page_url,title,description,delivery_method,instruction_type,what_will_learn,prerequisites,target_students,instructor|1|name,instructor_bio,review|1|reviewer_name,review|1|photo,review|1|review,review|2|reviewer_name,review|2|photo,review|2|review,review|3|reviewer_name,review|3|photo,review|3|review,review|4|reviewer_name,review|4|photo,review|4|review,languages,total_duration,total_duration_unit,content,short_description,accessibilities,live_class,job_assistance,capstone_project,average_salary
https://mindmajix.com/postgresql-training,PostgreSQL Training and Certification Course Online,"<div class=""Curriculum_description__1LwKr""><p><strong>Mindmajix PostgreSQL Training</strong> will enable you to gain in-depth knowledge on all the core fundamentals of PostgreSQL. You will gain hands-on skills and expertise to administer and performance tune PostgreSQL databases through hands-on projects, and this will enable you to become a certified PostgreSQL developer.</p></div>",Online,Instructor Paced,"|Install and setup PostgreSQL|Insert and manage data in a PostgreSQL database|Create databases and database structures|Define roles, their attributes and role memberships|Select the encryption method and set up security for the database|Upgrade the Postgres DB|SQL Dump, Perform Backup and Recovery and Restore|Migrate the Oracle DB to Postgres|Maintain, monitor and optimize the PostgreSQL database|","What are the prerequisites for the PostgreSQL course?




Basic knowledge of SQL and Database concepts is essential to learn PostgreSQL, and Knowledge of Linux environment is suggested but not mandatory.

",|Professionals getting started on PostgreSQL DBA projects|Anyone wishing to add PostgreSQL DBA skills to their profile|,Dhanraj,"Having 12+ years of experience working closely with industry, Dhanraj is one of the best-certified trainers of MindMajix. He has bagged PostgreSQL and can deliver the best technology to our trainees.",Lavanya,https://cdn.mindmajix.com/mern/images/instructor-male.svg,"Best place for PostgreSQL online training. The trainer was very knowledgeable, and was very helpful in solving all my queries. The explanations were concise and straight to the point. Overall, the course was well delivered. Thank you MindMajix.",James,https://cdn.mindmajix.com/mern/images/instructor-male.svg,Recently I had gone through my PostgreSQL Training at MindMajix. I felt very happy with training pattern they follow. The traineer was well expeienced and able to clear all my doubts. Thank you MindMajix for delivering such a wonderful training.,Judisti,https://cdn.mindmajix.com/mern/images/instructor-male.svg,"Best place to enhance our skils. Trainers are very experienced and cleared all my queries, throught the training. And after the completion of the course, they have given a good guidance for certification. Really thankful to MindMajix, for delivering such a good training and support.",NaN,NaN,NaN,English,25,Hours,"['Introduction to PostgreSQL', 'Installation', 'System Architecture']",Leverage the growing demand for Certified PostgreSQL Professionals,"Mobile,Desktop",TRUE,TRUE,TRUE,"₹5,935,280"
https://mindmajix.com/sql-server-dba-training,SQL Server DBA Training and Certification Course,"<div class=""Curriculum_description__1LwKr""><p>SQL Server DBA Training and certification course by Mindmajix is designed by industry experts to provide you with an in-depth understanding of database administration concepts. This instructor-led course allows you to gain proficiency in types of DBA’s, SQL Server 2019 installation, and configuration. We provide the best online training classes to help you master database architecture, SQL server authentication, database backups, backup devices, and performing the restoration. As a part of this course, you will work on two real-time projects to get practical knowledge of database administration. Enroll in our SQL Server DBA Online Training, and become a Certified SQL Server database administrator.</p></div>",Online,Instructor Paced,|Learn about Database architecture and perform DBA duties|Install all the necessary Oracle Softwares to run the database|Administer user accounts in the database|Manage Tablespaces to provide the space needed for the data|Perform backup and recovery when required|Diagnose the problems and work as Oracle Support|Configure the Listeners for communication|,"What are the prerequisites for the SQL Server DBA course?There aren't any specific prerequisites for learning this course. But, basic and working knowledge of:

Command-line program,
Relational database systems will be an added advantage

",|SQL developers |SQL administrators|Database Server professionals|People aspiring to start their careers as SQL Server DBAs.|,Uday,"Having 10+ years of experience working closely with industry, Uday is one of the best-certified trainers of MindMajix. He has bagged SQL Server DBA and can deliver the best technology to our trainees.",Mustaq Khan,http://cdn.mindmajix.com/reviewer/mustaq-khan-sql-server-dba-review-18092021.jpg,SQL Server DBA Training by mindmajix.com introduces people to the principles and process. SQL Server DBA Online Training with best subject experts.,Balaji G,http://cdn.mindmajix.com/reviewer/bala-g-sql-server-dba-review-18092021.jpg,The trainer of the mindmajix is top-rated and highly professional. This online course helped me to get a vast knowledge of SQL Server DBA. Excellent and Greate learning experience with Mindmajix.,Prabhu Palyam,https://cdn.mindmajix.com/mern/images/instructor-male.svg,"Mindmajix SQL Server DBA Online Training covered each topic with exciting lectures. The presentation of materials was excellent, making it easy to understand even for the beginners. Thanks to their expert trainers and 24*7 customer support. I recommend to the people who want to excel their career in the Database Administration
",Viney GARG,http://cdn.mindmajix.com/reviewer/viney-garg-sql-server-dba-review-18092021.jpg," 
Mindmajix is the most successful instructor-led online institute. I completed the SQL Server DBA course.  With well-curated Course course content, I had a great experience with the Mindmajix Training team, including their expert trainers and 24*7 support. Thanks to the entire Mindamajix Team.",English,25,Hours,"['Starting with SQL Server 2019', 'Installing and Configuring', 'Working with Databases']",Learn the Latest (DBA) Database Administration Skills from the Experts and Give a Fly to Your Career.,"Mobile,Desktop",TRUE,TRUE,TRUE,"₹ 7,938,437"
https://mindmajix.com/oracle-dba-training,Oracle DBA Training,"<div class=""Curriculum_description__1LwKr""><p>MindMajix’s Oracle DBA training is designed to grow your skills and ability to leverage all the Oracle DBA opportunities in the industry.  Our best in-field instructors offer practical guidance and real-world expertise needed to become a successful Oracle Database Administrator. From the fundamentals to advanced features, you'll explore everything you need to know about Oracle database versions 12c or 19c, including development, management, security, high availability, and data warehousing. Sign up for this online interactive Oracle DBA online course to sharpen your skills, increase your job security, and stand out at the workplace.</p></div>",Online,Instructor Paced,"|Core database concepts|SQL and PL/SQL concepts|Database Administrator Functionalities|Physical and logical structures of the database |Configuring and managing the Oracle Network|Database configuration and programming|Database best practices and scripts|Installation, harnessing cloud and storage management|","What are the prerequisites for the Oracle DBA course?Anybody interested in this domain can take this training course. Basic knowledge of database can be beneficial.
",|Software Developers|SQL Programmers and Architects|Database Analysts and Administrators|Project Managers|Individuals aspiring for an Oracle DBA career|,Ashwini,"Having 12+ years of experience working closely with industry, Ashwini is one of the best-certified trainers of MindMajix. She has bagged Oracle RAC DBA, Oracle DBA and can deliver the best technology to our trainees.",Ishan,https://cdn.mindmajix.com/mern/images/instructor-male.svg,"It was an amazing experience and learning from Mindmajix. The Whole thanks to Instructor, he was excellent. He had explained everything included in Oracle DBA, thanks to co-ordinators for supported me.",Jahnavi,https://cdn.mindmajix.com/mern/images/instructor-male.svg,I am really happy with the training I got from Mindmajix in Oracle DBA because of the trainer's very rich and powerful knowledge in the subject. I am able to grasp the concepts very easily because of the highly interactive and well presented sessions. I would highly recommend Mindmajix for online IT training,Prashant Singh,https://cdn.mindmajix.com/mern/images/instructor-male.svg,I took Oracle DBA training from MindMajix. It was very helpful to clear the certification exam. The instructor was very clear with good examples. Thanks MindMajix,Snigdha,https://cdn.mindmajix.com/mern/images/instructor-male.svg,"Learning Oracle DBA at Mindmajix has improved my skills and i am now able to crack the certification. Trainer was superb, Thanks Mindmajix for the wonderful experience.",English,50,Hours,"['Introduction of Oracle Database Administrator', 'Basics of Multi Container Database and Pluggable Databases', 'Creating a Multi Container Database and Pluggable Databases', 'Managing Multi Container Databases and Pluggable Databases', 'Managing Tablespaces and Users in CDB and PDBs', 'Backup, Recovery, Flashback CDB and PDBs', 'Heat Map, Automatic Data Optimization and Online Datafile Move', 'Auditing', 'Privileges', 'Oracle Data Pump, SQL*Loader, and External Tables', 'Recovery Manager New Features', 'Practice Test & Interview Questions']",Learn Oracle Database Administrator (12c or 19c) Core Skills - Become a Successful Oracle DBA.,"Mobile,Desktop",TRUE,TRUE,TRUE,"₹ 816,101"
