page_url,title,description,delivery_method,instruction_type,what_will_learn,prerequisites,target_students,instructor|1|name,instructor_bio,review|1|reviewer_name,review|1|photo,review|1|review,review|2|reviewer_name,review|2|photo,review|2|review,review|3|reviewer_name,review|3|photo,review|3|review,review|4|reviewer_name,review|4|photo,review|4|review,languages,total_duration,total_duration_unit,short_description,accessibilities,live_class,job_assistance,capstone_project,average_salary
https://mindmajix.com/fuse-esb-training,Fuse ESB Training,"<div class=""Curriculum_description__1LwKr""><p>Mindmajix Fuse ESB training is designed for the developers to get maximum advantage of Integration capability offered by Fuse ESB by offering hands-on practical training. The curriculum covers clear understanding of Maven, XML Configuration, Fuse Fabric etc.</p></div>",Online,Instructor Paced,|Lead Developer|JBoss Fuse Developer|And the Aspirant who want to build their career in this field|,"Why should you learn this Fuse ESB training?





Enterprises have to upgrade and enhance their application services, and so there is a need for skilled Fuse ESB developers. The average salary for a skilled Fuse ESB developer is $125775 per annum.

",NaN,Suriya,"With 5+ years of experience in training and nine years of working experience, Suriya is a certified professional, has trained more than 90+ students and delivered seven corporate firms with live online sessions worldwide.
",Rishabh Goel,https://cdn.mindmajix.com/reviewer/rishabh-goel-fuse-esb-review-29092021.jpg,"Mindmajix really sets a high bar for sound and image quality as well. Not only Fuse ESB, they are delivering high quality online training for many other IT courses as well. The trainers are informative and rehearsed, but also relaxed. I really trust that these people are experts.",Saikumar juluru,https://cdn.mindmajix.com/mern/images/instructor-male.svg,"I got trained in Fuse ESB it was great experience and the  Faculty at Mindmajix is also well experienced. The trainer has got a lot of patience to resolve every participant's queries. That's really appreciated.
",sudipta adhikari ,https://cdn.mindmajix.com/mern/images/instructor-male.svg,"I got trained Fuse ESB from mindmajix the trainers has an exceptional Knowledge and clears our doubts instantly. Cheers to Mindmajix for having such wonderful trainers. and kudos the support team for helping me every time, I will recommend mindmajix to learn Fuse ESB
",NaN,NaN,NaN,English,25,Hours,Leverage the growing demand for Certified Fuse ESB Professionals,"Mobile,Desktop",TRUE,TRUE,TRUE,"₹7,537,435"
https://mindmajix.com/wso2-esb-training,WSO2 ESB Training,"<div class=""Curriculum_description__1LwKr""><p>This WSO2 ESB course from Mindmajix trains the students with features of the WSO2 as well as the underlying concepts and standards. The course covers both fundamentals and advanced topics of WSO2 with practical examples. When you’re done with this online training, you’ll have a better understanding of WSO2 ESB  and be more prepared for the WSO2 certifications.</p></div>",Online,Instructor Paced,"||WSO2 Enterprise Integrator is a highly popular opensource integration platform used by large enterprises globally to integrate on-premise as well as cloud systems|||Many top companies are employing WSO2 ESB professionals in various roles with high payouts|||WSO2 ESB professionals are earning high salaries with an average of $69k per annum, according to SimplyHiredcom||","What are the Prerequisites for WSO2 ESB Course?Participants are expected to have essential Java programming experience to have a conceptual understanding of SOA and message-oriented middleware, mainly web services and related standards (WSDL, SOAP, XML).
",||IT Architects/Developers|||SOA Architects|||IT professionals having experience in systems integration|||Administrators who are interested in the maintenance and support of WSO2 EI production systems.||,Mandeep,"Mandeep has got 5+ years of industrial experience working for global MNCs. He chose to deliver online training and contribute informative articles and blogs to various websites to share his technical expertise.
",Abhilash Menon,https://cdn.mindmajix.com/mern/images/instructor-male.svg,"Took the training for WSO2 ESB. Extremely satisfied with the training. Your commitment was very much appreciable. The way of communication was also excellent so that we did not face any major problems in any of the Sessions.
",sudipta adhikari ,https://cdn.mindmajix.com/mern/images/instructor-male.svg,"




A very good place to learn new technologies. I have Completed WSO2 ESB training here and it helped me a lot at my workplace. They teach everything from basics. All thanks to Mindmajix

",Adinarayana Gunnam,https://cdn.mindmajix.com/reviewer/adinarayana-gunnam-review-17102021.jpg,Better than classroom training. All technical issues are answered by the Mindmajix support team very quickly and the WSO2 ESB trainer is highly skilled. Overall best investment and value for money. Good institute for WSO2 ESB training. ,NaN,NaN,NaN,English,20,Hours,Leverage the growing demand for Certified WSO2 ESB Professionals,"Mobile,Desktop",TRUE,TRUE,TRUE,"₹9,623,760"
https://mindmajix.com/apache-camel-training,Apache Camel Training,"<div class=""Curriculum_description__1LwKr""><p>This Apache Camel Training covers every aspect of Apache Camel, from installing to configuring endpoints and multi-threaded integration flows. Participants will also learn the testing and deployment aspects of the framework with the best practices. The course is designed especially for developers and architects who want to build integration solutions using EIPs (Enterprise Integration Patterns) through Apache Camel. To know more about implementing EI Architecture Patterns with Active MQ, Kafka, and more, Enrol for the Apache Camel course.</p></div>",Online,Instructor Paced,|Camel and its applications| Filtering out unwanted Messages| Transforming using a Simple Expression| Splitting XML Messages| Using Camel in Java Application| Converting from Java to JSON| Monitoring and Debugging|,"What are the prerequisites for the Apache Camel course?




Basic concepts of Java and usage of eclipse tool is required for this training.

",|Web Developers|Architects|Graduates willing to make a career in Apache Camel|,Sawan,"With 6+ years of experience in training and nine years of working experience, Sawan is a certified professional, has trained more than 150+ students and delivered seven corporate firms with live online sessions worldwide.",Ramesh,https://cdn.mindmajix.com/mern/images/instructor-male.svg,I have enrolled for Apache Camel Certification in mindmajix. The trainer is good and has shared a lot of examples to cover all the points in the curriculum. He had a lot of patience and was able to help us where ever required. Big thanks to Mindmajix!!,Pavani,https://cdn.mindmajix.com/mern/images/instructor-male.svg,The course plan was simple and easy to understand as well trainer's support is appreciable. Overall it was very good with Mindmajix. I would recommend it strongly for professional enhancement.,Padraic,https://cdn.mindmajix.com/mern/images/instructor-male.svg,"Mindmajix's Instructors are really very good, their customer support and teaching staff support is excellent. I have completed Apache Camel training from Mindmajix and planning for some other courses as well. Go for it. Thank you team and keep growing!",NaN,NaN,NaN,English,20,Hours,Leverage the growing demand for Certified Apache Camel Professionals,"Mobile,Desktop",TRUE,TRUE,TRUE,"₹5,433,897"
https://mindmajix.com/ibm-cast-iron-training,IBM Cast Iron Training,"<div class=""Curriculum_description__1LwKr""><p>Become job-ready by mastering the fundamental concepts of IBM Cast Iron through real-world examples. You will learn how to configure and manage the appliance, create users, troubleshoot, back up the repository, etc., through hands-on projects, and this will help you in clearing the IBM Cast Iron Certification Exam.</p></div>",Online,Instructor Paced,NaN,"Who should take the IBM Cast Iron Training?IBM WebSphere Cast Iron training is designed for Business Analysts, System Engineers, and Application Integrators for developing integration solutions.
",NaN,Virat sharma,"Passion towards teaching made Virat sharma share the industrial experience he has got for further generations. He has got a total of three years into the real-time industrial background and has trained over 220+ students.
",Satish Volety,https://cdn.mindmajix.com/mern/images/instructor-male.svg,"IBM Cast Iron Training coach has great command on the subjects. Takes measures to ensure everybody is understanding the indispensable concepts. Course substance is great and learner well dispose. Thanks Mindmajix!
",Ravi zende,https://cdn.mindmajix.com/mern/images/instructor-male.svg,"My experience with IBM Cast Iron online training and with this project was positive as well as rewarding. There were a lot of valuable information provided me here. Thank you Mindmajix!
",Danny jospeph,https://cdn.mindmajix.com/mern/images/instructor-male.svg,"This course is amazing. I have gained a lot of information and skills in this course. Thank you for providing such a nice course.it was awesome experience to get trained from you now i feel confident about my career Thanks to IBM Cast Iron trainers and Mindmajix.
",Hassan,https://cdn.mindmajix.com/mern/images/instructor-male.svg,The Trainer was a master of all the concepts in IBM Cast Iron training. Great to learn at Mindmajix. Thank you.,English,20,Hours,Leverage the growing demand for Certified IBM Cast Iron Professionals,"Mobile,Desktop",TRUE,TRUE,TRUE,"₹13,201,398"
https://mindmajix.com/apache-nifi-training,Apache Nifi Training and Certification Course Online,"<div class=""Curriculum_description__1LwKr""><p><span style=""font-weight: 400;"">This Apache Nifi course delivers the foundational training you need to succeed with Nifi. </span><span style=""font-weight: 400;"">You’ll gain hands-on experience in building, deploying, and managing Apache Nifi Dataflows, along with gaining mastery in Nifi’s key features and concepts.  Through the problem-solving exercises, you'll construct the critical thinking skills that are the basis for Apache Nifi. And, by the end of this online certification course, you’ll be a skilled Apache Nifi professional, well-practiced at everything from managing real-time data pipelines to automating the movement of data between disparate systems.</span></p></div>",Online,Instructor Paced,NaN,"Is there any prerequisite to take this Apache Nifi Training Course?Some prior experience of ETL is assumed, but you’re in good shape to start this course if you can understand the basic concepts of Big data and the Linux command line.",NaN,Sukumar,"Having 7+ years of experience working closely with industry, Sukumar is one of the best-certified trainers of MindMajix. He has bagged Apche Nifi, Java, Spring Boot Microservices, Apache Kafka, Elasticseach, ELK Stack and can deliver the best technology to our trainees.
",Kalyan babu,https://cdn.mindmajix.com/mern/images/instructor-male.svg,It’s a very useful website to learn Apache Nifi Training Course. The course content and projects they provide are helpful for both beginners and experienced learners.,Pooja bhargav,https://cdn.mindmajix.com/mern/images/instructor-male.svg,The explanation is superb. I recommend this Apache Nifi Training to every self-taught learner serious about getting a job in giant tech companies.,Balakrishna G,https://cdn.mindmajix.com/mern/images/instructor-male.svg,I was looking for a better resource to learn Apache Nifi and I came to know about Mindmajix through Ads. I browsed through the site and immediately enrolled for the training. The way they convey complex topics within a short period of time is really amazing and I find it very beneficial for me.,Vishal kulkarni,https://cdn.mindmajix.com/mern/images/instructor-male.svg,"




Apache Nifi material was very detailed and oriented towards equipping me with practical skills rather than bookish knowledge. All thanks to Mindmajix!

",English,30,Hours,Leverage the growing demand for Certified Apache Nifi Professionals,"Mobile,Desktop",TRUE,TRUE,TRUE,"₹6,782,319"
https://mindmajix.com/biztalk-server-administrator-training,BizTalk Server Administrator Training,"<div class=""Curriculum_description__1LwKr""><p>Become an expert in Creating a Domain User Account for BizTalk Server Administrator, Understanding BizTalk Server and the BizTalk Server Application also get certified.</p></div>",Online,Instructor Paced,NaN,"What are the prerequisites for the BizTalk Server Administrator course?




No, prior BizTalk Server experience is required for learning this course. This course requires hands-on experience in managing a Windows-based network environment.

",|Systems Administrators|Systems Engineers|,Roopesh,"Roopesh has got 5+ of years of industrial experience working for global MNCs. He chose to deliver online training and contribute informative articles and blogs to various websites to share his technical expertise.",Harathi,https://cdn.mindmajix.com/mern/images/instructor-male.svg,Mindmajix is a great learning organization with their good collection of online courses. I have attended BizTalk Server Administrator training courses so far and found the trainers extremely accommodating and going the extra mile to clarify any questions that the participant may have. Their timings are suitable for working staff. I would definitely recommend Mindmajix.,Thomas,https://cdn.mindmajix.com/mern/images/instructor-male.svg,"I took online BizTalk Server Administrator training from the Mindmajix. As of my experience, the training was really excellent. I would like to thank the faculty team for providing such training with a commitment that is appreciable. Looking forward to getting support and help when required.",Sandy GVS,https://cdn.mindmajix.com/mern/images/instructor-male.svg,"I had a good experience learning with Mindmajix. I have completed BizTalk Server Administrator training from Mindmajix. Just try to reach out them by raising the quires that you are having, and there all your problem will be resolved. The entire team displays an extremely high level of professionalism. I would even refer my friends to take the training from Mindmajix.",NaN,NaN,NaN,English,25,Hours,Leverage the growing demand for Certified BizTalk Server Administrator Professionals,"Mobile,Desktop",TRUE,TRUE,TRUE,"₹5,876,521"
https://mindmajix.com/ibm-websphere-mq-training,IBM WebSphere Message Queue Training,"<div class=""Curriculum_description__1LwKr""><p>Mindmajix offers the best IBM WebSphere Message Queue training with top-rated trainers in the IT industry. Our training will help you master all the essentials of the IBM WebSphere Message Queue right from basic to expert level through real-time examples. You’ll gain expertise in administering IBM MQ queue managers on the distributed operating systems through industry use cases. Upon completion, these skills will help you in clearing the IBM WebSphere Message Queue certification exam.</p></div>",Online,Instructor Paced,|IBM WMQ Overview|Point-To-Point Communication|Triggering|Configuration|Types Of Logs|Logging Mechanisms|Dead Letter Queue & Handler Usage|MQ Security|Clustering|MultiHopping On Distributed Systems|,"What are the prerequisites for the IBM WMQ course?




Knowledge in any of the below-mentioned areas is required to learn IBM WMQ:

Communications and networking
System design
System and network management
Transaction processing
Client/server solutions
Open systems
Application development
Database
Platform knowledge (IBM and non-IBM)


",|Websphere Administrators|Application Integrators|Business Analysts|,Rajesh,"With 9+ years of experience in training and nine years of working experience, Rajesh is a certified professional, has trained more than 200+ students and delivered seven corporate firms with live online sessions worldwide.",Anindya banerjee,https://cdn.mindmajix.com/reviewer/anindya-banerjee-review-17102021.jpg,"When I was searching for the best online training to learn IBM WebSphere Message Queue I had found Mindmajix name come out from the most, I been enquired for. Then after I joined there. Start learning the course, where I felt difficult in so many scenarios but the support and care, they`ve taken is abnormal, outstanding.",vedhanathan M,https://cdn.mindmajix.com/mern/images/instructor-male.svg,"Thank You for the sessions that helped me gaining knowledge in IBM WebSphere Message Queue. Trainers experience helped me to get detailed information regarding the key concepts and challenging tasks in real time. Thanks again.
",Ravi zende,https://cdn.mindmajix.com/reviewer/ravi-zende-websphere-mq-review-29092021.jpg,"I had taken IBM WebSphere MQ Training Program from MindMajix, thoroughly enjoyed the course! Pretty good course content and constant support from Mindmajix Team.",NaN,NaN,NaN,English,25,Hours,Leverage the growing demand for Certified IBM WebSphere Message Queue Professionals,"Mobile,Desktop",TRUE,TRUE,TRUE,"₹6,994,357"
https://mindmajix.com/biztalk-server-training,BizTalk Server Training,"<div class=""Curriculum_description__1LwKr""><p>Mindmajix BizTalk Server training is curated by industry-experts as per the latest advancements and demands of the IT industry. The course starts with the configuration of a message architecture and dives into developing BizTalk artifacts, debugging and exception handling, integrate web services, deploy, and administer a BizTalk solution, etc., with real-time examples and projects.</p></div>",Online,Instructor Paced,"|How to automate business processes|The fundamentals of BizTalk messaging|The advanced features of BizTalk like WCF adapters, deployment, and error handling|Work with ESB toolkit based on real-world scenarios|How to use the exception framework built into ESB|","What are the prerequisites for the Biztalk Server course?There are no specific prerequisites required for learning this course.
But, basic knowledge of, 

Administration tools,
C#,
VB.NET,
SQL Server databases is needed, and 
Working experience on web services and XML will be an additional advantage.

","|.Net Professionals,|SQL Professionals,|Web designers, |Business analysts, |Software designers,|Framework evaluators.|",Ranvir,"Ranvir has got 7+ of years of industrial experience working for global MNCs. He chose to deliver online training and contribute informative articles and blogs to various websites to share his technical expertise.
",Amy,https://cdn.mindmajix.com/mern/images/instructor-male.svg,"As a beginner, I found the course curriculum and explanation well defined. It is simple and easy to learn new and complex technologies. simple but powerful and BizTalk Server. Great way to start learning..wish to see next courses from MindMajix. ",Meghana Nath,https://cdn.mindmajix.com/mern/images/instructor-male.svg,BizTalk Server online training course hits the bull’s eye. The Trainer was a master of all concepts and implementation. Great to learn at Mindmajix.,NaN,NaN,NaN,NaN,NaN,NaN,English,25,Hours,Enroll now for BizTalk Server Training and Get Expertise in Microsoft BizTalk Server Documentation ,"Mobile,Desktop",TRUE,TRUE,TRUE,"₹6,015,555"
https://mindmajix.com/ibm-datapower-training,IBM DataPower Training,"<div class=""Curriculum_description__1LwKr""><p>IBM DataPower Training from Mindmajix teaches you the essential skills needed to implement, configure, and troubleshoot services on the IBM DataPower Gateways. From initial installation and setup to advanced concepts like upgrading firmware, managing backup and restore operations, etc., you’ll learn everything through hands-on exercises and practical examples. Get started with this training to improve your chances of being hired as an IBM DataPower professional.</p></div>",Online,Instructor Paced,"|Get an overview of IBM WebSphere DataPower SOA appliances|Create XSLT Stylesheet|Use XML firewalls for content-based routing|Create a web application firewall service|Create cryptographic objects|Configure a multi-protocol gateway service|Create a Web Application firewall service|Configure Secure Sockets Layer (SSL) on DataPower services|Control message traffic using service level monitoring policy|Get an overview of Authorization, Auditing, and Authentication|Create, configure, and administer the Objects using DataPower|","What are the prerequisites for the IBM DataPower course?The prerequisites for learning IBM DataPower are listed below:

The candidate should be familiar with security-based concepts and networking protocols.
The candidate should have functional knowledge of XML-related technologies such as XPath, XSLT, and XML Schema.
The candidate should have basic knowledge of JavaScript programming, REST basics, and Web services.

",|System Administrators|Integration developers|Networking professionals|Professionals who want to extend their skill set with advanced technologies.|,Shiva,"Shiva has got 8+ of years of industrial experience working for global MNCs. He chose to deliver online training and contribute informative articles and blogs to various websites to share his technical expertise.",Kumar,https://cdn.mindmajix.com/mern/images/instructor-male.svg,"I had taken IBM DataPower Training from Mindmajix, thoroughly enjoyed the course! Pretty good course content and constant support from Mindmajix Team.",Shruthi,https://cdn.mindmajix.com/mern/images/instructor-male.svg,I have received training in IBM DataPower from Mindmajix and everything worked out well for me. Great trainer and training material and a really good project. I have got valuable knowledge here in IBM DataPower and gave me a lot of confidence.,Shraddha,https://cdn.mindmajix.com/mern/images/instructor-male.svg,"I\'ll take an opportunity to thank Mindmajix Team for great learning experience. Trainers was Excellent, he covered each every topic in IBM Datapower with real time examples.",NaN,NaN,NaN,English,25,Hours,Leverage the growing demand for Certified IBM DataPower Professionals,"Mobile,Desktop",TRUE,TRUE,TRUE,"₹7,258,699"
https://mindmajix.com/ibm-integration-bus-training,IBM Integration Bus Training,"<div class=""Curriculum_description__1LwKr""><p>Mindmajix IBM Integration Bus training gives a solid foundation on how to create, develop, and deploy message flow applications using IBM Integration Bus. You will also develop skill sets on various messaging topologies and processing nodes in transforming data using various real-time use cases during training. This will enable you to become a successful IBM Integration Bus developer.</p></div>",Online,Instructor Paced,"|Get an overview of the IBM Integration Bus features and its uses|Design, develop, deploy, support, and test the message flow applications|Explore predefined patterns for generating the message flow applications|Diagnose and solve development and runtime errors using IBM Integration Bus problem determination|Understand the function and appropriate use of IBM Integration Bus processing nodes|Transform data using IBM Graphical Data Mapping editor|Learn about supported transport protocols, and understand how to use them in message flows|","What are the prerequisites for the IBM Integration Bus course?The prerequisites for learning IBM Integration Bus are listed below:

The participant should have a basic understanding of Structured Query Language (SQL), Java, and XML Path Language (XPath).
The participant should have a basic knowledge of transport protocols such as FTP and HTTP.

",|Integration specialists|Application developers|Java Developers|Database professionals|Professionals who want to extend their skill set with advanced technologies.|,David,"Passion towards teaching made David share the industrial experience he has got for further generations. He has got a total of three years into the real-time industrial background and has trained over 320+ students.",Rohit,https://cdn.mindmajix.com/mern/images/instructor-male.svg,Instructor explains every Integration Bus concept with real use cases and all queries are answered during the class. Support team is always active to help us any point of time to resolve the queries.,Deepthi,https://cdn.mindmajix.com/mern/images/instructor-male.svg,I am glad that I decided to choose Mindmajix for the IBM course. Wonderful learning experience and I like the way classes are organized.,Sainath,https://media.licdn.com/dms/image/C5603AQEXpuJfWwCHNQ/profile-displayphoto-shrink_200_200/0?e=1576108800&v=beta&t=9NhnPuNVYFF-T6Xc33V3Ph4dLrmykiVaB_ZR45ZH0Io,I have completed IBM Integration Bus Training at Mindmajix. Structured courses which cover the baiscs very well in time to set you for exploring the subject matter further. ,Prem,https://cdn.mindmajix.com/mern/images/instructor-male.svg,"I am sharing my learning experience with MindMajix. completed IBM Integration Bus training, Trainer gave his best and explained very well had good patience while clearing doubts. Glad to be part of MindMajix.",English,30,Hours,Leverage the growing demand for Certified IBM Integration Bus Professionals,"Mobile,Desktop",TRUE,TRUE,TRUE,"₹5,389,828"
