page_url,title,description,delivery_method,instruction_type,what_will_learn,prerequisites,target_students,instructor|1|name,instructor_bio,review|1|reviewer_name,review|1|photo,review|1|review,review|2|reviewer_name,review|2|photo,review|2|review,review|3|reviewer_name,review|3|photo,review|3|review,review|4|reviewer_name,review|4|photo,review|4|review,languages,total_duration,total_duration_unit,content,short_description,accessibilities,live_class,job_assistance,capstone_project,average_salary
https://mindmajix.com/ptc-windchill-admin-training,PTC Windchill Admin Training,"<div class=""Curriculum_description__1LwKr""><p>Learn how to perform Windchill administration tasks using real-time examples with our hands-on training sessions. You will gain in-depth knowledge on how to plan and create groups, users, and information management storage strategies. You will also understand workflows, domain configuration policies, lifecycles, etc., and these skills will advance your career to become a certified Windchill Administrator. Enroll now and get certified.</p></div>",Online,Instructor Paced,NaN,"Who should take this course?




The PTC Windchill admin training is designed for the following professional:


Windchill PLM Analyst
Windchill Developers
Windchill Techno-Functional Consultant
Windchill end users
Windchill Business or System administrators
Windchill Process Consultant
Aspirants who want to start a career in PTC Windchill


",|Basic understanding of process management deliverables and processes|Basic web navigation skills|,Shakir,"With 15+ years of experience in training and nine years of working experience, Shakir is a certified professional, has trained more than 450 students and delivered seven corporate firms with live online sessions worldwide.
",Sampath Betha,https://cdn.mindmajix.com/mern/images/instructor-male.svg,"Recently I completed PTC Windchill Admin Training from Mindmajix. I am very happy with the training process. The instructor, as well as the support from the mindmajix team was excellent. The instructor covered all the important topics such as Windchill PDMLink change process & terminology, workflow administration, windchill configuration & customization and many more. I want to Thank mindmajix for the great support throughout the training period.
",Samarth Khandelwal Samart,https://cdn.mindmajix.com/mern/images/instructor-male.svg,"I thoroughly enjoyed the course. All concepts were covered timely with a detail explanation. The trainer has sound knowledge of the PTC Windchill Admin course. The support team was so helpful with instant updates. The interview preparation program designed by mindmajix gave me immense knowledge and I got full confidence to crack the interview. I am fully satisfied with the PTC Windchill Admin training, thanks to mindmajix for helping me to complete the training.
",Manya,https://cdn.mindmajix.com/mern/images/instructor-male.svg,"I took PTC  Windchill Admin Training from Mindmajix, and my experience was really good. The trainer has a good technical and subject grip. I had some misconception about online classes, but I cleared it all with the quality live sessions of Mindmajix. They covered all topics with detailed practical examples. They have given me recording sessions of the whole training that would be very helpful for rewinding some essential concepts. I would recommend mindmajix for anyone who is looking for PTC Windchill Admin training.
",NaN,NaN,NaN,English,20,Hours,"['Basic - Session 1', 'Basic - Session 2', 'Business admin Configuration-Business Object Configuration- Session 3']",Leverage the growing demand for Certified PTC Windchill Admin Professionals,"Mobile,Desktop",TRUE,TRUE,TRUE,"₹6,825,572"
https://mindmajix.com/ptc-windchill-training,PTC Windchill Training and Certification Course Online,"<div class=""Curriculum_description__1LwKr""><p>In this PTC Windchill Course, you’ll gain the foundational knowledge needed to perform functions to create and manage product information with Windchill. You’ll learn how to access and navigate the Windchill environment, manage product structures, and more. Our training builds in-demand skills you need to create products of the highest quality. Mastering these skills will help you to earn PTC Windchill certification easily. </p></div>",Online,Instructor Paced,"|Know the terminology and Windchill PDMLink configuration|Analyze Windchill architecture and coding|Create and customize layouts|Manage change request and change notice|Deploy tasks like content replication, file vaulting|Debug the services of windchill|Set windchill peripherals and work-flows for performance|Learning proposals for access control|	 |","What are the prerequisites for the PTC Windchill course?
The participant should have a basic understanding of web navigation.
The participant should have a basic understanding of Project management processes & deliverables.

",NaN,NaN,NaN,Abhay Thorat,https://media.licdn.com/dms/image/C5103AQEq9O5GcCQcfg/profile-displayphoto-shrink_200_200/0?e=1576108800&v=beta&t=YJge7q840fyeehuV4JLUXSBxTi74BQXsTKcshODhu7g,"The PTC Windchill course at Mindmajix is top-notch and thorough. The materials are valuable tools and the online support team covered all the bases.
",Vikram,https://media.licdn.com/dms/image/C4D03AQGsXKaOHwXaMw/profile-displayphoto-shrink_200_200/0?e=1576108800&v=beta&t=NTz_nnfkbCe6L0TFV-eKmMvVBmPb4X5h3G1RSRv60VE,"This was my first online training. I am very satisfied with the PTC Windchill training methodologies, and gained valuable knowledge on the entire course. Thank You Mindmajix!
",Kalyan Dwara,https://cdn.mindmajix.com/mern/images/instructor-male.svg,"




The PTC Windchill Certification Training program was a great experience. Had the best training experience, I would recommend Mindmajix for the PTC Windchill course.

",NaN,NaN,NaN,English,40,Hours,"['Basic - Session 1', 'Basic - Session 2', 'Business admin Configuration - Business Object Configuration - Session 3', 'Business admin Configuration - Business Object Configuration - Session 4', 'Business admin Configuration - Business Object Configuration - Session 5', 'Business admin Configuration - Business Object Configuration - Session 6', 'Business admin Configuration - Business logic customization - Session 7', 'Windchill Database Technology and Development /Deployment Environment Setup - Session 8', 'Advanced Development - Server side Customization - Session 9', 'Advanced Development - Server side Customization - Session 10', 'Advanced Development - UI Customization -Session 11', 'Advanced Development - UI Customization - Session 12']",Enroll now for PTC Windchill Training and Get Expertise in Product Lifecycle Management Software,"Mobile,Desktop",TRUE,TRUE,TRUE,"₹7,960,768"
