page_url,title,description,delivery_method,instruction_type,what_will_learn,prerequisites,target_students,instructor|1|name,instructor_bio,review|1|reviewer_name,review|1|photo,review|1|review,review|2|reviewer_name,review|2|photo,review|2|review,review|3|reviewer_name,review|3|photo,review|3|review,review|4|reviewer_name,review|4|photo,review|4|review,languages,total_duration,total_duration_unit,short_description,accessibilities,live_class,job_assistance,capstone_project,average_salary
https://mindmajix.com/blue-coat-training,Blue Coat Training,"<div class=""Curriculum_description__1LwKr""><p>Mindmajix offers the best Blue Coat training with industry experts who have deep domain expertise. It will enable you to master all the fundamentals of Blue Coat from scratch to advanced level techniques with real-time examples and also provides hands-on exposure to industry use cases and projects. Enroll now and get certified.</p></div>",Online,Instructor Paced,|Blue Coat PacketShaper architecture|Advanced Classification|Traffic Tree Management|URL Categorization|Understanding Adaptive Response|Network Management and Monitoring|Advanced Bandwidth Management|PacketShaper Reporting Tools|Overview of Intelligence Center|Summary of the Policy Center|,"What are the prerequisites for the Blue Coat course?Experience in the following aspects is required to take up this training:

Working with ProxySG administration.
Networking, security, and authentication concepts

",|Network Professionals|Security Professionals|IT Professionals|End Users|,NaN,NaN,Gloria,https://cdn.mindmajix.com/mern/images/instructor-male.svg,The BlueCoat course at mindmajix was very good. The Trainers are well experienced had a good hands on knowledge about the subject. They answer all the questions asked and sort out the doubts. The support team is also very active . In case of any issue they solve it as soon as possible.,Jayson,https://cdn.mindmajix.com/mern/images/instructor-male.svg,Best training sourse to gain good knowledge in  BlueCoat technology.,Laurie,https://cdn.mindmajix.com/mern/images/instructor-male.svg,"It was a very good experience to learn BlueCoat from mindmajix. Faculty member is very knowledgeable and cooperative,he focused upon practical rather than theory.all together it was an enlightening and informative course.",Benjamin,https://cdn.mindmajix.com/mern/images/instructor-male.svg,"This is a great course , basics of BlueCat  are dealt very well.explanation is so go.",English,10,Hours,Leverage the growing demand for Certified Blue Coat Professionals,"Mobile,Desktop",TRUE,TRUE,TRUE,"₹6,770,819"
https://mindmajix.com/fortigate-i-training,FortiGate I Training,"<div class=""Curriculum_description__1LwKr""><p>Experience the Realtime implementation of FortiGate I projects by exploring different features of Firewall Policies, Explicit Proxy, Authentication, Antivirus, Webfilter, Logging &amp; Monitoring. etc</p></div>",Online,Instructor Paced,NaN,NaN,NaN,NaN,NaN,Roberta,https://cdn.mindmajix.com/mern/images/instructor-male.svg,I am very much gratified and learnt a lot from this FortiGate I online training. Trainer was very good explained nicely. Thanks to Mindmajix for such type of quality training.,Victoria,https://cdn.mindmajix.com/mern/images/instructor-male.svg,This course is very good.updated content and I am very much satisfied and would surely suggest to all who are searching for FortiGate I Training course.,Leslie,https://cdn.mindmajix.com/mern/images/instructor-male.svg,I am very satisfied with FortiGate I Training online training. Thank to each member involved in it. Videos are good in quality.,Mubash Khan,https://cdn.mindmajix.com/reviewer/mubash-khan-fortigate-i-review-28092021.jpg," 
I had taken FortiGate I Online Training from Mindmajix. It’s a great experience and I’m happy for what I have learned. The trainer has a strong command over the subject and made sessions interesting. Thanks for the entire Mindmajix team.",English,30,Hours,,"Mobile,Desktop",TRUE,TRUE,TRUE,"₹5,624,865"
https://mindmajix.com/fortigate-ii-training,FortiGate II Training,"<div class=""Curriculum_description__1LwKr""><p>Mindmajix FortiGate II Training makes you an expert in building the applications by leveraging capabilities of Transparent Mode, Data Leakage Prevention, Hardware Acceleration, Certificate Operations, Virtual Domains, Routing., etc. You will also get an exposure to industry based Real-time projects in various verticals.</p></div>",Online,Instructor Paced,NaN,NaN,NaN,NaN,NaN,Bertram,https://cdn.mindmajix.com/mern/images/instructor-male.svg,I have an awesome experience in taking the FortiGate II Training online from mindmajix. Thanks to Mindmajix team.,Jerald,https://cdn.mindmajix.com/mern/images/instructor-male.svg,The substance of this course is very fascinating to learn and I am sufficiently fortunate to pick this course with Mindmajix. I cherish it companions. You ought to likewise attempt this one.,Saiprasad Shettar,https://cdn.mindmajix.com/reviewer/saiprasad-shettar-fortigate-ii-review-29092021.jpg," 
The FortiGate II Training was conducted by Mindmajix. It was a wonderful experience with Mindmajix. The trainers were hands on and provided real time scenario's. I would like to recommend Mindmajix to learn FortiGate.",Manikandan Saibaba,https://cdn.mindmajix.com/reviewer/manikandan-saibaba-fortigate-ii-review-28092021.jpg," 
The FortiGate II certification course from Mindmajix is outstanding. The trainer is highly experienced and shared his knowledge with real-time examples. My learning experience with Mindmajix is excellent.",English,30,Hours,,"Mobile,Desktop",TRUE,TRUE,TRUE,"₹6,583,487"
https://mindmajix.com/fortigate-iii-training,FortiGate III Training,"<div class=""Curriculum_description__1LwKr""><p>MindMajix FortiGate III Training: Experience the real-time implementation of FortiGate III Troubleshooting Concepts, Firewall Authentication, Explicit Web Proxy, Network Troubleshooting, explore how to configure BGP and OSPF, System Resources, FSSO., etc. Enroll &amp; Become Certified!</p></div>",Online,Instructor Paced,NaN,NaN,NaN,NaN,NaN,Jerald,https://cdn.mindmajix.com/mern/images/instructor-male.svg,It is truly a heap of knowledge.very pleasant clarification. It enhances the shortcoming of learner and make them certain about what they are gaining. Thanks to Mindmajix.,Robin,https://cdn.mindmajix.com/mern/images/instructor-male.svg,This instructional exercise is extremely useful and decent as it covers all substance pertinent to course in legitimate manner. I adore this course. It made me especially sure on FortiGate III,Lillian,https://cdn.mindmajix.com/mern/images/instructor-male.svg,"Friendly training faculty good quality in videos and his teaching skills too appreciable observed one thing with in trainer, his teaching speed is depends on my understand point.",Saiprasad Shettar,https://cdn.mindmajix.com/reviewer/saiprasad-shettar-fortigate-iii-review-29092021.jpg," 
I completed my FortiGate III Training in MindMajix. Sessions are very interesting and the course content is well structured with real-time scenarios. Special thanks to the trainer and support team for resolving the queries.",English,30,Hours,,"Mobile,Desktop",TRUE,TRUE,TRUE,"₹5,624,865"
https://mindmajix.com/palo-alto-networks-essentials-i-training,Palo Alto Networks Essentials I Training,"<div class=""Curriculum_description__1LwKr""><p>Mindmajix Palo Alto Networks Essentials I Training course will make you learn how to install, configure, and manage the Palo Alto Networks firewalls. You will gain in-depth knowledge on the configuration steps for the security, networking, threat prevention, logging, and reporting features of the Palo Alto Networks Operation System (PAN-OS).</p></div>",Online,Instructor Paced,NaN,NaN,NaN,NaN,NaN,Sarah John,https://cdn.mindmajix.com/mern/images/instructor-male.svg,Perfect sessions to know all the key concepts of PALO ALTO NETWORKS: Essentials I Training. All credits to the trainers who took special care in presenting them in practically. Thanks to the support team as well.,Kiran,https://cdn.mindmajix.com/reviewer/kiran-patil-palo-alto-networks-essentials-i-review-28092021.jpg,"The most practical and easy way to learn PALO ALTO NETWORKS: Essentials I Training covering all topics and overall good experience, It is very well documented course for beginners. Everything is so well explained. I liked the format and the material. This course is awesome, I\'m really happy to have found the mindmajix training course.",NaN,NaN,NaN,NaN,NaN,NaN,English,30,Hours,,"Mobile,Desktop",TRUE,TRUE,TRUE,"₹9,581,323"
https://mindmajix.com/palo-alto-essentials-ii-training,Palo Alto Essentials II Training,"<div class=""Curriculum_description__1LwKr""><p>Mindmajix Palo Alto Essentials II Training enhance the student’s understanding of how to install, configure, manage, and perform basic troubleshooting on the entire line of Palo Alto Networks Next Generation firewalls. Students will gain an in-depth knowledge of how to optimize their visibility and control over applications, users, and content.</p></div>",Online,Instructor Paced,NaN,NaN,NaN,NaN,NaN,Vicky ,https://cdn.mindmajix.com/mern/images/instructor-male.svg,I had taken  online Palo Alto Essentials II Training sessions from MindMajix. The sessions will not only help you in real time work and also interviews too.,John,https://cdn.mindmajix.com/mern/images/instructor-male.svg,Best institute to learn Palo Alto Essentials II Training. The trainer guided me very well and supported through out the training. I would even refer my friends to take the training from Mindmajix.,Manikandan Saibaba ,https://cdn.mindmajix.com/reviewer/manikandan-saibaba-commvault-review-18092021.jpg," 
Thank you for the sessions that helped me gaining knowledge in Palo Alto Essentials II Training. It helped me to get the detailed information regarding the key concepts and challenging tasks in real-time. Thanks once again",Mubash Khan,https://cdn.mindmajix.com/reviewer/mubash-khan-commvault-review-18092021.jpg," 
I have joined for  Palo Alto Essentials II Training at Mindmajix. I had a great experience with the team and support as well from the staff.   We had a regular query hour after the class completion",English,30,Hours,,"Mobile,Desktop",TRUE,TRUE,TRUE,"₹6,735,653"
https://mindmajix.com/palo-alto-panorama-manage-multiple-firewalls-training,Palo Alto Networks: Panorama 8.0 Manage Multiple Firewalls Training,"<div class=""Curriculum_description__1LwKr""><p>Mindmajix Palo Alto Panorama 10.0 Manage Multiple Firewalls Training Provides an in-depth knowledge of how to configure and manage their Palo Alto Networks Panorama Management Server. Upon completion of this course, administrators will understand the Panorama server’s role in managing and securing their overall network. Enroll for Palo Alto Firewalls Certification Training Free DEMO!</p></div>",Online,Instructor Paced,NaN,NaN,NaN,NaN,NaN,Albert,https://cdn.mindmajix.com/mern/images/instructor-male.svg,"I had a great experience in taking the Panorama 7.1: Manage Multiple Firewalls course from Mindmajix. It has provided a unique opportunity for the students around the world to connect to some of the best tutors. The tutors not only provide a very good theoretical explanation , but also help us to co-relate it with some real time examples.",Charles,https://cdn.mindmajix.com/mern/images/instructor-male.svg,"I have taken online training on Panorama 7.1: Manage Multiple Firewalls course at Mindmajix, and I am really happy with them. An excellent online mode of learning.The classes were very interactive and insightful. It helped break the boredom of a usual classroom and kept the course interesting. This reduces my effort of reading the books and can start working immediately in the ongoing projects.",Ranjan Saha ,https://cdn.mindmajix.com/reviewer/sanjan-saha-palo-alto-review-18092021.jpg," 
It was a great experience with mindmajix taken Palo Alto Networks: Panorama 8.0 Manage Multiple Firewalls online training. Very detailed oriented trainers made the learning process so easy. I appreciate their responsibly towards students needs and 24/7 support.",Mubash Khan,https://cdn.mindmajix.com/reviewer/mubash-khan-commvault-review-18092021.jpg," 
I took Palo Alto Networks: Panorama 8.0 Manage Multiple Firewalls online training from Mindmajix. The trainer is good at explaining concepts with real-time scenarios. I am very happy with the course content delivered by him. Thanks to my friend for introducing Mindmajix to me.",English,30,Hours,,"Mobile,Desktop",TRUE,TRUE,TRUE,"₹6,272,107"
https://mindmajix.com/ethical-hacking-training,Ethical Hacking Training Course Online,"<div class=""Curriculum_description__1LwKr""><p>Mindmajix’s Certified Ethical Hacking online Training is designed by the top ethical hackers from the best organizations. This Certified ethical hacking course will help you learn skill sets like penetration testing, working with firewalls and intrusion detection systems, and more to become a certified ethical hacker. During this course, you will work on real-time scenarios to get practical knowledge of intrusion detection systems, sniffing, DoS attack, and honeypots, Through this training, trainees will master the advanced ethical hacking concepts like SQL injection, hacking wireless networks, and mobile platforms, IoT hacking, and cryptography. Enroll in our Certified Ethical Hacking training and clear CEH v11 certification.</p></div>",Online,Instructor Paced,NaN,"What are the Prerequisites for Ethical Hacking Course?Anyone who wants to build his career in hacking can attend this course.
",NaN,NaN,NaN,Amit Agarwal,https://cdn.mindmajix.com/mern/images/instructor-male.svg,The Ethical Hacker training module is been very well structured and delivered. Trainer has been practical working in real time and helped me to get more knowledge on real time security information.,Mary Koh,https://cdn.mindmajix.com/mern/images/instructor-male.svg,It is a very good online training institute for Ethical Hacking & Faculty is also well experienced. the trainer has got a lot of patience to resolve every participants query....that is really appreciated..,Ramya Shetty,https://cdn.mindmajix.com/mern/images/instructor-male.svg,Mindmajix has taught me all the Ethical Hacking Concepts and took me to the next level. I truly thank Mindmajix for making me Certified Hacker.,Satish,https://cdn.mindmajix.com/mern/images/instructor-male.svg,Outstanding Ethical Hacking training by Mindmajix. Helped me understand the logic by giving real life examples and scenarios. The best institute for Ethical Hacking Training.,English,30,Hours,Enroll for Ethical Hacking Training and become a Certified Ethical Hacking Specialist (CEH),"Mobile,Desktop",TRUE,TRUE,TRUE,"₹2,978,324"
