page_url,title,description,delivery_method,instruction_type,what_will_learn,prerequisites,target_students,instructor|1|name,instructor_bio,review|1|reviewer_name,review|1|photo,review|1|review,review|2|reviewer_name,review|2|photo,review|2|review,review|3|reviewer_name,review|3|photo,review|3|review,review|4|reviewer_name,review|4|photo,review|4|review,languages,total_duration,total_duration_unit,short_description,accessibilities,live_class,job_assistance,capstone_project,average_salary
https://mindmajix.com/arcsight-training,ArcSight Training,"<div class=""Curriculum_description__1LwKr""><p><span style=""font-weight: 400;"">This ArcSight Training course teaches you all the essentials of the ArcSight solution, as well as provides information on how to design a complete solution. First, the course covers the basic operations of ArcSight, such as ArcSight download, install, deploy, troubleshoot, and more. Next, you’ll get a brief overview of ArcSight architecture, how to use the Console and Command Center to monitor security events, manage users, configure SIEM ArcSight, and ESM network intelligence resources. This online ArcSight Training also introduces you to searching and running reports with ArcSight Logger. Finally, you’ll gain the necessary hands-on expertise to clear ArcSight Certification through interactive labs and detailed use-cases.</span></p></div>",Online,Instructor Paced,|ArcSight ESM (Enterprise Security Manager)|Log source onboarding & Log baselines|Logger Installation|Content creation on ESM|ESM Administration|Web Interference|,"What are the prerequisites for joining this ArcSight Training?There is no specific prerequisite to get started with ArcSight. But, it’s recommended to have a basic understanding of security concepts before joining this ArcSight training to master the concepts easily in a shorter time.",|ESM System Administrators |Analysts|Security Professionals|Network Operators|,Vihari,"Vihari  has got 10+ of years of industrial experience working for global MNCs. He chose to deliver online training and contribute informative articles and blogs to various websites to share his technical expertise.
",Saiprasad Shettar,https://cdn.mindmajix.com/reviewer/saiprasad-shettar-arcsight-review-29092021.jpg,"I’m a beginner in ArcSight, but the instructor really simplified the course content such that even a newbie can understand everything easily from scratch. The uniqueness of this ArcSight Training is it imparts both theoretical and practical knowledge simultaneously.",Bonnie,https://cdn.mindmajix.com/mern/images/instructor-male.svg,"Before signing up for the ArcSight Training Course at Mindmajix, ArcSight really looked so complicated to me. But thanks to the trainer Hemanth who really helped me to feel confident and eager to learn more about ArcSight concepts with the detailed study of examples, projects, and training videos.",Legborsi Frank,http://cdn.mindmajix.com/reviewer/legborsi-frank-arcsight-review-18092021.jpg,Thank You for the flexible ArcSight training sessions provided by Mindmajix. The trainer is very knowledgeable and cleared every single query with patience even after the session and this really helped me to understand even better.,NaN,NaN,NaN,English,20,Hours,Leverage the growing demand for Certified ArcSight Professionals,"Mobile,Desktop",TRUE,TRUE,TRUE,"₹4,034,432"
https://mindmajix.com/cyberark-training,CyberArk Training Course Online,"<div class=""Curriculum_description__1LwKr""><p>Mindmajix CyberArk training develops the skills and knowledge required to design, install, and configure the CyberArk Privileged Account Security Solution. Our participants will attain hands-on experience in installing CyberArk infrastructure, setting authentication types, etc., through real-time examples. This course imparts in-depth knowledge on password management and PSM along with software concepts including backup and troubleshooting.</p></div>",Online,Instructor Paced,"||CyberArk is ranked as a global leader as per Gartner Magic Quadrant 2019 for Privileged Access Management|||More than half of the Fortune 500 companies trust CyberArk to protect their critical and high-value assets|||According to enlyft, a total of 2525 organizations utilize CyberArk, and it has a market share of around 36%|||A CyberArk engineer makes an average annual income of $154,250, according to neuvoo|||The job opportunities for CyberArk professionals are numerous and is expected to increase even more shortly||","What are the Prerequisites for CyberArk Course?The participant should have a basic knowledge of networking and Windows administration.
",||Vault administrators|||IT security professionals||,Subash,"Having 12+ years of experience working closely with industry, Subash is one of the best-certified trainers of MindMajix. He has bagged CyberArk and can deliver the best technology to our trainees.
",swathi kadiyala,https://media.licdn.com/dms/image/C5103AQEokERuwyIYlA/profile-displayphoto-shrink_200_200/0?e=1576108800&v=beta&t=yilzyU13frdiB2ETt0bcyk8b6WoUv5i0tRW0TPyZe_o,"The CyberArk training by mindmajix checks all the right boxes. Mindmajix course material includes realtime scenarios with practical skills rather than bookish knowledge. All thanks to Mindmajix!
",Rohan Bakliwal,https://cdn.mindmajix.com/reviewer/rohan-bakliwal-cyberark-review-18092021.jpg,I have recently passed my CyberArk Certification exam. All thanks to Mindmajix and their trainers for inspiring me to opt this career.,Adarsh s,https://cdn.mindmajix.com/reviewer/adarsh-s-review-17102021.jpg," 
I enrolled for the CyberArk training course at Mindmajix, the trainer is well talented in explaining real-time projects with examples. I would strongly recommend mindmajix for my friends",Akhilesh Rajendran,https://cdn.mindmajix.com/mern/images/instructor-male.svg,"




It’s a very good learning experience at mindmajix. the trainer has excellent knowledge of core concepts of Cyberark which helped me to learn more better.

",English,20,Hours,Enroll now for CyberArk Training and Become a Master in Identity Security and Access Management,"Mobile,Desktop",TRUE,TRUE,TRUE,"₹7,655,621"
https://mindmajix.com/commvault-training,Commvault Training,"<div class=""Curriculum_description__1LwKr""><p>Mindmajix CommVault training guides you in building essential skills required to install, configure, and manage a Commvault software using the functions of the Admin Console and CommCell Console. By the end of the training, you will gain valuable insights into all the core concepts of CommVault through hands-on projects and use cases. This will enable you to become a certified CommVault professional.</p></div>",Online,Instructor Paced,NaN,"What are the prerequisites for the Commvault course?There are no prerequisites for learning Commvault. But, administration and data management experience can be an added advantage.
",|Administrators|Database managers|Aspirants who are willing to learn advanced Commvault strategies.|,Ranjith,"With 8+ years of experience in training and nine years of working experience, Ranjith is a certified professional, has trained more than 610+ students and delivered seven corporate firms with live online sessions worldwide.
",Mubash Khan,https://cdn.mindmajix.com/reviewer/mubash-khan-commvault-review-18092021.jpg,I have recently passed my CommVault Certification exam. All thanks to Mindmajix and their trainers for inspiring me to opt this career.,Manikandan Saibaba,https://cdn.mindmajix.com/mern/images/instructor-male.svg,"Dear Mindmajix Team, I really appreciate your interest in resolving the query. My best wishes to the entire Support team. Thanks for helping me to get expertise in Commvault Training.
",Suraj Pingle,https://cdn.mindmajix.com/mern/images/instructor-male.svg,"It was an amazing experience and learning from Mindmajix. The Whole thanks to Instructor, he was excellent. He explained everything included in the CommVault course content, thanks to Mindmajix.
",Rupak Kumar Naik,https://cdn.mindmajix.com/reviewer/rupak-kumar-naik-commvault-review-18092021.jpg,"Learned a lot, Thanks for better service provided by Mindmajix. Team processes and the way you communicate really helped me with CommVault online Training.",English,22,Hours,Take your Career to the Next Level with Commvault Training Online,"Mobile,Desktop",TRUE,TRUE,TRUE,"₹7,667,640"
https://mindmajix.com/cyber-security-training,Cyber Security Training,"<div class=""Curriculum_description__1LwKr""><p>Our Cyber Security Training enables you to build basic to advanced cybersecurity knowledge and gain skills on techniques to defend against cyber threats. By taking this course, you will become proficient in securing your critical systems and assets. You will also be working with the latest Cybersecurity technologies and tools that help you become an expert in detecting vulnerabilities, threats, and cybersecurity attacks. Following course completion, you will be able to perform risk management, incident response, and more to protect your infrastructure from cyber attacks. All these skills will help you clear the Cybersecurity certification.</p></div>",Online,Instructor Paced,|Security Fundamentals|Security Teams Management|Offensive Security|Cloud Security Architecture|Security Systems Architecture|Auditing and Compliance|Electives|Networking Concepts|,"What are the prerequisites for the Cyber Security course?Prior knowledge in the following areas is required to take up this training:

Network Security
Systems Administration
Database Applications
Data Recovery

",|Technical support engineers|Security consultants/managers|IT directors/managers/consultants|Chief information security officers (CISOs)|Security auditors/architects|Chief compliance/privacy/risk officers|Security systems engineers|Systems analysts or administrators|All levels of IT auditors/penetration testers|,Surender,"Surender has got 10+ years of industrial experience working for global MNCs. He chose to deliver online training and contribute informative articles and blogs to various websites to share his technical expertise.
",Muhammad Talha Majoka,https://cdn.mindmajix.com/reviewer/muhammad-talha-majoka-cyber-security-review-28092021.jpg,Course content is really good and support folks are really helpful. Supports at every time with full energy. thanks to the very enthusiastic trainer and Best Institute for Cybersecurity training. Keep up the good work! Thank for Mindmajix.,Soujanya Vadali,https://cdn.mindmajix.com/mern/images/instructor-male.svg,"Excellent videos and interactive mode of online teaching. Instructors are very informed and clear while communicating. Cybersecurity online course covers all the topics, what they said. thanks to Mindmajix.
",Charan singh,https://cdn.mindmajix.com/mern/images/instructor-male.svg,"I loved every bit of the Cyber security training. The trainers especially were really qualified, experienced, courteous and had a knack to impart technical knowledge. Due to this great training from Mindmajix now I got more logical  technics effortlessly. Great work!",Sharan shukla,https://cdn.mindmajix.com/mern/images/instructor-male.svg,Training in ethical hacking is great. Got a chance to gain more knowledge in cyber security field due to this training course. Thank you Mindmajix.,English,25,Hours,Enroll now for CyberSecurity Training and Get Expertise in securing your Critical Systems and Assets,"Mobile,Desktop",TRUE,TRUE,TRUE,"₹5,628,945"
https://mindmajix.com/fortinet-training,Fortinet Training,"<div class=""Curriculum_description__1LwKr""><p>Mindmajix Fortinet training develops network security skills and expertise required for a career as a certified Fortinet professional. It offers a foundational understanding of threat landscape, Fortinet features, FortiGate firewalls, and much more through real-world examples. By the end of the training, you’ll become an expert in designing, configuring, and troubleshooting network security solutions and will also able to use this knowledge in real-time. Enroll now and get certified.</p></div>",Online,Instructor Paced,"|Get an Overview of Fortinet Unified Threat Management appliance and its key features|Explore firewall policies, user authentication, SSL VPN, web filter, etc, used in protecting the network|Understand FortiGate network security management and analytics|Explore advanced Fortinet products|Deploy, administer, and troubleshoot the security solutions on Fortinet products|","What are the prerequisites for the Fortinet course?The following are the prerequisites for learning this course:

Basic knowledge of Firewall concepts
Entry-level working experience on network security concepts.

",|IT security professionals|Networking professionals|Professionals working on FortiGate appliance.|,Mahender,"Having 8.5+ years of experience working closely with industry, Mahender is one of the best-certified trainers of MindMajix. He has bagged Fortinet and can deliver the best technology to our trainees.
",Lois,https://cdn.mindmajix.com/mern/images/instructor-male.svg,It was a very good experience to learn Fortinet from Mindmajix. Faculty members are very knowledgeable and cooperative.all together it was an enlightening and informative course.,Rosemary,https://cdn.mindmajix.com/mern/images/instructor-male.svg,Before taking Fortinet online course I was invalid at my insight . After this course I was super confident.,NaN,NaN,NaN,NaN,NaN,NaN,English,30,Hours,Leverage the growing demand for Certified Fortinet Professionals,"Mobile,Desktop",TRUE,TRUE,TRUE,"₹5,175,787"
https://mindmajix.com/ibm-security-qradar-siem-training,IBM Security QRadar SIEM Training Course Online,"<div class=""Curriculum_description__1LwKr""><p>Boost your security career by gaining deep visibility into QRadar architecture &amp; components, log activity, network activity, and offense management through real-world examples. This IBM Security QRadar SIEM training course will help you learn how to configure, administer, tune, and troubleshoot the QRadar SIEM through hands-on projects, and this will help you in clearing the IBM Security QRadar certification exam.</p></div>",Online,Instructor Paced,"|Configure and Administer the IBM Qradar SIEM|Manage reference sets and assets|Configure user accounts, and customize dashboards|Manage data by using recovery, backups, and retention buckets|Manage log and flow data sources|Create customized log sources|Use and create rules|Identify and tune False positive|","What are the prerequisites for the IBM Security QRadar SIEM course?The candidate should have basic knowledge of the following concepts for a better understanding of IBM Security QRadar SIEM:

IT Security Fundamentals
Windows and Linux OS 
TCP/IP
Networking 
Regular expression basics

",|Security administrators|Security technical architects|Offence managers|QRadar SIEM administrators|Security analysts|Professionals who want to enhance their skills in QRadar SIEM.|,Veena,"Passion towards teaching made Veena share the industrial experience she has got for further generations. She has got a total of three years into the real-time industrial background and has trained over 310+ students.
",Ganesh Kotikalapudi,https://cdn.mindmajix.com/reviewer/ganesh-kotikalapudi-ibm-security-qradar-siem-review-28092021.jpg,"IBM Security QRadar SIEM training is really awesome, I knew nothing about it before joining the course in Minmajix. But now I have got the confidence that I can crack interview answering any type of questions shooted on IBM QRadar. Thanks, Mindmajix.",Suhas Ganjikunta,https://cdn.mindmajix.com/reviewer/suhas-ganjikunta-ibm-security-qradar-siem-review-29092021.jpg,"Thanks Mindmajix..!!! Really a good place to learn IBM Security QRadar SIEM Clear understanding of concepts and really clear explanation of everything about that, special thanks to my trainer. Being a real time experience guy he helped me a lot with real time concepts.",Akram,https://cdn.mindmajix.com/mern/images/instructor-male.svg,I have a great experience with Mindmajix while taking IBM Security QRadar SIEM training and very useful knowledge i gained here on IBM Security QRadar SIEM. Thank you Mindmajix.,Anudeep,https://cdn.mindmajix.com/mern/images/instructor-male.svg,"My name is Anudeep, Let me share my experience with mindmajix for QRadar SIEM Training. The training is good & the instructor is excellent. The topics are related to the latest trends. Lab sessions were good. Overall someone can attend the training online with mindmajix.",English,20,Hours,Leverage the growing demand for Certified IBM Security QRadar SIEM Professionals,"Mobile,Desktop",TRUE,TRUE,TRUE,"₹10,720,600"
https://mindmajix.com/palo-alto-training,Palo Alto Training,"<div class=""Curriculum_description__1LwKr""><p>Palo Alto Training offered by Mindmajix allows you to build the skills required for configuring and managing next-generation firewalls. This course discusses how you can enhance your organization security by deploying Palo Alto next-generation firewalls. With the help of this, you can get good command on various aspects like VLANs, Security Zones, DNS Proxy. Quality of Service(QoS), routing, addressing, etc. By enrolling in this course, you can prevent your organization from modern cybersecurity attacks. After the completion of this course, you will be able to get through the Palo Alto certification exam.</p></div>",Online,Instructor Paced,NaN,"What are the Prerequisites for Palo Alto Course?Having previous knowledge on the basics of networking and security concepts is an advantage for this course.
",NaN,Razark,"Passion towards teaching made Razark share the industrial experience he has got for further generations. He has got a total of three years into the real-time industrial background and has trained over 300+ students.
",Sai,https://cdn.mindmajix.com/mern/images/instructor-male.svg,I sincerely recommend mindmajix for Paloalto online training. I appreciate their responsibly towards students needs and 24/7 support.,Ranjan Saha,https://cdn.mindmajix.com/reviewer/sanjan-saha-palo-alto-review-18092021.jpg,It was great experience with mindmajix taken Paloalto online training. Very detained oriented trainers made learning process so easy.,Saurav Biswas,https://cdn.mindmajix.com/reviewer/saurav-biswas-palo-alto-review-18092021.jpg," 
Great explanation of concepts through live examples, this helped me to link the topics and understand the connect between various topics of Palo Alto online course. Excellent. Great learning experience. Thanks a lot, Mindmajix!!",Firoz Ansari,https://cdn.mindmajix.com/reviewer/firoz-ansari-palo-alto-review-18092021.jpg," 
Excellent Palo Alto certification training institute.clear and in-depth concepts in Hadoop, real-time examples",English,25,Hours,Gain knowledge of Advanced Firewalls to Control Networks with the Palo Alto certification course,"Mobile,Desktop",TRUE,TRUE,TRUE,"₹5,379,515"
https://mindmajix.com/rsa-archer-training,RSA Archer Training Course Online,"<div class=""Curriculum_description__1LwKr""><p>RSA Archer training by Mindmajix delivers foundational knowledge on all the concepts and processes required to design, configure, and manage the RSA Archer platform. You’ll learn how to navigate the RSA Archer system, create applications, dashboards, troubleshooting, and much more through hands-on sessions. You will also get exposure to real-time case studies and projects, which boost your skills and help you in clearing the RSA Archer certification exam.</p></div>",Online,Instructor Paced,"|RSA Archer and eGRC Suite|Interface components and Data Structures|General Application Properties and layouts|Access control basics and roles, and Automate work streams|Troubleshooting|","What are the prerequisites for the RSA Archer course?Fundamentals of GRC and business process knowledge will be beneficial.
",|IT Risk Managers|GRC Professionals|IT Auditors|IT Security Professionals|,Rana,"With 6+ years of experience in training and nine years of working experience, Rana is a certified professional, has trained more than 580+ students and delivered seven corporate firms with live online sessions worldwide.
",Ishita Kundu,https://cdn.mindmajix.com/reviewer/ishita-kundu-rsa-archer-review-28092021.jpg,Loved the way it is delivered. Clear and precise so much so that you can just refer the course for starting a project.I would recommend this course to anyone who wants to start a career in RSA Archer.,Gopal Rao Ippili,https://cdn.mindmajix.com/reviewer/gopal-rao-ippili-review-28092021.jpg,Perfect place to learn RSA Archer Online Training very helpful to my career. The course content is good and informative. I suggest Mindmajix would be the best institute to take RSA Archer Course.,Amol Hekare,https://cdn.mindmajix.com/reviewer/amol-hekare-review-17102021.jpg,"I have learned a lot from this training. The trainer have awesome skills, he can make you expert in RSA Archer. Go with Mindmajix for better training.",Giridhar Masireddy,https://cdn.mindmajix.com/reviewer/giridhar-masireddy-rsa-archer-review-28092021.jpg,"I have enrolled for RSA Archer Course at Mindmajix, and the support team responded immediately for any enquiry. The trainers in-depth knowledge has helped me understand much better about the RSA Archer.",English,12,Hours,Leverage the growing demand for Certified RSA Archer Professionals,"Mobile,Desktop",TRUE,TRUE,TRUE,"₹6,677,190"
https://mindmajix.com/ca-siteminder-training,CA SiteMinder Training,"<div class=""Curriculum_description__1LwKr""><p>Mindmajix CA SiteMinder training develops the core skills and expertise necessary to become an expert in this rapidly growing domain. You’ll gain in-depth knowledge on all the essentials of SiteMinder including Policy Server, domain objects, global policies, authentication services, and much more through practical sessions and examples. Our training also provides hands-on exposure to industry use cases and projects, which will help you in clearing the CA SiteMinder certification exam.</p></div>",Online,Instructor Paced,|CA Siteminder overview|Installation|System objects|Domain objects|Responses|Global policies|Authentication services|Password services|Maintenance|,"What are the prerequisites for the CA Siteminder course?




The students should have a working knowledge of the following:

Knowledge of federation concepts
Understanding of LDAP Concepts 


",|Deployment Consultants|Architects|Deployment Administrators|,NaN,NaN,Ahmed Said,https://cdn.mindmajix.com/reviewer/ahmed-said-review-17102021.jpg,"I appreciate the quality of learning material of Mindmajix. My experience in dealing with the support team has been excellent. Overall, I feel Mindmajix is a good platform for IT professional. Thank you Mindmajix for making CA SiteMinder training easy!",Kartheek KV,https://cdn.mindmajix.com/mern/images/instructor-male.svg,"I can say Mindmajix is the best platform for online training, which is providing CA SiteMinder training course. The Trainer has exceptional knowledge really amazing, I strongly recommend this institute for CA SiteMinder course.",sudipta adhikari ,https://cdn.mindmajix.com/mern/images/instructor-male.svg,"The training was very good and was helpful to learn new concepts of CA SiteMinder course. The training had a good blend of lectures and they provided practical knowledge which helped me to understand using the features provided by the product and will surely be helpful in practical implementations.
",NaN,NaN,NaN,English,30,Hours,,"Mobile,Desktop",TRUE,TRUE,TRUE,"₹7,724,619"
https://mindmajix.com/thycotic-secret-server-training,Thycotic Secret Server Training,"<div class=""Curriculum_description__1LwKr""><p> </p>
<p>Mindmajix’s Thycotic Secret Server training allows security professionals to acquire expertise in managing sensitive credentials throughout privileged accounts. In our virtual classroom training, you will master Secret Server basics like the Thycotic architecture, installing the secret server, basic configuration, Secret Template, etc. This Thycotic Secret Server course provides you with an in-depth understanding of error detections, remote password changing, secret policies, privileged account integration, SSH, and RDP proxy through live training sessions and practical use-cases. Enrol now our Thycotic Secret Server online training and learn how to secure all privileges, services, root accounts, and applications from cyber-attacks.</p></div>",Online,Instructor Paced,NaN,NaN,NaN,NaN,NaN,NaN,NaN,NaN,NaN,NaN,NaN,NaN,NaN,NaN,NaN,NaN,NaN,English,30,Hours,Learn Thycotic Secret Server Online Course - Become an Expert in Privileged Access Management,"Mobile,Desktop",TRUE,TRUE,TRUE,"₹3,673,048"
