page_url,title,description,delivery_method,instruction_type,what_will_learn,prerequisites,target_students,instructor|1|name,instructor_bio,review|1|reviewer_name,review|1|photo,review|1|review,review|2|reviewer_name,review|2|photo,review|2|review,review|3|reviewer_name,review|3|photo,review|3|review,review|4|reviewer_name,review|4|photo,review|4|review,languages,total_duration,total_duration_unit,content,short_description,accessibilities,live_class,job_assistance,capstone_project,average_salary
https://mindmajix.com/oracle-bpm-training,Oracle BPM Training,"<div class=""Curriculum_description__1LwKr""><p>Mindmajix Oracle BPM training is designed to develop the core skills and competence in building Oracle Business Process Management Suite solutions with practical sessions. You’ll gain in-depth knowledge on BPMN process modeling, business rules, human workflow, adaptive case management, etc., through hands-on projects. Upon completion, you’ll be able to implement this knowledge in real-time. Enroll now and get certified.</p></div>",Online,Instructor Paced,"|LEAN business processes|ProPeC ""Simple Improvement Process""|Connect business improvements to high-level business goals|Current state analysis|Identify and implement an action plan|Create a process flow and implement a continuous improvement strategy|Run an efficient business meeting|","What are the prerequisites for the Oracle BPM course?




The following are the prerequisites for learning Oracle BPM course:
Basic knowledge of,

Oracle service bus
Oracle SOA
Oracle BPEL
DevOps


",|HR managers|Business developers|Developers|,NaN,NaN,Arpita Jain,https://cdn.mindmajix.com/mern/images/instructor-male.svg,I have opted for Oracle BPM Training at Mindmajix. I must say a great amount of information has been clearly communicated by the experienced trainer which helped me gain deeper knowledge of the subject.,Shirley,https://cdn.mindmajix.com/mern/images/instructor-male.svg,I recommend mindmajix for beginners who are seeking for a professional way of learning Oracle BPM. Here you will definitely experience well organised e-learning. Thank You mindMajix,Siddharth,https://cdn.mindmajix.com/mern/images/instructor-male.svg,I have a good experience while having Oracle BPM course. The classes were highly interactive and also practical oriented where one can learn and improve his learning abilities. The office staff was cordial and co-operative.,Laxmikant Latpate,https://cdn.mindmajix.com/mern/images/instructor-male.svg,"




Mindmajix designed as a flexible online Education Portal. I have completed the Oracle BPM  course from Mindmajix.The way of communication was also excellent so that we did not face any major problems in any of the Sessions.  It was a great experience with Mindmajix. Thank you.

",English,28,Hours,NaN,,"Mobile,Desktop",TRUE,TRUE,TRUE,"₹7,766,091"
https://mindmajix.com/oracle-workflow-training,Oracle Workflow Training,"<div class=""Curriculum_description__1LwKr""><p>Mindmajix Oracle Workflow Training: Learn Workflow APIs, R12.2 Implement Oracle Workflow, Workflow Administration, Wizard Overview, Deploying Workflow, Oracle Workflow Components, how to design the workflow processes in order to automate and streamline business processes, Sending FYI &amp; FYA Notifications, modeling, and Workflow Engine., etc. You will also get exposure to industry-based Real-time projects in various verticals.</p></div>",Online,Instructor Paced,|Routing Information|Defining and Modifying Business Rules|Integrating Systems|Delivering Electronic Notifications|Design workflow processes using Oracle Workflow Builder|Set up and administer Workflow for a site|Discover subscription-based processing for business events|,"What are the prerequisites for the Oracle Workflow course?




The prerequisites to take up this training are:

Expertise in Oracle Database and Oracle Application Server technology
Expertise in Oracle E-Business Suite


",|Software Engineers|SQL and investigation experts|Database heads |Those trying for a vocation in Oracle PL/SQL|,Ankit,"Ankit has got 8+ of years of industrial experience working for global MNCs. He chose to deliver online training and contribute informative articles and blogs to various websites to share his technical expertise.",Zeelani Shaik,https://cdn.mindmajix.com/mern/images/instructor-male.svg,"I have taken Oracle Workflow online training from MindMajix. They are very flexible with timings and quality of the trainer is great, he covered most real time scenarios. I recommend MindMajix.
",Sukanya Kura,https://cdn.mindmajix.com/mern/images/instructor-male.svg,"I have opted for Oracle Workflow Training at Mindmajix. I must say a great amount of information has been clearly communicated by the experienced trainer which helped me gain deeper knowledge of the subject.
",Ashim Sen Gupta,https://cdn.mindmajix.com/mern/images/instructor-male.svg,"I completed my Oracle Workflow training. I personally feel that Mindmajix is the right place to embark on a successful Oracle Workflow career. I shall definitely recommend it to my friends and colleagues.
",NaN,NaN,NaN,English,20,Hours,NaN,Leverage the growing demand for Certified Oracle Workflow Professionals,"Mobile,Desktop",TRUE,TRUE,TRUE,"₹6,677,190"
https://mindmajix.com/appian-training,Appian Training and Certification Course Online,"<div class=""Curriculum_description__1LwKr""><p>This Appian Training course main objective is to help you become familiar with the core concepts of Appian and gain the skills needed to become a professional Appian developer. Trainees will learn the Appian terminology, design patterns, lifecycle, Appian’s development tools, and much more.</p></div>",Online,Instructor Paced,"|Install and configure Appian|Understand Appian data terminology|Design user interfaces|Plan and create a high-level process model|Design and add objects to the application|Configure gateways, subprocess node, and additional task settings(exceptions, deadline, escalations)|Create and configure a data store and query rules|Create reports using the report builder to export and import an application |Master the advanced features of Appian|","Prerequisites to learn Appian Course? Following are the prerequisites to learn Appian:

Basic Understanding of BPM Concepts.
Strong Knowledge of Java, C# .Net, SQL
Expertise in Web Technologies like ASP, AJAX, etc.

",|Business Analysts|Project Managers|Designers|BPM Developers & Administrators|System Administrators|Professionals who want to extend their skill-set with advanced technologies.|,Sarvesh,"Passion towards teaching made Sarvesh share the industrial experience he has got for further generations. He has got a total of Seven years into the real-time industrial background and has trained over 340+ students.",Ravindra Kuchibhotla,http://cdn.mindmajix.com/reviewer/ravindra-kuchibhotla-appian-review-18092021.jpg,"Thanks to Mindmajix I am really happy with this training, Appian was brought in to create business processes and workflows to automate or facilitate manual processes.",Azhagiri M,http://cdn.mindmajix.com/reviewer/azhagiri-m-appian-review-18092021.jpg,"Recently, I have joined in Mindmajix Appian Online training. Their team is working excellent with well-mannered trainers who are professionally expert in the field. The team is available 24/7 to provide enough support and clear doubts.",vijay bachu,https://media.licdn.com/dms/image/C4E03AQGSo_MyKSCWBg/profile-displayphoto-shrink_200_200/0?e=1576108800&v=beta&t=Ad4vKLDZs69Ay7CfO1UM0oK-_NQQycVPElV9VbR8L_8,"I had taken the Appian Course from MindMajix, thoroughly enjoyed the course! Pretty good course content and constant support from Mindmajix Team.
",Vanaja Movva,http://cdn.mindmajix.com/reviewer/vanaja-movva-appian-review-18092021.jpg,"According to experience in Mindmajix, a lovely training destination to learn the Appian course with a syllabus designed as per market trends with best standards.",English,25,Hours,NaN,Leverage the growing demand for Certified Appian Professional,"Mobile,Desktop",TRUE,TRUE,TRUE,"₹6,677,190"
https://mindmajix.com/ibm-bpm-training,IBM BPM Training,"<div class=""Curriculum_description__1LwKr""><p>Mindmajix’s IBM BPM (Business Process Manager) Training provides insights into business process management with practical examples. The course starts with an overview of BPM, emphasizing concepts of re-use, maintenance, and high development strategies. You’ll learn to create business objects, variables, implement gateways, and more. Hands-on exercises throughout the course provide experience with BPM tasks and skills.</p></div>",Online,Instructor Paced,"|Get an overview of the IBM Business Process Manager architecture, and its components|Use the Process Designer to Create ad hoc activities|Create a process application using process designer|Build a business data model|Translate workflow steps into business process activities and nested processes|Manage variables and dataflow|Master performance concepts and methodologies|Initialize Complex variable using Javascript|Implement Ajax controls on a Coach|Create efficient Coaches and Coach Views|","What are the prerequisites for the IBM BPM course?The prerequisites for learning IBM BPM are listed below:

The participant should have a basic knowledge of data structures and web services.
The participant should have a basic understanding of SQL and Javascript.

",|BPM analysts|Process Administrators|Support engineers|Integration developers|System administrators|Deployment engineers|,Roshan,"Having 9+ years of experience working closely with industry, Roshan is one of the best-certified trainers of MindMajix. He has bagged IBM BPM and can deliver the best technology to our trainees.
",Laxmikant,https://cdn.mindmajix.com/mern/images/instructor-male.svg,"Mindmajix designed as a flexible online Education Portal. I have completed the IBM BPM course from Mindmajix. It was a great experience with Mindmajix. Thank you.
",Jyosthsna,https://cdn.mindmajix.com/mern/images/instructor-male.svg,"Took the training for IBM Lombardi BPM Admin. Well, satisfied with the training. Your commitment was very much appreciable. The way of communication was also excellent so that we did not face any major problems in any of the Sessions.
",Shafi,https://cdn.mindmajix.com/reviewer/shafeeq-mohammed-ibm-bpm-review-29092021.jpg,"With My Personal Experience, I am writing this review. Mindmajix is an Excellent online Coaching institute for IBM BPM training. Before taking an online course from Mindmajix, I was so confused about IBM BPM, now I am very confident in the field of IBM BPM the faculty is very dedicated. The Course structure is Satisfying. Thanks, Mindmajix.",Bhushan,https://cdn.mindmajix.com/reviewer/bhushan-kulkarni-ibm-bpm-review-28092021.jpg,I did the IBM Lombardi BPM online training course from Mindmajix and I must express my gratitude to the Support I got from them. The whole system (Instructor and the support staff) worked seamlessly and gave a smooth learning experience. Mindmajix is a highly recommended place to learn.,English,30,Hours,NaN,Leverage the growing demand for Certified IBM BPM Professionals,"Mobile,Desktop",TRUE,TRUE,TRUE,"₹5,990,923"
https://mindmajix.com/jbpm-training,jBPM Training,"<div class=""Curriculum_description__1LwKr""><p>Mindmajix jBPM training enables you to gain in-depth knowledge of JBPM installation, external integration, JBPM console, Drools, exception handling, and more through real-world examples and practical executions. You are also allowed to work on two real-time industry based projects in our training to boost your skills and clear the jBPM certification exam.</p></div>",Online,Instructor Paced,"|Get an overview of the jBPM console and its components|Install and configure jBPM|Create the Real-time Web Application using jBPM|Integrate BPMS process workflow with Java or Java EE applications|Monitor, optimize, and simulate BPMN process execution|","What are the prerequisites for the jBPM course?The major prerequisites for learning jBPM are listed below:

The participant should have a basic knowledge of Java.
The participant should be familiar with workflow concepts of business process management.

",|Application Architects|Application Developers|Middleware Programmers|Business Process Managers|Java Developers|Professionals who want to enhance their skill set in business process modeling.|,NaN,NaN,Jelly Edward,https://cdn.mindmajix.com/mern/images/instructor-male.svg,Excellent jBPM training. Mindmajix helped me with their step-by-step procedures and well explained by the trainers. Thank You MindMajix.	,Pranay,https://cdn.mindmajix.com/mern/images/instructor-male.svg,I took my online training for jBPM from Mindmajix. I must say the course content was highly reliable and the trainer covered even the slightest of concept. Overall it was a good experience with Mindamajix.,Sammy,https://cdn.mindmajix.com/mern/images/instructor-male.svg,The Mindmajix classes for jBPM were consistent and the material provided was highly relevant. I felt the complete course was best organized.,Vara Prasad B,https://cdn.mindmajix.com/mern/images/instructor-male.svg,"




Thank you for providing in-depth jBPM Online Training. I am glad to say that my learning experience with Mindmajix was more than top-class. It was exceptional. I experienced a very good explanation from the trainer.

",English,25,Hours,NaN,Enroll now for jBPM Training and Get Expertise in Java Business Process Model,"Mobile,Desktop",TRUE,TRUE,TRUE,"₹6,009,323"
https://mindmajix.com/pega-training,Pega Training and Certification Course Online,"<div class=""Curriculum_description__1LwKr""><p>Mindmajix has specially designed this Pega Training to provide you with in-depth knowledge of Pega fundamentals from scratch. The course focuses on designing and configuring Pega applications. You’ll gain the essential skills required to analyse, design, and create business requirements and specifications in the Pega application. Signup for this course to improve your chances of becoming a certified Pega Business Architect.</p></div>",Online,Instructor Paced,"|Project Implementation Methodology|Data Modeling and User Interfaces|BPM and its concepts|Class Structures and Hierarchy|Process Flow – Flow & Flow Actions, SLA|Declarative rules and Case Management|Integration with external systems|PRPC Database Concepts and Activities|Performance and PRPC Guardrails |Rule Management & Security|","What are the prerequisites for the Pega course?




There are no specific prerequisites to learn Pega. Having basic knowledge of BPM and CRM is an added advantage.

",|System Architects|System Developers who want to learn Pega to develop PRPC applications|IT programmers|Business Analysts|Anyone from IT and Non-IT domains who want to learn Pega and its applications|,Anvish,"With 9+ years of experience in training and Ten years of working experience, Anvish is a certified professional, has trained more than 300+ students and delivered seven corporate firms with live online sessions worldwide.
",Padmaja Akella,https://cdn.mindmajix.com/mern/images/instructor-male.svg,"I have learned Pega Training through the Mindmajix Online Training Platform. Highly experienced and qualified Pega trainers made the learning process completely effortless and enjoyable for me. A big thank you to the entire Mindmajix for their 24*7 support and amicable customer service.
",Prasad B.,https://cdn.mindmajix.com/reviewer/borra-v-pega-review-28092021.jpg,Thank you for providing in-depth Pega Online Training. I am glad to say that my learning experience with Mindmajix was more than top-class. It was exceptional.,Keerthana Yellavula,https://cdn.mindmajix.com/reviewer/keerthana-yellavula-pega-review-28092021.jpg,"I have enrolled for Pega Course at Mindmajix, and the support team responded immediately for any enquiry. The trainers in-depth knowledge has helped me understand much better about the Pega systems.",Kundan Kumar,https://cdn.mindmajix.com/reviewer/kundan-kumar-pega-review-28092021.jpg,I recently completed training on the Pega Certification course from MindMajix. I experienced a very good explanation from the trainer. They help me to learn more about Pega.,English,30,Hours,NaN,Leverage the growing demand for Certified Pega Professionals,"Mobile,Desktop",TRUE,TRUE,TRUE,"₹13,725,335"
https://mindmajix.com/tibco-activematrix-bpm-training,TIBCO AMX BPM Training,"<div class=""Curriculum_description__1LwKr""><p>Become a certified TIBCO ActiveMatrix BPM developer by mastering all the essentials of TIBCO AMX BPM from scratch. Our training will advance your knowledge and skills to design, develop, and deploy ActiveMatrix BPM applications using TIBCO Business Studio through hands-on sessions and real-time examples. Upon completion, you’ll become a master in applying this knowledge in the real world.</p></div>",Online,Instructor Paced,|Organization Modeller|Deploying an organization model|Object models|Modeling business processes| Modeling forms|Events and gateways|Pageflow processes|Custom forms|Resource management|Sub-processes and AMX BPM logging|Service tasks and using web service tasks|Enhancing page flows|,"What are the prerequisites for the TIBCO AMX BPM course?




Knowing the basics of Business Process Management is enough to take up the course.

",|BI Experts|SQL Experts|Database Investigators|,Harshavardhan,"Harshavardhan has got 4+ years of industrial experience working for global MNCs. He chose to deliver online training and contribute informative articles and blogs to various websites to share his technical expertise.",Deepthi,https://cdn.mindmajix.com/mern/images/instructor-male.svg,"When I thought to go for TIBCO AMX BPM certification, my friend suggested me about this training sessions. I was happy that these sessions helped me a lot to gain confidence to get certified. Thank You.",tarun,https://cdn.mindmajix.com/mern/images/instructor-male.svg,"The course is very structured and trainer is very clear in communication, invoking participation from trainees, helping clearing there doubts.",Vara Prasad B,https://cdn.mindmajix.com/mern/images/instructor-male.svg,"




The training was very informative and helped me a lot in understanding the TIBCO AMX BPM concepts. This Certification Course really helped me to enhance my skills.

",Keerthana Yellavula,https://cdn.mindmajix.com/mern/images/instructor-male.svg,"




Completed the TIBCO AMX BPM course in Mindmajix. I Extremely satisfied with the training. Trainer commitment was very much appreciable. The way of communication was also excellent so that we did not face any major problems in any of the Sessions.

",English,25,Hours,NaN,Leverage the growing demand for Certified TIBCO AMX BPM  Professionals,"Mobile,Desktop",TRUE,TRUE,TRUE,"₹7,398,697"
