page_url,title,description,delivery_method,instruction_type,what_will_learn,prerequisites,target_students,instructor|1|name,instructor_bio,review|1|reviewer_name,review|1|photo,review|1|review,review|2|reviewer_name,review|2|photo,review|2|review,review|3|reviewer_name,review|3|photo,review|3|review,review|4|reviewer_name,review|4|photo,review|4|review,languages,total_duration,total_duration_unit,short_description,accessibilities,live_class,job_assistance,capstone_project,average_salary
https://mindmajix.com/mulesoft-training-hyderabad,Mulesoft Training in Hyderabad,"<div class=""Curriculum_description__1LwKr""><p><span style=""font-weight: 400;"">Mulesoft training in Hyderabad offered by Mindmajix allows you to develop integrations and APIs and set up APIs through the Mulesoft Anypoint platform. Our Mulesoft training in Hyderabad covers the concepts like web services, API directories, RAML, creating API portals, unsecured APIs, and creating Mock APIs. It also includes real-time projects and practical use cases to provide an in-depth understanding of message processors, create flows graphically, connect to the databases, transform the data, structure mule applications, utilize web services, handle errors, and write DataWeave transformations. In addition to these concepts, you will also learn Processing records, handling mule code, and mule projects. Join our Mulesoft online training in Hyderabad to start your career as a certified Mulesoft developer.</span></p></div>",Online,Instructor Paced,NaN,"Who should take this Mulesoft Training in Hyderabad?




The Mulesoft Training is designed for the following professionals:


Software Developers
System Administrators
And the Aspirants who are willing to take this training in Hyderabad


","|Fundamentals of Mulesoft ESB|Good knowledge of java or other object-oriented programming languages|Basic understanding of tools like JDBC, JMS, and HTTP|Hands-on experience in working with data formats like CSV, JSON, and XML|",Sujith,"With 9+ years of experience in training and Ten years of working experience, Sujith is a certified professional, has trained more than 800+ students and delivered seven corporate firms with live online sessions worldwide.",Saptaparni Dey,http://cdn.mindmajix.com/reviewer/saptaparni-dey-mulesoft-review-18092021.jpg,"I am delighted to say that Sujith, our Mulesoft trainer, was extremely professional in his way of teaching. All the study material which was provided by Sujith is extremely helpful for learning. The way of teaching was also very interesting as he used to explain concepts with real-time scenarios and make us understand which was in a way very helpful.",Anand,https://cdn.mindmajix.com/mern/images/instructor-male.svg,Mindmajix’s MuleSoft training helped me with my career transition from Non-IT to the technical side. It’s one of the best solutions for learning online.,Roshan,https://cdn.mindmajix.com/mern/images/instructor-male.svg,"I recently enrolled in MuleSoft training. Live sessions explained concepts well with real-time examples, and the syllabus is well-structured. This makes the course more accessible to me. Now I’m looking forward to completing it. Thanks, Mindmajix team.",Praneeth Samalla,http://cdn.mindmajix.com/reviewer/praneeth-samalla-mulesoft-review-18092021.jpg,"Thank you Mindmajix, you provided me a chance to acquire good knowledge in MuleSoft. Those persons who are looking for the best online training institute regarding MuleSoft I strongly recommend Mindmajix.",English,22,Hours,"Learn Mule 4 - Become a Master to Integrate Applications, Data, and Devices","Mobile,Desktop",TRUE,TRUE,TRUE,"₹5,205,463"
