page_url,title,description,delivery_method,instruction_type,what_will_learn,prerequisites,target_students,instructor|1|name,instructor_bio,review|1|reviewer_name,review|1|photo,review|1|review,review|2|reviewer_name,review|2|photo,review|2|review,review|3|reviewer_name,review|3|photo,review|3|review,review|4|reviewer_name,review|4|photo,review|4|review,languages,total_duration,total_duration_unit,short_description,accessibilities,live_class,job_assistance,capstone_project,average_salary
https://mindmajix.com/jboss-soa-esb-training,JBoss SOA ESB Training,"<div class=""Curriculum_description__1LwKr""><p>Mindmajix JBoss SOA ESB Course provides an overview of the Red Hat Boss Enterprise SOA Platform and focuses on skills required to use the ESB. This course covers how to develop ESB services like HTTP providers, transformation actions, Java Message Server providers, and available built-in service actions. This Course also Includes Events management and problems associated, Managing data-related tasks, Automating the business activities, Utilizing the IT resources and skills, Service and applications management.</p></div>",Online,Instructor Paced,NaN,"Who should take this course?






Senior Java EE Developers
Enterprise SOA architects


","|Understand how ESB providers and services work together|Write customESB actions to perform services|Expose business functions using web services, service deployments, and JMS providers|Use JBoss Developer Studio tooling to deploy and build ESB services|Details of popular in0-built ESB providers and services|Support message formats using XSLT and Smooks transformations.|",Prasad,"Passion towards teaching made Prasad share the industrial experience he has got for further generations. He has got a total of three years into the real-time industrial background and has trained over 310+ students.",Jaiganesh Seetharaman,https://cdn.mindmajix.com/mern/images/instructor-male.svg,"I took JBoss SOA ESB training organized by Mindmajix. Trainers are very professional, corporative to the schedule as per my availability. I got the required content as I expected. Thanks to the Mindmajix team.
",Sureshnaidu mullaguri,https://cdn.mindmajix.com/mern/images/instructor-male.svg,"I had a very valuable training on JBoss SOA ESB. It provides good insight. The instructor has done an excellent job of structuring and delivering the content. It definitely wants to do other courses in the Mindmajix 
",VIKAS Shrivastava,https://cdn.mindmajix.com/mern/images/instructor-male.svg,"JBoss SOA ESB course is very practical training. I felt like this was a bit challenging as I lack enough experience in the software industry but I gave me a very good intuition.
",Srilekha Upadhyayula,https://cdn.mindmajix.com/mern/images/instructor-male.svg,"




Loved this training. The content is extremely informative and highly useful. Special thanks to my trainer, he had a great knowledge of the subject and explained all the concepts patiently by clearing all my doubts.

",English,30,Hours,Leverage the growing demand for Certified JBoss SOA ESB  Professionals,"Mobile,Desktop",TRUE,TRUE,TRUE,"₹6,844,936"
https://mindmajix.com/mulesoft-training,MuleSoft Training Course Online,"<div class=""Curriculum_description__1LwKr""><p>Learn the key concepts of MuleSoft with this interactive course. Whether you're exploring MuleSoft for the first time or looking to deepen your understanding, this course will allow you to develop the problem-solving techniques you need to think like a MuleSoft expert. Through 22 Hrs of MuleSoft Training and hands-on activities, you’ll learn to design, build, test, and deploy integrations and APIs from Anypoint Platform to Anypoint Studio. Our training designed and led by MuleSoft practitioners to take your knowledge from beginner to certified.</p></div>",Online,Instructor Paced,NaN,"What are the prerequisites to take this MuleSoft Course?One of the main prerequisites to take this MuleSoft training course is some experience in programming, especially with Object-Oriented languages like Java. In addition, it’s good to possess a basic understanding of data formats, such as JSON, XML, and CSV, and integration technologies like HTTP, SOAP, and REST to master MuleSoft in a shorter time.",|Developers|Architects|Administrators |,Sujith,"With 9+ years of experience in training and Ten years of working experience, Sujith is a certified professional, has trained more than 800+ students and delivered seven corporate firms with live online sessions worldwide.",Saptaparni Dey,http://cdn.mindmajix.com/reviewer/saptaparni-dey-mulesoft-review-18092021.jpg,"I am delighted to say that Sujith, our Mulesoft trainer, was extremely professional in his way of teaching. All the study material which was provided by Sujith is extremely helpful for learning. The way of teaching was also very interesting as he used to explain concepts with real-time scenarios and make us understand which was in a way very helpful.",Anand,https://cdn.mindmajix.com/mern/images/instructor-male.svg,Mindmajix’s MuleSoft training helped me with my career transition from Non-IT to the technical side. It’s one of the best solutions for learning online.,Roshan,https://cdn.mindmajix.com/mern/images/instructor-male.svg,"I recently enrolled in MuleSoft training. Live sessions explained concepts well with real-time examples, and the syllabus is well-structured. This makes the course more accessible to me. Now I’m looking forward to completing it. Thanks, Mindmajix team.",Praneeth Samalla,http://cdn.mindmajix.com/reviewer/praneeth-samalla-mulesoft-review-18092021.jpg,"Thank you Mindmajix, you provided me a chance to acquire good knowledge in MuleSoft. Those persons who are looking for the best online training institute regarding MuleSoft I strongly recommend Mindmajix.",English,22,Hours,Leverage the growing demand for Certified Mulesoft Professionals,"Mobile,Desktop",TRUE,TRUE,TRUE,"₹5,205,463"
https://mindmajix.com/odi-training,ODI Training and Certification Course Online,"<div class=""Curriculum_description__1LwKr""><p>Oracle Data Integrator (ODI) training by Mindmajix provides hands-on experience in configuring and managing the ODI 12c environment. The course covers various techniques and methods of data integration across various platforms based on Extract Load Transform architecture. With instructor-led online classes, the trainee will master advanced ODI concepts such as project development, data integration 12c models, datastores, and much more through the best practices.</p></div>",Online,Instructor Paced,"|Get an overview of Oracle Data Integrator Repositories|Create and manage ODI repositories and agents|Administer ODI resources and setup security with ODI|Design and monitor the interfaces|Perform ELT data transformations by designing ODI Mappings, Procedures, Packages, and Load Plans|Set up and administer secure multi-user ODI environment|Use ODI Web services to perform integration of ODI with SOA|","What are the prerequisites for the ODI course?The participant should have a basic knowledge of SQL and relational database.
",|Administrator|Analyst|Architect|Data Scientist|Database Administrator|,Simran,"With 6+ years of experience in training and nine years of working experience, Simran is a certified professional, has trained more than 200+ students and delivered seven corporate firms with live online sessions worldwide.",Vishal Patel,https://cdn.mindmajix.com/mern/images/instructor-male.svg,"I would like to inform that my Oracle Data Integrator Course has been successfully completed with the Support of Mindmajix and I am very much satisfied with his teaching quality.
",Zeelani Shaik,https://cdn.mindmajix.com/mern/images/instructor-male.svg,"




Hi, I’m Zeelani Shaik, I completed ODI training from Mindmajix. Every concept was explained in a detailed manner. The trainer is outstanding and is a professional working on the same. He is very supportive, and all my doubts are making me complete the course and obtain certification.

",Tejaswini Mahadev Naik,https://cdn.mindmajix.com/mern/images/instructor-male.svg,"




 
Myself Tejaswini, joined the ODI Certification training in Mindmajix. They are providing excellent coaching with expert instructors. Training exercises are provided for better results from us. Thank you Mindmajix.

",NaN,NaN,NaN,English,25,Hours,Enroll now for ODI Training and Get Expertise in Oracle Data Integration  ,"Mobile,Desktop",TRUE,TRUE,TRUE,"₹7,044,435"
https://mindmajix.com/soa-admin-training,Oracle SOA Admin Training,"<div class=""Curriculum_description__1LwKr""><p>Mindmajix Oracle SOA Admin training course provides participants with in-depth knowledge of all the fundamentals of Oracle SOA Suite 11g from scratch. You’ll learn how to design, deploy, administer, and troubleshoot SOA composite applications in Oracle SOA Suite 11g environment using Oracle SOA 11g components (such as Mediator, Business Rules, BPEL, Business Process Management, Human Task) with practical executions and examples.</p></div>",Online,Instructor Paced,NaN,"What are the prerequisites for the Oracle SOA Admin course?The following are the prerequisites for learning Oracle SOA Admin:
Basic knowledge of,

SQL queries
Web Service concepts
Command line scripts
Interfaces 

",|Administrators|Architects|System integrators|System administrators|,Praveen,"With 8+ years of experience in training and nine years of working experience, Praveen is a certified professional, has trained more than 500+ students and delivered seven corporate firms with live online sessions worldwide.", Smith Aku,https://cdn.mindmajix.com/reviewer/smith-aku-soa-admin-review-29092021.jpg,"I have completed Oracle SOA Admin Training in Mindmajix. service wise and knowledge wise i am very happy, Now i am working in top MNC Company.",Smitha Sunil,https://cdn.mindmajix.com/mern/images/instructor-male.svg,"Oracle SOA Admin was one of the best training experiences i have ever had. Thank you Mindmajix for your coordination and prompt replies.
",Preetam Shinde,https://cdn.mindmajix.com/mern/images/instructor-male.svg,"I took Oracle SOA Admin Training at Mindmajix which was my best Online Session that was available at a very reasonable price.
",NaN,NaN,NaN,English,25,Hours,Leverage the growing demand for Certified Oracle SOA Admin Professionals,"Mobile,Desktop",TRUE,TRUE,TRUE,"₹6,677,190"
https://mindmajix.com/oracle-soa-training,Oracle SOA Training and Certification Course Online,"<div class=""Curriculum_description__1LwKr""><p>This Oracle SOA training is suitable for developers, administrators, or architects who want to gain a firm foundation and expertise in Oracle Suite 12c solutions. The course covers topics such as BPEL modeling, business rules, adapters, event processing, securing services, business activity monitoring, troubleshooting, installation, configuration, deployment, and more. This certification course provides the necessary knowledge to provide a competitive edge through proven expertise.</p></div>",Online,Instructor Paced,"|Develop and integrate core SOA Suite components|Build, deploy and manage Service-Oriented Architectures (SOA)|Utilize end-to-end security and unified metadata management tools and techniques|Build enterprise applications that provide solutions to business problems|Use Oracle Service Bus (OSB) 12c capabilities to connect and coordinate interaction between different applications and services across a variety of platforms, protocols, and interface technologies|","What are the prerequisites for the Oracle SOA course?As such, there are no prerequisites for learning Oracle SOA. Anyone who is interested in learning this course can join this training.
",|Architect|Application developer|Integration developer|Administrator|Implementation consultant|,Praveen,"With 8+ years of experience in training and nine years of working experience, Praveen is a certified professional, has trained more than 500+ students and delivered seven corporate firms with live online sessions worldwide.",Jojo,https://media.licdn.com/dms/image/C5103AQGQYUiemNyhTA/profile-displayphoto-shrink_200_200/0?e=1576108800&v=beta&t=8KDBUCAef39FtNau8swtn8yztH1uQULcgaDoZQmiD-A,It is a very good online training institute for Oracle SOA & Faculty is also well experienced. trainer has got lot of patience to resolve every participants query....that is really appreciated.,Siddarth,https://media.licdn.com/dms/image/C5603AQHXC5MlRqC3GQ/profile-displayphoto-shrink_200_200/0?e=1576108800&v=beta&t=E0R9_Mj0ZfQpeLMAlUd2ahYgee3QXG4Z6plWNqx1ikw,"I have taken Oracle SOA  online training from Mindmajix. They are very flexible with timings and quality of the trainer is great, he covered most real time scenarios. I recommend Mindmajix.",Kalyani,https://cdn.mindmajix.com/mern/images/instructor-male.svg,Thanks for making this platform available. Provided best Oracle SOA training. I hope to bring more people to embrace mindmajix as the bridge to fill the gaps in their career needs.,Arun Srivatsa,https://cdn.mindmajix.com/reviewer/arun-srivatsa-120821.png,"It was a great learning experience for me, and the training from MindMajix was really good and helped to brush up my basics on Oracle SOA. Goutam handled the sessions very well and all the topics were covered whatever was promised on the website. we have got all the learning Materials and Real-time SOA code from the trainer.",English,25,Hours,Leverage the growing demand for Certified Oracle SOA Professionals,"Mobile,Desktop",TRUE,TRUE,TRUE,"₹6,306,235"
https://mindmajix.com/oracle-service-bus-training,OSB Training,"<div class=""Curriculum_description__1LwKr""><p>OSB (Oracle Service Bus) Training from Mindmajx teaches you how to install and configure OSB 12c. Our best in-house instructors will help you gain hands-on experience in managing various components using Enterprise Manager Fusion Middleware Control and Service Bus Console. By taking this course, you’ll walk away with the skills to troubleshoot and debug tasks as well.</p></div>",Online,Instructor Paced,"|XML Fundamentals Ed 11|Developing Web Services Using Java Technology|SOA Adoption and Architecture Fundamentals|Oracle Service Bus 11g System Admin, Design & Integrate Accelerated|","What are the prerequisites for the OSB course?




There are no specific prerequisites to take up OSB course. However, knowledge in functional Messaging Web Service, SOA is an added advantage.

",|Application Developers|System Integrators|SOA Architects|End Users|Any graduate who is interested in this field.|,Praveen,"Praveen has got 8+ of years of industrial experience working for global MNCs. He chose to deliver online training and contribute informative articles and blogs to various websites to share his technical expertise.",Naresh Mann,https://cdn.mindmajix.com/reviewer/naresh-mann-osb-review-28092021.jpg,OSB training I got from Mindmajix is job oriented and industry-focused. The trainer dealt the course in a unique and comprehensive manner. I rate this as the best training I have ever received.,Mohammad Sadique Ansari,https://cdn.mindmajix.com/reviewer/mohammad-sadique-ansari-osb-review-28092021.jpg,"Mindmajix is the best OSB online training center, One of the most interesting, valuable and enjoyable course i ever had. Excellent material and good tutoring. Highly recommended.",Sonam,https://cdn.mindmajix.com/mern/images/instructor-male.svg,Best institute to learn OSB. The trainer guided me very well and supported through out the training. I would even refer my friends to take the training from Mindmajix.,NaN,NaN,NaN,English,25,Hours,Leverage the growing demand for Certified OSB Professionals,"Mobile,Desktop",TRUE,TRUE,TRUE,"₹6,306,235"
https://mindmajix.com/tibco-businessworks-6x-training,TIBCO BusinessWorks 6.x Training,"<div class=""Curriculum_description__1LwKr""><p>Mindmajix TIBCO BusinessWorks 6.x training provides in-depth knowledge on all the key fundamentals of BusinessWorks 6.x and also develops skills to design, test, deploy, and administer the TIBCO ActiveMatrix BusinessWorks applications. By the end of the training, you will gain confidence to clear the TIBCO BusinessWorks 6.x certification exam. Enroll now and get certified.</p></div>",Online,Instructor Paced,|Fundamentals of TIBCO BusinessWorks|Connection and session management|Managing exception and logging|Service managing and monitoring|Support interaction with non-TIBCO tools|Load balancing and fault tolerance|Scalability and extensibility of Business Works|Transforming XML data and validating|,"What are the prerequisites for the Tibco BW 6.x course?There are no prerequisites required for learning this course. Knowledge of:

XML, SOAP and REST Services, and Eclipse IDE is an added advantage.

To brush up your skills, you can take a look at our self-paced videos on:

XML
SOAP

",|IT professionals|Business Intelligence professionals|System administrators |Graduates willing to learn Tibco|,Jeevan,"Having 15+ years of experience working closely with industry, Jeevan is one of the best-certified trainers of MindMajix. He has bagged Tibco BW 5.x and can deliver the best technology to our trainees.
",Shreya,https://cdn.mindmajix.com/mern/images/instructor-male.svg,Perfect sessions to know all the key concepts of Tibco BusinessWorks 6. All credits to the trainers who took special care in presenting data management practically. Thanks to the support team as well.,Vijayata Keshri,https://cdn.mindmajix.com/mern/images/instructor-male.svg,"




I have received TIBCO BusinessWorks 6.x  online training from Mindmajix and everything worked out well for me. Great trainer and training material and a really good project. I have got valuable knowledge here in TIBCO BW 6 and gave me a lot of confidence.

",Manish Soni,https://cdn.mindmajix.com/mern/images/instructor-male.svg,"




My experience with TIBCO BusinessWorks certification training and with this project was positive as well as rewarding. There were a lot of valuable information provided me here

",NaN,NaN,NaN,English,25,Hours,Leverage the growing demand for Certified TIBCO BusinessWorks 6.x Professionals,"Mobile,Desktop",TRUE,TRUE,TRUE,"₹6,780,315"
https://mindmajix.com/tibco-bw-training,Tibco BW Training,"<div class=""Curriculum_description__1LwKr""><p>Enhance your skills in TIBCO ActiveMatrix Business Works by mastering its fundamental concepts and latest features through real-world examples and hands-on projects. By the completion of training, you will excel in building, deploying, and managing complex business processes in TIBCO and this will enable you to become a certified TIBCO BW developer.</p></div>",Online,Instructor Paced,|Fundamentals of TIBCO BusinessWorks|Transforming XML data and validating|Load balancing and fault tolerance|Service managing and monitoring|Connection and session management|Scalability and extensibility of Business Works|Support interaction with non-TIBCO tools|Managing exception and logging|,"What are the prerequisites for the TIBCO BW course?




There are no specific prerequisites to learn TIBCO BW. 

",|IT Professionals|Business Intelligence Professionals|System Administrators|Graduates|,Paul francis,"Having 15+ years of experience working closely with industry, Paul Francis is one of the best-certified trainers of MindMajix. He has bagged Tibco BW 5.x and can deliver the best technology to our trainees.",Prabhanjan Kurremula,https://cdn.mindmajix.com/reviewer/prabhanjan-kurremula-tibco-bw-review-29092021.jpg,The trainer was excellent! he has a an in-depth understanding and experience of TIBCO BW 5.x Platform. I highly recommend this course to anyone looking for quality TIBCO BW training and be productive in short time.,Abhilash,https://cdn.mindmajix.com/reviewer/abhilash-bola-review-17102021.jpg,"This is excellent course to Understand Tibco BW and covers all different flavors of Tibco BW, it is step by step approach to help each problem related to this training and One of the most interesting, valuable and enjoyable course i ever have. Excellent material and good tutoring. Highly recommended to MindMajix online training center.",Pooja Kamble,https://cdn.mindmajix.com/reviewer/pooja-kamble-tibco-bw-review-29092021.jpg,This was the first time I opted for online training in Tibco BW and I was completely blown away by the training I got from Mindmajix. The Tibco BW online training program was very well organized and all the required contents were covered in a proper manner. This training had given me tremendous confidence to secure a job in the Tibco BW domain. I really appreciate this training from Mindmajix.,NaN,NaN,NaN,English,25,Hours,Leverage the growing demand for Certified Tibco BW Professionals,"Mobile,Desktop",TRUE,TRUE,TRUE,"₹6,780,315"
https://mindmajix.com/webmethods-training,WebMethods Training and Certification Course Online,"<div class=""Curriculum_description__1LwKr""><p>Mindmajix webMethods training develops skills and proficiency in the webMethods integration platform from the ground up. You will explore about the webMethods architecture, integration tools, webMethods components, advanced web services, and much more with real-time use cases. We also offer industry-level projects to enhance your skills and successfully clear the webMethods certification exam.</p></div>",Online,Instructor Paced,NaN,"What will you learn in this WebMethods training?The core skills that you will gain are as follows:

Integration tools, EAI, B2B, B2C, and XML
WebMethods Architecture and its components
Monitoring, administering, deploying, and installing components
WebMethods Trading Network & Modeler
WebMethods Integration Server Administration
WebMethods BAM Basics

",NaN,Sudheer,"Sudheer has got 9+ years of industrial experience working for global MNCs. He chose to deliver online training and contribute informative articles and blogs to various websites to share his technical expertise.
",Pravas Parida,https://cdn.mindmajix.com/reviewer/pravas-parida-webmethods-review-29092021.jpg,The training in the WebMethods course by Mindmajix checks all the right boxes. The course material was very detailed and oriented towards equipping me with practical skills rather than bookish knowledge. All thanks to Mindmajix.,suneela d ,https://cdn.mindmajix.com/mern/images/instructor-male.svg,"




I joined the WebMethods online course at MIndmajix. They provide a good curriculum and their explanation also good. Thanks to Mindamjix! 

",Maneesh Singh,https://cdn.mindmajix.com/reviewer/maneesh-singh-webmethods-review-28092021.jpg," 
Greetings!! I really appreciate your effort in webMethods certification training. I would definitely give you a 5-star rating for detailed providing the best online training. Great Mindmajix.",Ravi narayanaswamy,https://cdn.mindmajix.com/reviewer/ravi-narayanaswamy-webmethods-review-29092021.jpg," 
MindMajix is a good online training provider. I have taken up a webMethods online course, the course content is well designed, the trainer and the supporting team were very good. I will suggest to others.",English,25,Hours,Enroll now for webMethods Training and Get Expertise in webMethods Integration Server,"Mobile,Desktop",TRUE,TRUE,TRUE,"₹7,623,422"
