page_url,title,description,delivery_method,instruction_type,what_will_learn,prerequisites,target_students,instructor|1|name,instructor_bio,review|1|reviewer_name,review|1|photo,review|1|review,review|2|reviewer_name,review|2|photo,review|2|review,review|3|reviewer_name,review|3|photo,review|3|review,review|4|reviewer_name,review|4|photo,review|4|review,languages,total_duration,total_duration_unit,content,short_description,accessibilities,live_class,job_assistance,capstone_project,average_salary
https://mindmajix.com/bitbucket-training,BitBucket Training,"<div class=""Curriculum_description__1LwKr""><p>Bitbucket training by Mindmajix will enable you to master all the fundamentals of Bitbucket through real-world examples. You’ll gain complete knowledge on Git workflows, commands, repositories, and much more through our hands-on training sessions and projects. Enroll now and get certified.</p></div>",Online,Instructor Paced,|Integrating Git|Working for any Git command|Executing basic commands in the command line |,"What are the prerequisites for the BitBucket course?The following are the prerequisites for learning BitBucket:
Basic knowledge of,

Oracle DBA and Incident Management,
Jenkins,
Kintana, and
Atlassian tools.

",|Version Control engineers.|Designers.|Software developers.|,Vijay,"Passion towards teaching made Vijay share the industrial experience he has got for further generations. He has got a total of three years into the real-time industrial background and has trained over 460+ students.",Anushri,https://cdn.mindmajix.com/mern/images/instructor-male.svg,Getting to know about the advanced real-time training programs offered by the Mindmajix Technologies in the trending courses. I’ve enrolled for BitBucket Training. The faculty here is well experienced and they are always up ahead in providing career guidance. The best part regarding the Mindmajix Technologies is that they make the students get to interact with the real-time industry experts & this has been proven to be a lot helpful for me in terms of boosting my confidence levels and as well as it helped me in attaining a broader outlook regarding BitBucket professional career. Mindmajix technologies have helped me a lot in fetching the best job opportunities suiting my profile and today I feel very glad for ensuring my career in the hands of Mindmajix Technologies.,Thomas,https://cdn.mindmajix.com/mern/images/instructor-male.svg,"Hi, this is Thomas. I was joined at Mindmajix for BitBucket Training. The trainer as well as the support group are excellent. I refer you to join Mindmajix.",Gayatri,https://cdn.mindmajix.com/mern/images/instructor-male.svg,Mindmajix is a great learning organization with their good collection of online courses. I have attended BitBucket courses so far and found the trainers extremely accommodating and going the extra mile to clarify any questions that the participant may have. Their timings are suitable for working staff. I would definitely recommend this.,NaN,NaN,NaN,English,18,Hours,"['Introduction to Bitbucket', 'Bit bucket installation', 'Navigation of Bitbucket', 'Introduction to Git', 'Git installation', 'Git Commands', 'Git with Bitbucket', 'Repository Creation', 'Repository permissions', 'Branches', 'Branch permission', 'Pull requests', 'Merging files', 'Repository clone', 'Git bash', 'Source tree', 'Installation of Source tree', 'User Management', 'Integration with Jira']",Leverage the growing demand for Certified BitBucket Professionals,"Mobile,Desktop",TRUE,TRUE,TRUE,"₹7,503,455"
https://mindmajix.com/git-training,Git Training,"<div class=""Curriculum_description__1LwKr""><p>Mindmajix has specially designed this Git Training Course to advance your skills for a successful career in this domain. The trainee will go through the various aspects of Git source control system, workflow, manage files with Git, and more related source control concepts. Upon completion of this online training, the trainee will hold a solid understanding and hands-on experience with Git.</p></div>",Online,Instructor Paced,|Installing and Configuring Git|Creating a new file and tracking files across the three-stage workflow|Creating Git accounts and moving the files to the remote repository|Using the issue tracker in GitHub to collaborate among developers|Create Remote repositories among developers|,"What are the prerequisites for the Git course?




Having basic knowledge of Windows Command line is required to learn Git.

",|Software Professionals|Software Architects and Designers|Testing Professionals|Open source contributors and enthusiasts|Developers who wish to accelerate their career as professionals using Git|,TRN Naresh,Prepared self-paced video content for GIT.,Grussell,https://cdn.mindmajix.com/mern/images/instructor-male.svg,Git Training at MindMajix was extensive. It was well planned and well executed. The trainer as well versed with the technology. Overall a good experience.,Hamp Crooks,https://cdn.mindmajix.com/mern/images/instructor-male.svg,Loved the way Mindmajix delivered. Clear and precise so much so that you can just refer the course for starting a project.I would recommend this course to anyone who wants to start a career in Git.,Prasanth,https://cdn.mindmajix.com/mern/images/instructor-male.svg,Looks like they want us to think of nothing but learning. I really appreciate this approach. Thank you MindMajix Team! I had a nice and fruitful time. Git course contents are up-to-date and the instructors are industry trained and extremely hard working.,Robert,https://cdn.mindmajix.com/mern/images/instructor-male.svg,Mindmajix is the best online professional training institute to learn Git course.,English,18,Hours,"['SDLC Models', 'Introduction to Version Control and Git', 'Distributes VS Centralized Remote Repository', 'Life Cycle of File in GIT', 'Understanding of WD, SA, and Local Repo', 'Git Log Command', 'Git Diff Command', 'Helix visual merge tool for checking differences (p4merge)', 'Removing files from different areas using git rm command', 'Git Checkout Command', 'Git References ( master and HEAD )', 'Git Reset Command', 'Git Aliases', 'gitignore file', 'Special Treatment for directories by Git ???', 'Branching And Merging', 'Merging by using Rebase', 'Stash in GIT', 'Repository', 'Git Remote Repository Commands', 'Tagging', 'Reset & Revert', 'Git Reflog Command', 'Cherry-Picking', 'Git and GitLab', 'Practice Test & Interview Questions']",Take your Career to the Next Level with Git Training Online,"Mobile,Desktop",TRUE,TRUE,TRUE,"₹6,979,518"
