page_url,title,description,delivery_method,instruction_type,what_will_learn,prerequisites,target_students,instructor|1|name,instructor_bio,review|1|reviewer_name,review|1|photo,review|1|review,review|2|reviewer_name,review|2|photo,review|2|review,review|3|reviewer_name,review|3|photo,review|3|review,review|4|reviewer_name,review|4|photo,review|4|review,languages,total_duration,total_duration_unit,content,short_description,accessibilities,live_class,job_assistance,capstone_project,average_salary
https://mindmajix.com/adobe-experience-manager-training,AEM Training Course Online,"<div class=""Curriculum_description__1LwKr""><p>AEM Training from Mindmajix teaches you the essential skills needed to develop and debug Adobe Experience Management through best practices. In this AEM course, you’ll learn the advanced methods used for developing websites being an AEM developer. The training starts with AEM basics and dives into central concepts like architecture, installation, features, using AEM with Maven and VLT, etc. By the time you’re done with this certification training, you’ll have the required skill set to tackle advanced development challenges in AEM.</p></div>",Online,Instructor Paced,NaN,"Prerequisites to learn AEM?Following are the Prerequisites for learning the AEM:

Basic Understanding of Web Technologies like Html, CSS, Javascript.
In-depth knowledge of Programming Languages like Java, C#, Python, etc.

",|Software programmers|Web developers|Adobe's Content managers|,Raju,"With 8+ years of experience in training and nine years of working experience, Raju is a certified professional, has trained more than 200+ students and delivered seven corporate firms with live online sessions worldwide.
",Dalglish Fernandes,http://cdn.mindmajix.com/reviewer/dalglish-fernandes-adobe-experience-manager-review-18092021.jpg,Well-structured Adobe Experience Manager course and the instructor is very Experienced. He has exceptional knowledge of Adobe Experience Manager and clears our doubts instantly and he makes sure that all the Students.,May Thet Hninn,http://cdn.mindmajix.com/reviewer/may-thet-hninn-adobe-experience-manager-review-18092021.jpg,It was a wonderful learning experience. Trainer's knowledge is impressive and great teaching capability. The course content is great. The session was interactive which was very good. I have gained in-depth knowledge of all the concepts of Adobe Experience Manager training. Thanks for everything Mindmajix.,Satish Krishnaraj,http://cdn.mindmajix.com/reviewer/satish-krishnaraj-adobe-experience-manager-review-18092021.jpg,I have joined for Adobe Experience Manager certification course at Mindmajix. Thank you MindMajix for awesome co-ordination. The training was very good and the trainer is so cooperative.,Rodrigo Reinheimer,http://cdn.mindmajix.com/reviewer/rodrigo-reinheimer-adobe-experience-manager-review-18092021.jpg," 
Thank You for the sessions that helped me gaining knowledge in Adobe Experience Manager online course. Trainer's experience helped me to get the detailed information regarding the key concepts and challenging tasks in real-time. Thanks again.",English,18,Hours,NaN,Leverage the growing demand for Certified AEM Professionals,"Mobile,Desktop",TRUE,TRUE,TRUE,"₹10,995,106"
https://mindmajix.com/adobe-marketing-cloud-training,Adobe Marketing Cloud Training Course Online,"<div class=""Curriculum_description__1LwKr""><p>Become an expert in Adobe Marketing Cloud by mastering all the fundamentals, features, and capabilities of the Adobe Marketing Cloud platform with real-time examples. Our training will help you gain expertise in content management, campaign execution, personalization, and more with industry projects and use cases. This knowledge will help you to become a certified Adobe Marketing Cloud professional.</p></div>",Online,Instructor Paced,"|Introduction to Adobe Marketing Cloud|Web Analytics|Layer Basics and Quick Fixes|Consumer Targeting and Solutions|Backbonejs Model, View, and Collections|Basic Photo Corrections|Masks and Channels|Typographic Design and Vector Drawing Techniques|Working with Selections|Applying Advanced C|Printing 3d Files|","What are the prerequisites for the Adobe Marketing Cloud course?Prerequisites for this course include:

Basics of Adobe tools on marketing 
Fundamentals of Digital Marketing

",|Digital Marketing Experts|Marketing Professionals|IT Professionals|,NaN,NaN,Bargavi,https://cdn.mindmajix.com/mern/images/instructor-male.svg,The most practical and easy way to learn Adobe Marketing Cloud covering all topics and overall good experience. It is a very well documented course for beginners. Everything is so well explained. I especially liked the format and the material. This is really an awesome course and I'm quite happy to have found MindMajix as my goto institute for learning purposes.,Kishore,https://cdn.mindmajix.com/mern/images/instructor-male.svg,The trainer tailored the material to meet the needs of students with varying skills and abilities. I found that Mindmajix has successful programs to accommodate people who are just starting out and upskill those looking to get ahead.,Sanjana,https://cdn.mindmajix.com/mern/images/instructor-male.svg,The Adobe Marketing Cloud training I got from Mindmajix is job oriented and industry focused. The trainer dealt the course in a unique and comprehensive manner. The project dealt here was very helpful in gaining in-depth knowledge about the Adobe Marketing Cloud concepts. ,Rodrigo Reinheimer,https://cdn.mindmajix.com/mern/images/instructor-male.svg,"




Recently I joined Adobe Marketing Cloud Training provided by Mindmajix. Trainers made sure that every topic of the course is useful in the real-time world. I thank them for making proficient in Adobe Marketing Cloud.

",English,24,Hours,"['Reporting and Analytics tool usage and Business analysis', 'Analytics implementation and admin concepts', 'TMS (Tag manager) – DTM, GTM', 'Adobe Target (Analytics optimization) – formely Adobe Test & Target', 'Overview of Adobe audience manager, Adobe campaign, Adobe experience manager', 'Interview Questions']",Leverage the growing demand for Certified Adobe Marketing Cloud Professionals,"Mobile,Desktop",TRUE,TRUE,TRUE,"₹5,821,916"
https://mindmajix.com/ibm-filenet-training,IBM Filenet Training,"<div class=""Curriculum_description__1LwKr""><p>IBM Filenet Training from Mindmajix teaches you how to configure and administer the IBM FileNet P8 system. The course introduces you to the core concepts of OBM FileNet such as architecture, P8 domain structures, content repositories, configuring metadata, managing security, auditing, logging, migration and deployment of IBM FileNet P8 assets, and more. Projects and use-cases covered during the course help you to clear the IBM FileNet Certification easily.</p></div>",Online,Instructor Paced,|IBM FileNet Content Manager Concepts|FileNet Workplace XT Configuration|Process design and implementation|Document Searches and Bulk Operations|Migrate applications|System Administration and Maintenance|Enable Content-Based Search on CMS|Overview of main applications of Platform|Workflow infrastructure|Securing Content|,"What are the prerequisites for the IBM FileNet course?




Good understanding of Content Management Systems is required to learn IBM FileNet.

",|System Administrators|Database Administrators|Aspirants who are looking for a career in this field.|Professionals who want to extend their skill-set with advanced technologies|,Devi,"Devi has got 9+ of years of industrial experience working for global MNCs. He chose to deliver online training and contribute informative articles and blogs to various websites to share his technical expertise.
",Narendra Jaiswal,https://cdn.mindmajix.com/mern/images/instructor-male.svg,"I have enrolled in the IBM FileNet from Mindmajix. Mindmajix took all the pain to ensure that I am progressing. They have always been prompt in helping me. The trainers have been great and highly experienced.
",Imran Ali,https://cdn.mindmajix.com/mern/images/instructor-male.svg,"My experience with Mindmajix in IBM Filenet Training is very pleasant. Their support is prompt and excellent. The trainer helped me exceptionally with well-curated content. I appreciate his efforts personally. And also Thanks to Mindmajix for their friendly support.
",VKameswari Sekhar Dasari,https://cdn.mindmajix.com/mern/images/instructor-male.svg,"I have done IBM FileNet course from Mindmajix. I liked their live classes, provided during the course. The course content was well structured. The trainer was easily approachable and was helpful in each and every step of the course.
",NaN,NaN,NaN,English,30,Hours,"['Introduction to IBM FileNet Content Manager', 'Configure FileNet Workplace XT', 'Process design and implementation']",Leverage the growing demand for IBM Filenet Cloud Professionals,"Mobile,Desktop",TRUE,TRUE,TRUE,"₹3,251,495"
https://mindmajix.com/documentum-training,Documentum Training,"<div class=""Curriculum_description__1LwKr""><p>Mindmajix Documentum Training provides the aspirants with the knowledge and skills needed to be successful. You’ll be introduced to the Documentum architecture, content management functionality, underlying technical structure, and application configuration. You will gain proficiency in all the core essentials of Documentum and become career-ready upon completion. Stay up to date with the latest tools and techniques of Documentum by mastering this certification course.</p></div>",Online,Instructor Paced,"|Get an overview of Enterprise Content Management (ECM) architecture, and its components|Explore the Documentum product and its key features|Install and configure the Content Server|Create a Custom Type using Composer|Create and configure Virtual Documents|Understand the relationship between content files and objects|Build a complex workflow|Master the concepts of Documentum Query language|Get an overview of D2 and its configuration|","What are the prerequisites for the Documentum course?The prerequisites for learning Documentum are listed below:

The participant should have basic knowledge of Java, and JavaScript.
The participant should be familiar with database and web services.
The participant should have a functional knowledge of web server and application server. 

",|Administrators|Project managers|Web developers|Java programmers|,Narender,"Having 9+ years of experience working closely with industry, Narender is one of the best-certified trainers of MindMajix. He has bagged Documentum, Java and can deliver the best technology to our trainees.
",Yuvaraj Anthony,https://cdn.mindmajix.com/reviewer/yuvaraj-anthony-documentum-review-29092021.jpg,I have opted for Documentum Training at Mindmajix. I must say a great amount of information has been clearly communicated by the experienced trainer which helped me gain deeper knowledge of the subject.,Satish Hegde,https://cdn.mindmajix.com/mern/images/instructor-male.svg,"The course structure was awesome. After attaining the Mindmajix Documentum course, now, I look forward to beginning my career in it.
",Deepika,https://cdn.mindmajix.com/mern/images/instructor-male.svg,The Mindmajix classes for Documentum were consistent and the material provided was highly relevant. I felt the complete course was best organized.,NaN,NaN,NaN,English,30,Hours,"['Enterprise Content Management Overview', 'Documentum Overview', 'Documentum Product Overview', 'Documentum Concepts Overview', 'Objects and Types', 'Users & Privileges', 'Groups and Roles', 'Object Security', 'System Administration Overview', 'Alias Sets', 'Custom Types', 'Virtual Documents', 'Object & Content Relationship', 'Lifecycle Overview', 'Workflow Basics and Workflow Manager', 'Search', 'Documentum Query Language', 'Documentum Foundation Classes', 'Business Object Framework (BOF)', 'Documentum Foundation Services (DFS)', 'Documentum Composer & Application builder', 'D2', 'Practice Test & Interview Questions']",Leverage the growing demand for Certified Documentum Professionals,"Mobile,Desktop",TRUE,TRUE,TRUE,"₹3,523,479"
https://mindmajix.com/oracle-webcenter-training,Oracle WebCenter Training,"<div class=""Curriculum_description__1LwKr""><p>Mindmajix Oracle WebCenter Training makes you an expert in concepts like Oracle WebLogic Server, Metadata Services (MDS), Oracle JSF Portlet Bridge, Page Hierarchies, Page Template, Creating Oracle WebCenter Portal 11g,and Runtime Editing…. etc.</p></div>",Online,Instructor Paced,NaN,"What are the prerequisites to take this course?




The following are the prerequisites for learning Oracle WebCenter training:


Basic knowledge of Java programming, Linux, SQL, WebLogic, and Front end languages like CSS and HTML
Oracle Fusion Middleware: Build Applications with ADF


",|Developers|System Analysts|Application Developers|Technical Consultant|Database administrators|Functional implementers|,N.n Eshwar sharma,"Having 10+ years of experience working closely with industry, N.N.Eshwar Sharma is one of the best-certified trainers of MindMajix. He has bagged Oracle Webcenter, Weblogic and can deliver the best technology to our trainees.",Zeelani Shaik,https://cdn.mindmajix.com/mern/images/instructor-male.svg,"I had taken Oracle WebCenter Training Program from mindmajix, thoroughly enjoyed the course! Pretty good course content and constant support from Mindmajix Team.
",Preetam Shinde,https://cdn.mindmajix.com/mern/images/instructor-male.svg,"Great explanation of concepts through live examples, this helped me to link the topics and understand the connect between various topics of Oracle WebCenter. Excellent. Great learning experience.. Thanks a lot Mindmajix!!.
",Sukanya Kura,https://cdn.mindmajix.com/mern/images/instructor-male.svg,"My Experience with Mindmajix was really great. Thanks for such amazing help to my career with Oracle webCenter Training.
",Tony,https://cdn.mindmajix.com/mern/images/instructor-male.svg,"I am extremely satisfied with the Oracle WebCenter Training. Marvelous job by our faculty, great hold over his technical skills. Trainers were too good and explained concept not once or twice but until we understood completely. Supportive people, good quality of study material like ppt's, videos, tutorials.. Mindmajix is a very good learning environment and experience.",English,18,Hours,"['Introduction To Oracle WebCenter Portal 11g', 'Creating The WebCenter Portal Application', 'Creating And Using Page Templates And Pages', 'Using Portlets', 'WebCenter Portal Services', 'Integrating WebCenter Portal Services', 'Runtime Management Of Portal Application', 'Runtime Editing And Customizing Of Pages With Oracle Composer', 'Application Packaging And Deployment', 'Practice Test & Interview Questions']",Leverage the growing demand for Certified Oracle WebCenter Professionals,"Mobile,Desktop",TRUE,TRUE,TRUE,"₹6,677,190"
https://mindmajix.com/sitecore-training,Sitecore Training and Certification Course Online,"<div class=""Curriculum_description__1LwKr""><p>In this hands-on Sitecore Training, you’ll be taught to develop MVC solutions that integrate with the marketing capabilities and content management system of Sitecore. The course focuses on Sitecore architecture, MVC design patterns, workflows, security, and much more. This online Training also prepares you for passing the Sitecore certification exam.</p></div>",Online,Instructor Paced,|Applying the architecture and features of Sitecore web content management System|Applying the template architecture to create a content structure|Publishing Sitecore features|Knowing the relationship between Sitecore databases|Apply presentation details to the Sitecore items|,"What are the prerequisites for the Sitecore course?The following are the prerequisites to learn Sitecore:
Basic knowledge of, 

Web development 
MVC architecture
Programming languages like C#, XML, HTML, and ASP.net. 

",|Web developers|Sitecore project managers|Software engineers|,Sushanth,"Sushanth has got 8+ years of industrial experience working for global MNCs. He chose to deliver online training and contribute informative articles and blogs to various websites to share his technical expertise.
",EARNEST,https://cdn.mindmajix.com/mern/images/instructor-male.svg,Best training source to gain good knowledge in SiteCore technology. Thank you Mindmajix.,abhishek sharma,https://cdn.mindmajix.com/mern/images/instructor-male.svg,"In my experience, MindMajix provides great course material and their instructors have always been helpful and very accessible.",rajeesh,https://cdn.mindmajix.com/mern/images/instructor-male.svg,"Hi, I have enrolled for SiteCore Training. The user interface, the materials for the course look good and the course is easily understandable.",NaN,NaN,NaN,English,20,Hours,"['Overview', 'Installation & Setup', 'Data']",Enroll now for Sitecore Training and Get Expertise in Content Management System(CMS),"Mobile,Desktop",TRUE,TRUE,TRUE,"₹8,386,031"
https://mindmajix.com/adobe-target-training,Adobe Target Training Course Online,"<div class=""Curriculum_description__1LwKr""><p>Become job-ready by mastering the core concepts and capabilities of Adobe Target with real-time examples. You’ll learn how to create A/B, multivariate, and targeting tests using Visual Experience Composer(VEC) through hands-on sessions. You’ll also learn how to use content, create audiences for targeting, campaign life cycle, reports, project governance, and more for optimizing a website through industry use cases and projects.</p></div>",Online,Instructor Paced,|Concepts of Designing|Designing Landing Pages|Digital Campaign Management|Optimizing Designs|Working with new Power-path analysis and reports|Simplifying the Search Optimization Methodologies|,"What are the prerequisites for the Adobe Target course?There are no specific prerequisites to take up this course.
",|Project Managers|Content Editors|Professionals working in the Creative industry|Marketing Associates|,Sanjay,"Having 10+ years of experience working closely with industry, Sanjay is one of the best-certified trainers of MindMajix. He has bagged Adobe Analytics, Target and can deliver the best technology to our trainees.",May Thet Hninn,https://cdn.mindmajix.com/mern/images/instructor-male.svg,"I enrolled in the Adobe Target Training offered by Mindmajix. Quality of training was good, and trainers taught all the topics which are required for me. Thanks to Mindmajix for this training.
",Satish Krishnaraj,https://cdn.mindmajix.com/mern/images/instructor-male.svg,"Mindmajix has all the facilities essential for an online learning platform, and they plan the training sessions very well. They have good trainers, and they will train the students in such a way that students can withstand the present competition.
",Suvendu Mishra ,https://cdn.mindmajix.com/mern/images/instructor-male.svg,"I joined Adobe Target Training provided by Mindmajix. They will provide all the materials, and the trainer's presentation was also good. Anyone who doesn't have previous knowledge on Adobe target can also attend this training as trainers will teach from scratch.
",Rodrigo Reinheimer,https://cdn.mindmajix.com/mern/images/instructor-male.svg,"




I have taken Adobe Target training from Mindmajix, and it was adequate. Live projects taught by the trainers have made me aware of the applications of Adobe Target. After the completion of training, they have provided the materials required for job preparation.

",English,18,Hours,"['Introduction to Test & Target', 'Terminology, Test & Target basics', 'Creating basic campaigns and filters', 'Other different types of campaigns', 'Segments', 'Parameters', 'Targeting', 'Reports & results analysis', 'Using success metrics', 'Multi variate campaigns', 'Ad testing', 'Real time case studies and next steps']",Become proficient with online marketing and web analytics products by taking the Adobe Target Training.,"Mobile,Desktop",TRUE,TRUE,TRUE,"₹7,195,340"
https://mindmajix.com/aem-forms-training,AEM Forms Training,"<div class=""Curriculum_description__1LwKr""><p>AEM Forms online training is an instructor-led classroom training that covers basic AEM forms concepts and techniques. In this training, trainees will learn the best ways to create AEM forms templates and adaptive forms. During this course, you will work to real-world scenarios to gain practical knowledge of creating and using themes, generating a document of records, and using XDP templates.  Every topic of our course curriculum is followed by practical exercises to implement your knowledge. By the end of this AEM Forms certification training, you will acquire all the skills to get hired as an AEM Forms Developer</p></div>",Online,Instructor Paced,NaN,NaN,NaN,NaN,NaN,NaN,NaN,NaN,NaN,NaN,NaN,NaN,NaN,NaN,NaN,NaN,NaN,English,25,Hours,"['Basics of AEM Forms Designer', 'AEM Forms Designer vs Html Forms', 'Form Designing and Layout Techniques of AEM Forms']",Kick start your career as AEM Forms Developer with AEM Forms Course,"Mobile,Desktop",TRUE,TRUE,TRUE,"₹6,751,381"
https://mindmajix.com/adobe-cq5-system-administrator-training,Adobe CQ5 System Administrator Training,"<div class=""Curriculum_description__1LwKr""><p>Adobe CQ5 System Administrator Training: Learn how to install, configure, maintain, and troubleshoot CQ5, CQ5 architecture, CQ5 integration, how to enable XMP extraction, XMP Write-back, LDAP synchronization., etc. You will also get an exposure to industry based Real-time projects in various verticals.</p></div>",Online,Instructor Paced,NaN,NaN,NaN,NaN,NaN,irfan,https://cdn.mindmajix.com/mern/images/instructor-male.svg,overall had a very good experience with adobe cq5 system admin training,shinde,https://cdn.mindmajix.com/mern/images/instructor-male.svg,very good training experience taught all the concepts very well ! training materials were also provided.,reshma,https://cdn.mindmajix.com/mern/images/instructor-male.svg,"adobe cq5 system administrator training at mindmajix is a good experience, taught all the concepts from basics, got the recorded sessions too.",Amit Beyond,https://cdn.mindmajix.com/mern/images/instructor-male.svg,"




I have joined for the Adobe CQ5 System Administrator Training in mindmajix. It was such a great experience. The entire credit goes to the trainer Because we found very few trainers like him. He is exceptionally good at teaching, and his knowledge on Adobe CQ5 System Administrator mesmerised me. The course is well packed with all the essentials to understand the complete Analytics. I am feeling delighted to express my joy through this review. I strongly recommend Mindmajix for those who would like to join Adobe CQ5 System Administrator Training.

",English,30,Hours,NaN,,"Mobile,Desktop",TRUE,TRUE,TRUE,"₹8,680,273"
