title,learn_type,description,delivery_method,instruction_type,content,what_will_learn,target_students,instructor|1|name,instructor|1|designation,instructor|1|instructor_image,instructor|2|name,instructor|2|designation,instructor|2|instructor_image,review|1|reviewer_name,review|1|review,total_duration,total_duration_unit,recommended_effort_per_week,batch|1|batch_start_date,enrollment_end_date,languages,short_description,accessibilities,pricing_type,currency,regular_price,additional_pricing_details,institute,partner_course_url
Basics of Financial Management,Course,"[<p><p><strong>Duration</strong>: 9 weeks (excluding orientation)<br/>
</p>
<p>Sound financial management is a vital aspect of any thriving business. As a result, professionals with skills and knowledge in this area tend to be highly valued by enterprises. Similarly, those who’ve started their own company also need to grasp key financial concepts to optimise the day-to-day management of their start-up and ensure profitability in the long term.
</p>
<p>The University of Cape Town (UCT) Basics of Financial Management online short course is designed to prepare you – as an administrator, manager, director, or entrepreneur – to more efficiently and effectively run a business’s finances in the South African context. Presented by experts in the field, it familiarises you with financial terms and processes, and aims to equip you with essential skills that will help you to draw up budgets, analyse financial statements, cut costs, and conduct cash flow analyses. You’ll leave with the insight you need to contribute to better financial management and, accordingly, better business management.
</p></p>, <p><strong>Duration</strong>: 9 weeks (excluding orientation)<br/>
</p>, <p>Sound financial management is a vital aspect of any thriving business. As a result, professionals with skills and knowledge in this area tend to be highly valued by enterprises. Similarly, those who’ve started their own company also need to grasp key financial concepts to optimise the day-to-day management of their start-up and ensure profitability in the long term.
</p>, <p>The University of Cape Town (UCT) Basics of Financial Management online short course is designed to prepare you – as an administrator, manager, director, or entrepreneur – to more efficiently and effectively run a business’s finances in the South African context. Presented by experts in the field, it familiarises you with financial terms and processes, and aims to equip you with essential skills that will help you to draw up budgets, analyse financial statements, cut costs, and conduct cash flow analyses. You’ll leave with the insight you need to contribute to better financial management and, accordingly, better business management.
</p>]",Online,Self Paced,"[<div class=""module-content""><p class=""heading font-h6-mobile"">Orientation module</p><p class=""font-p-default"">Welcome to your Online Campus</p></div>, <div class=""module-content""><p class=""heading font-h6-mobile"">Module 1</p><p class=""font-p-default"">The financial goal of a firm</p></div>, <div class=""module-content""><p class=""heading font-h6-mobile"">Module 2</p><p class=""font-p-default"">Taxation and policies</p></div>, <div class=""module-content""><p class=""heading font-h6-mobile"">Module 3</p><p class=""font-p-default"">Understanding financial statements</p></div>, <div class=""module-content""><p class=""heading font-h6-mobile"">Module 4</p><p class=""font-p-default"">Analysing financial statements</p></div>, <div class=""module-content""><p class=""heading font-h6-mobile"">Module 5</p><p class=""font-p-default"">Profit planning and control</p></div>, <div class=""module-content""><p class=""heading font-h6-mobile"">Module 6</p><p class=""font-p-default"">The time value of money</p></div>, <div class=""module-content""><p class=""heading font-h6-mobile"">Module 7</p><p class=""font-p-default"">Financing</p></div>, <div class=""module-content""><p class=""heading font-h6-mobile"">Module 8</p><p class=""font-p-default"">Capital budgeting</p></div>, <div class=""module-content""><p class=""heading font-h6-mobile"">Module 9</p><p class=""font-p-default"">Managing working capital</p></div>]","['An understanding of the tax requirements for different business entities, and the financial policies and laws impacting South African firms|', 'The tools to understand and interpret income statements, balance sheets, and cash-flow statements|', 'The ability to apply the principles of budgeting to plan profits and determine future cash flow in an organisation|', 'The skills to evaluate and monitor the value of investments in long-lived assets|', '']","If you currently have finance-related responsibilities in the workplace and want to improve your understanding of the essential elements of financial management, you’ll benefit from this course| Professionals in administrative or managerial roles can consolidate their knowledge and update their skills to more actively and confidently contribute to this business function| Similarly, entrepreneurs and business owners can familiarise themselves with financial basics to better manage cash flow, profit, and investments|
",Francois Toerien,"Senior Lecturer, Department of Construction Economics and Management, UCT",https://www.getsmarter.com/rails/active_storage/representations/eyJfcmFpbHMiOnsibWVzc2FnZSI6IkJBaHBBaDBDIiwiZXhwIjpudWxsLCJwdXIiOiJibG9iX2lkIn19--e49f2d2e6fd28f7365883627a9262fc7e05201d1/eyJfcmFpbHMiOnsibWVzc2FnZSI6IkJBaDdCam9MY21WemFYcGxTU0lNTVRFd2VERXhNQVk2QmtWVSIsImV4cCI6bnVsbCwicHVyIjoidmFyaWF0aW9uIn19--e8e4d52386516ed9566f111cb5206b7b0185063d/university_of_cape_town_basics_of_financial_management_course_convenor_francois_toerien.jpg,,,,,,9,weeks,7–10 ,2021-10-11T00:00:00,2021-10-05T00:00:00,English,Gain confidence in your ability to efficiently manage finances within the South African business context.,"Mobile,Desktop,Tablet",Paid,USD,"1,015","You can pay your course fees before the course starts, or you may opt for a split payment plan on courses that are nine weeks and shorter. For courses 10 weeks and longer, there is a three-part payment plan available.",University of Cape Town,https://www.getsmarter.com/products/uct-basics-of-financial-management-online-short-course
Oxford Executive Finance Programme,Course,"[<p><p><strong>Duration</strong>: 6 weeks</p><p>The turbulent nature of the current business climate has highlighted the impact that social, technological, and governmental disruption can have on an organisation. Now, more than ever, you need a firm comprehension of finance in order to participate in financial decision-making and discussions, and deliver value to your company. </p><p>On the Oxford Executive Finance Programme from Saïd Business School, University of Oxford you’ll gain the practical knowledge and skills to understand the finances of any organisation and how they make decisions. Over the course of six weeks, you’ll also explore corporate finance in terms of capital structure, taxation and bankruptcy, and investigate the trade-offs of funding through an analysis of debt versus equity and how this choice affects an investment project’s valuation. </p><p>Through analysing current industry debates and critical expert insights, you’ll discover the key topics that are changing practices in the fast-moving world of finance, such as corporate governance, and environmental, social, and governance (ESG) factors. By the end of the programme, you’ll be able to leverage finance as part of your executive toolkit to make more informed, strategic decisions and improve overall business performance. </p></p>, <p><strong>Duration</strong>: 6 weeks</p>, <p>The turbulent nature of the current business climate has highlighted the impact that social, technological, and governmental disruption can have on an organisation. Now, more than ever, you need a firm comprehension of finance in order to participate in financial decision-making and discussions, and deliver value to your company. </p>, <p>On the Oxford Executive Finance Programme from Saïd Business School, University of Oxford you’ll gain the practical knowledge and skills to understand the finances of any organisation and how they make decisions. Over the course of six weeks, you’ll also explore corporate finance in terms of capital structure, taxation and bankruptcy, and investigate the trade-offs of funding through an analysis of debt versus equity and how this choice affects an investment project’s valuation. </p>, <p>Through analysing current industry debates and critical expert insights, you’ll discover the key topics that are changing practices in the fast-moving world of finance, such as corporate governance, and environmental, social, and governance (ESG) factors. By the end of the programme, you’ll be able to leverage finance as part of your executive toolkit to make more informed, strategic decisions and improve overall business performance. </p>]",Online,Self Paced,"[<div class=""module-content""><p class=""heading font-h6-mobile"">Orientation module</p><p class=""font-p-default"">Welcome to your Online Campus</p></div>, <div class=""module-content""><p class=""heading font-h6-mobile"">Module 1</p><p class=""font-p-default"">Valuation: Time value of money, net present value, and internal rate of return (IRR)</p></div>, <div class=""module-content""><p class=""heading font-h6-mobile"">Module 2</p><p class=""font-p-default"">Financial decision-making: Measuring risk, return, and the cost of capital</p></div>, <div class=""module-content""><p class=""heading font-h6-mobile"">Module 3</p><p class=""font-p-default"">Corporate finance: Raising capital effectively</p></div>, <div class=""module-content""><p class=""heading font-h6-mobile"">Module 4</p><p class=""font-p-default"">Exit strategies: Initial public offerings (IPOs) and mergers and acquisitions (M&amp;As)</p></div>, <div class=""module-content""><p class=""heading font-h6-mobile"">Module 5</p><p class=""font-p-default"">Corporate governance</p></div>, <div class=""module-content""><p class=""heading font-h6-mobile"">Module 6</p><p class=""font-p-default"">Environmental, social, and governance (ESG) factors</p></div>]","['A contemporary executive finance toolkit, enabling you to make more informed, strategic financial decisions|', 'The ability to confidently engage in financial discussions and communicate your decisions to stakeholders|', 'An overview of the topics that are changing financial practices such as corporate governance, and environmental, social, and governance (ESG) investing|', 'Insights into some of the critical decisions firms make based on research from leading academics, field experts, and business practitioners, as well as a global network of like-minded professionals| ', '']","This online programme is designed to empower non-financial business leaders, senior executives, managers, and business professionals with the financial proficiency to participate in key discussions and strategic decision-making at an executive level| Those aspiring to move into a strategic decision-making role will develop an understanding of corporate finance and the financial implications of their decisions, learn to better manage resources, and discover how best to use and interpret financial information to drive their business forward| This programme has no prerequisites, and participants are not required to have extensive finance experience or knowledge| On successful completion, you’ll earn a certificate of attendance from Saïd Business School, University of Oxford|",Joel Shapiro,"Lecturer in Sustainability, Yale School of Management",https://www.getsmarter.com/rails/active_storage/representations/eyJfcmFpbHMiOnsibWVzc2FnZSI6IkJBaHBBa1VJIiwiZXhwIjpudWxsLCJwdXIiOiJibG9iX2lkIn19--efbb88a4a1fb3f38183efa690d5b5eb14ee52122/eyJfcmFpbHMiOnsibWVzc2FnZSI6IkJBaDdCam9MY21WemFYcGxTU0lNTVRFd2VERXhNQVk2QmtWVSIsImV4cCI6bnVsbCwicHVyIjoidmFyaWF0aW9uIn19--e8e4d52386516ed9566f111cb5206b7b0185063d/oxford_sai%CC%88d_oxford_sai%CC%88d_executive_finance_programme_course_convenor_joel%20_shapiro.jpg,,,,,,6,weeks,7–10 ,2021-10-13T00:00:00,2021-10-05T00:00:00,English,Gain the essential corporate finance knowledge needed for strategic decision-making and delivering value at an executive level.,"Mobile,Desktop,Tablet",Paid,USD,"3,220","You can pay your course fees before the course starts, or you may opt for a split payment plan on courses that are nine weeks and shorter. For courses 10 weeks and longer, there is a three-part payment plan available.","Saïd Business School, University of Oxford",https://www.getsmarter.com/products/oxford-executive-finance-programme
Financing and Valuing Commercial Property,Course,"[<p><p><strong>Duration</strong>: 8 weeks (excluding orientation)</p><p>As data becomes more available and less well-known property types become more established, investors are increasingly looking to diversify their portfolios and gain access to the different risk-and-return profiles these sectors can potentially offer. In a constrained property environment, investors and developers with an understanding of the macroeconomic drivers that influence the development of commercial property in a country stand to benefit the most. This includes the knowledge of the economics underpinning financing and valuing commercial property, including valuation theory explored in a commercial property context, and the use of financial modelling to forecast returns. </p><p>The Financing and Valuing Commercial Property online short course from the University of Cape Town (UCT) provides a sound understanding of the economics underpinning the investing in commercial property, as well as insight into the specialised tools required for property valuation. </p><p>Guided by UCT faculty with a knowledge of property feasibility analysis, valuation, and property finance, the course offers theoretical perspectives and practical approaches to commercial property investment. Understand different types of commercial properties, analyse the market, and discover investment vehicles. Finally, explore a broad overview of the South African listed property market and how it can be leveraged as an investment opportunity. </p></p>, <p><strong>Duration</strong>: 8 weeks (excluding orientation)</p>, <p>As data becomes more available and less well-known property types become more established, investors are increasingly looking to diversify their portfolios and gain access to the different risk-and-return profiles these sectors can potentially offer. In a constrained property environment, investors and developers with an understanding of the macroeconomic drivers that influence the development of commercial property in a country stand to benefit the most. This includes the knowledge of the economics underpinning financing and valuing commercial property, including valuation theory explored in a commercial property context, and the use of financial modelling to forecast returns. </p>, <p>The Financing and Valuing Commercial Property online short course from the University of Cape Town (UCT) provides a sound understanding of the economics underpinning the investing in commercial property, as well as insight into the specialised tools required for property valuation. </p>, <p>Guided by UCT faculty with a knowledge of property feasibility analysis, valuation, and property finance, the course offers theoretical perspectives and practical approaches to commercial property investment. Understand different types of commercial properties, analyse the market, and discover investment vehicles. Finally, explore a broad overview of the South African listed property market and how it can be leveraged as an investment opportunity. </p>]",Online,Self Paced,"[<div class=""module-content""><p class=""heading font-h6-mobile"">Orientation module</p><p class=""font-p-default"">Welcome to your Online Campus</p></div>, <div class=""module-content""><p class=""heading font-h6-mobile"">Module 1</p><p class=""font-p-default"">Commercial property: Analysing successful factors</p></div>, <div class=""module-content""><p class=""heading font-h6-mobile"">Module 2</p><p class=""font-p-default"">Macroeconomic drivers of property</p></div>, <div class=""module-content""><p class=""heading font-h6-mobile"">Module 3</p><p class=""font-p-default"">Commercial property contracts and funding mechanisms</p></div>, <div class=""module-content""><p class=""heading font-h6-mobile"">Module 4</p><p class=""font-p-default"">Predicting returns using financial modelling</p></div>, <div class=""module-content""><p class=""heading font-h6-mobile"">Module 5</p><p class=""font-p-default"">Property valuation methods</p></div>, <div class=""module-content""><p class=""heading font-h6-mobile"">Module 6</p><p class=""font-p-default"">Applied property valuation</p></div>, <div class=""module-content""><p class=""heading font-h6-mobile"">Module 7</p><p class=""font-p-default"">Property investment alternatives</p></div>, <div class=""module-content""><p class=""heading font-h6-mobile"">Module 8</p><p class=""font-p-default"">South African listed property market: REITs</p></div>]","['The ability to identify and leverage property benchmarking tools and data analysis techniques to drive strategic commercial property investment decisions in your business|', 'Practical templates for financial modelling and valuation to help forecast potential returns more accurately|', 'Insight into the macroeconomic drivers of commercial property value and the different commercial property asset types in the South African market|', '', '']","Investors and developers seeking to advance their understanding of the macroeconomic conditions that drive commercial property in South Africa will benefit from the focus on economics underpinning financing and valuing commercial property| Applicable not only to property consultants and property portfolio managers, but to investment analysts and asset managers, you’ll be exposed to the prediction of returns using financial modelling, discover property investment opportunities, and learn to apply valuation theory principles to real-world commercial property scenarios| You’ll investigate Real Estate Investment Trusts (REITs) and other alternative property investments in order to better understand investment opportunities from different asset classes, and the other options available in a challenging local investment environment|This course is certified by The Engineering Council of South Africa (ECSA) for CPD points| The course has an estimated 80 hours of learning and South African engineering professionals can earn up to eight CPD credits|*International students need to consult their national professional engineering bodies to check whether this course is recognised for points towards maintaining professional status|*Should you wish to claim CPD activity, the onus is upon you| The University of Cape Town and GetSmarter accept no responsibility| If you would like to claim validation or points, use the ECSA validation number UCTFIP21|",Saul Nurick,"Senior Lecturer, College of Accounting, UCT",https://www.getsmarter.com/rails/active_storage/representations/eyJfcmFpbHMiOnsibWVzc2FnZSI6IkJBaHBBb2NGIiwiZXhwIjpudWxsLCJwdXIiOiJibG9iX2lkIn19--5c51049ca0f941929ffaf0f60322f552b1e6a4e4/eyJfcmFpbHMiOnsibWVzc2FnZSI6IkJBaDdCam9MY21WemFYcGxTU0lNTVRFd2VERXhNQVk2QmtWVSIsImV4cCI6bnVsbCwicHVyIjoidmFyaWF0aW9uIn19--e8e4d52386516ed9566f111cb5206b7b0185063d/university_of_cape_town_financing_and_valuing_commercial_property_course_convenor_saul_nurick.jpg,,,,,,8,weeks,6–8 ,2021-09-27T00:00:00,2021-09-21T00:00:00,English,Apply advanced valuation techniques and financial modelling to forecast commercial property returns and make data-driven investment decisions.,"Mobile,Desktop,Tablet",Paid,USD,980,"You can pay your course fees before the course starts, or you may opt for a split payment plan on courses that are nine weeks and shorter. For courses 10 weeks and longer, there is a three-part payment plan available.",University of Cape Town,https://www.getsmarter.com/products/uct-financing-and-valuing-commercial-property-online-short-course
