title,learn_type,description,delivery_method,instruction_type,content,what_will_learn,target_students,instructor|1|name,instructor|1|designation,instructor|1|instructor_image,instructor|2|name,instructor|2|designation,instructor|2|instructor_image,review|1|reviewer_name,review|1|review,total_duration,total_duration_unit,recommended_effort_per_week,batch|1|batch_start_date,enrollment_end_date,languages,short_description,accessibilities,pricing_type,currency,regular_price,additional_pricing_details,institute,partner_course_url
Sustainable Finance and Investment,Course,"[<p><p><strong>Duration</strong>: 6 weeks (excluding orientation)</p><p>Environmental, social, and governance (ESG) issues continue to gain momentum. But achieving targets like a net zero economy and equality will need the support of financial services.<sup>1</sup> What’s more, companies have realized that integrating ESG criteria into business decisions goes beyond simply being more sustainable — it’s profitable too.
</p><p>The Sustainable Finance and Investment online program from the Yale School of Management Executive Education examines the ESG ecosystem: the terminology, activity, drivers, and participants. With this industry road map, you’ll become equipped to understand the core of sustainable finance systems with the skills to accelerate this shift in business. You’ll examine the challenges and opportunities of ESG data within the context of investment decision-making; explore its integration in asset-pricing models, portfolio management, and investment products; and learn how it can be used to determine investment strategies. The program features real-time data, gamified investment role playing, and interviews with a multitude of industry experts, giving you the practical skills, insights, and metrics to drive sustainable financial performance and investment strategies in your organization or career.
</p><p><em><sup>1</sup> <a data-ol-has-click-handler="""" href=""https://www.ey.com/en_za/financial-services/how-can-sustainable-finance-support-the-road-to-net-zero"" target=""_blank"">EY</a> (Jan, 2021).</em>
</p></p>, <p><strong>Duration</strong>: 6 weeks (excluding orientation)</p>, <p>Environmental, social, and governance (ESG) issues continue to gain momentum. But achieving targets like a net zero economy and equality will need the support of financial services.<sup>1</sup> What’s more, companies have realized that integrating ESG criteria into business decisions goes beyond simply being more sustainable — it’s profitable too.
</p>, <p>The Sustainable Finance and Investment online program from the Yale School of Management Executive Education examines the ESG ecosystem: the terminology, activity, drivers, and participants. With this industry road map, you’ll become equipped to understand the core of sustainable finance systems with the skills to accelerate this shift in business. You’ll examine the challenges and opportunities of ESG data within the context of investment decision-making; explore its integration in asset-pricing models, portfolio management, and investment products; and learn how it can be used to determine investment strategies. The program features real-time data, gamified investment role playing, and interviews with a multitude of industry experts, giving you the practical skills, insights, and metrics to drive sustainable financial performance and investment strategies in your organization or career.
</p>, <p><em><sup>1</sup> <a data-ol-has-click-handler="""" href=""https://www.ey.com/en_za/financial-services/how-can-sustainable-finance-support-the-road-to-net-zero"" target=""_blank"">EY</a> (Jan, 2021).</em>
</p>]",Online,Self Paced,"[<div class=""module-content""><p class=""heading font-h6-mobile"">Orientation module</p><p class=""font-p-default"">Welcome to your Online Campus</p></div>, <div class=""module-content""><p class=""heading font-h6-mobile"">Module 1</p><p class=""font-p-default"">Sustainable investing strategies</p></div>, <div class=""module-content""><p class=""heading font-h6-mobile"">Module 2</p><p class=""font-p-default"">Key organizations and tools in sustainable finance</p></div>, <div class=""module-content""><p class=""heading font-h6-mobile"">Module 3</p><p class=""font-p-default"">ESG data, metrics, and analytics</p></div>, <div class=""module-content""><p class=""heading font-h6-mobile"">Module 4</p><p class=""font-p-default"">Asset pricing and portfolio management</p></div>, <div class=""module-content""><p class=""heading font-h6-mobile"">Module 5</p><p class=""font-p-default"">Impact metrics and investing</p></div>, <div class=""module-content""><p class=""heading font-h6-mobile"">Module 6</p><p class=""font-p-default"">Diversity of ESG investment products</p></div>]","['Tools, frameworks, and insights to make educated decisions for your sustainable financial and investment goals|', 'A holistic understanding of the ESG ecosystem, data and metrics, and how this can be leveraged to inform your investment strategies|', 'Industry knowledge from Yale SOM faculty and numerous guest experts, empowering you to drive sustainable finance in business|', '', '']","This program has been designed for business leaders and professionals in strategic roles who are aiming to make more informed, sustainable investment decisions| It will be beneficial to individuals from a wide range of industries, including investment, asset management, and banking| They’ll gain the skills to accelerate the transformation towards sustainable finance in their organizations, and learn to better report on sustainable investment returns| Consultants working in sustainability and project execution, as well as public policy professionals, will similarly gain insight into the ESG data and metrics that help shape sustainable investments| How does this program differ from the Corporate Sustainability Management: Risk, Profit, and Purpose online program?The Sustainable Finance and Investment online program focuses primarily on equipping you to make more informed analyses and decisions when investing in sustainable assets and products| The Corporate Sustainability Management: Risk, Profit, and Purpose online program, on the other hand, is designed to help you embed sustainability and sustainable practices into the core of your business strategies|",Dr Todd Cort,"Associate Professor of Finance, LSE Department of Finance",https://www.getsmarter.com/rails/active_storage/representations/eyJfcmFpbHMiOnsibWVzc2FnZSI6IkJBaHBBalFLIiwiZXhwIjpudWxsLCJwdXIiOiJibG9iX2lkIn19--18983742bca36bc2338b867eaea132e4a0bee6f1/eyJfcmFpbHMiOnsibWVzc2FnZSI6IkJBaDdCam9MY21WemFYcGxTU0lNTVRFd2VERXhNQVk2QmtWVSIsImV4cCI6bnVsbCwicHVyIjoidmFyaWF0aW9uIn19--e8e4d52386516ed9566f111cb5206b7b0185063d/yale_school_of_management_executive_education_corporate_sustainability_management_program_course_convenor_todd_court.jpg,,,,,,6,weeks,5–8 ,2021-10-27T00:00:00,2021-10-19T00:00:00,English,"Gain a competitive advantage when you merge environmental, social, and governance factors into your financial and investment decisions.","Mobile,Desktop,Tablet",Paid,USD,"2,900","You can pay your course fees before the course starts, or you may opt for a split payment plan on courses that are nine weeks and shorter. For courses 10 weeks and longer, there is a three-part payment plan available.",Yale University,https://www.getsmarter.com/products/yale-som-executive-education-sustainable-finance-and-investment-online-program
Public Sector Audit and Governance,Course,"[<p><p><strong>Duration</strong>: 12 (excluding orientation)</p><p>Corruption and irresponsible spending has long been a subject of indignation. Financial misconduct and poor reporting has led to an increase in demand, from both the public and the Auditor-General (AGSA), for better fiscal accountability and transparency throughout the nation’s municipalities. </p><p>The Public Sector Audit and Governance online short course from the University of Cape Town (UCT) equips you with the tools to improve transparency in public sector governance, both from within government and contracted private entities. Over 12 weeks, you’ll explore the public sector audit environment and the legislation that underpins it, before engaging in an audit report for a public sector entity, based on applicable findings. You’ll also gain an understanding of the framework that promotes good governance, accountability, and ethics in the public sector, and the challenges faced by internal auditors in the South African context.</p></p>, <p><strong>Duration</strong>: 12 (excluding orientation)</p>, <p>Corruption and irresponsible spending has long been a subject of indignation. Financial misconduct and poor reporting has led to an increase in demand, from both the public and the Auditor-General (AGSA), for better fiscal accountability and transparency throughout the nation’s municipalities. </p>, <p>The Public Sector Audit and Governance online short course from the University of Cape Town (UCT) equips you with the tools to improve transparency in public sector governance, both from within government and contracted private entities. Over 12 weeks, you’ll explore the public sector audit environment and the legislation that underpins it, before engaging in an audit report for a public sector entity, based on applicable findings. You’ll also gain an understanding of the framework that promotes good governance, accountability, and ethics in the public sector, and the challenges faced by internal auditors in the South African context.</p>]",Online,Self Paced,"[<div class=""module-content""><p class=""heading font-h6-mobile"">Orientation module</p><p class=""font-p-default"">Welcome to your Online Campus</p></div>, <div class=""module-content""><p class=""heading font-h6-mobile"">Module 1</p><p class=""font-p-default"">Governance in the private and public sectors</p></div>, <div class=""module-content""><p class=""heading font-h6-mobile"">Module 2</p><p class=""font-p-default"">An auditor’s professional conduct</p></div>, <div class=""module-content""><p class=""heading font-h6-mobile"">Module 3</p><p class=""font-p-default"">Organisational risks and controls</p></div>, <div class=""module-content""><p class=""heading font-h6-mobile"">Module 4</p><p class=""font-p-default"">The pre-engagement and planning stages of an audit</p></div>, <div class=""module-content""><p class=""heading font-h6-mobile"">Module 5</p><p class=""font-p-default"">Audit risk and the audit plan</p></div>, <div class=""module-content""><p class=""heading font-h6-mobile"">Module 6</p><p class=""font-p-default"">Risk response and audit reporting</p></div>, <div class=""module-content""><p class=""heading font-h6-mobile"">Module 7</p><p class=""font-p-default"">The public sector audit environment</p></div>, <div class=""module-content""><p class=""heading font-h6-mobile"">Module 8</p><p class=""font-p-default"">The audit of performance information</p></div>, <div class=""module-content""><p class=""heading font-h6-mobile"">Module 9</p><p class=""font-p-default"">A performance audit</p></div>, <div class=""module-content""><p class=""heading font-h6-mobile"">Module 10</p><p class=""font-p-default"">Internal auditing and forensic auditing</p></div>, <div class=""module-content""><p class=""heading font-h6-mobile"">Module 11</p><p class=""font-p-default"">Governance, accountability, and ethics</p></div>, <div class=""module-content""><p class=""heading font-h6-mobile"">Module 12</p><p class=""font-p-default"">The framework for good governance in the public sector</p></div>]","['Knowledge of the public sector audit environment and the legislation that underpins it|', 'The ability to evaluate the performance information of a public sector entity|', 'The skills to develop an audit report for a public sector entity based on audit findings|', 'An understanding of the framework that promotes good governance, accountability, and ethics in the public sector|', '']","This course is designed for public sector professionals looking to specialise in public sector auditing| It’s equally aimed at professionals in the private sector who are looking to upskill or reskill themselves in public sector auditing, as well as improve the accountability and transparency of their division| Such professionals could include, but are not limited to, accountants, public sector managers, branch managers, compliance managers, or finance managers| Students will gain crucial insights into the workings of the public sector and will be better equipped to work within these institutions|",Sihaam Shamsoodien,"Associate Professor, Department of Finance and Tax, UCT",https://www.getsmarter.com/rails/active_storage/representations/eyJfcmFpbHMiOnsibWVzc2FnZSI6IkJBaHBBa0FQIiwiZXhwIjpudWxsLCJwdXIiOiJibG9iX2lkIn19--456727ccf31b2c677821e8b91c445f1f5565b28d/eyJfcmFpbHMiOnsibWVzc2FnZSI6IkJBaDdCam9MY21WemFYcGxTU0lNTVRFd2VERXhNQVk2QmtWVSIsImV4cCI6bnVsbCwicHVyIjoidmFyaWF0aW9uIn19--e8e4d52386516ed9566f111cb5206b7b0185063d/university_of_cape_town_public_sector_audit_and_governance_course_convenor_sihaam_shamsoodien.jpg,,,,,,12,weeks,10–15 ,2022-01-31T00:00:00,2022-01-25T00:00:00,English,Learn more about the role of auditing and governance in the public sector to maximise accountability and improve transparency.,"Mobile,Desktop,Tablet",Paid,USD,833,"You can pay your course fees before the course starts, or you may opt for a split payment plan on courses that are nine weeks and shorter. For courses 10 weeks and longer, there is a three-part payment plan available.",University of Cape Town,https://www.getsmarter.com/products/uct-public-sector-audit-and-governance-online-short-course
Managerial Finance,Course,"[<p><p><strong>Duration:</strong> 6 weeks (excluding orientation)<br/></p><p>To effectively drive organisational success, business leaders and managers across functions require a firm grasp of finance. It’s a key component to understanding how an organisation operates, and these professionals need to be commercially-minded to participate in financial discussions and decision-making. </p><p>The Managerial Finance online certificate course from LSE equips you with a practical grounding in modern finance. Over the course of six short weeks, you’ll develop the tools to understand corporate finance, financial statements and reports, and fundamentals such as the time value of money. You’ll also learn how to apply these to your business context through forecasting methods, project evaluation, realistic performance plans, and the monitoring of financial outcomes. Increase your managerial impact with stronger financial insight, and make more informed contributions to organisational discussions and decisions.</p></p>, <p><strong>Duration:</strong> 6 weeks (excluding orientation)<br/></p>, <p>To effectively drive organisational success, business leaders and managers across functions require a firm grasp of finance. It’s a key component to understanding how an organisation operates, and these professionals need to be commercially-minded to participate in financial discussions and decision-making. </p>, <p>The Managerial Finance online certificate course from LSE equips you with a practical grounding in modern finance. Over the course of six short weeks, you’ll develop the tools to understand corporate finance, financial statements and reports, and fundamentals such as the time value of money. You’ll also learn how to apply these to your business context through forecasting methods, project evaluation, realistic performance plans, and the monitoring of financial outcomes. Increase your managerial impact with stronger financial insight, and make more informed contributions to organisational discussions and decisions.</p>]",Online,Self Paced,"[<div class=""module-content""><p class=""heading font-h6-mobile"">Orientation Module</p><p class=""font-p-default"">Welcome to your Online Campus</p></div>, <div class=""module-content""><p class=""heading font-h6-mobile"">Module 1</p><p class=""font-p-default"">Financial statement analysis</p></div>, <div class=""module-content""><p class=""heading font-h6-mobile"">Module 2</p><p class=""font-p-default"">Financial forecasting</p></div>, <div class=""module-content""><p class=""heading font-h6-mobile"">Module 3</p><p class=""font-p-default"">Discounted cash flow analysis</p></div>, <div class=""module-content""><p class=""heading font-h6-mobile"">Module 4</p><p class=""font-p-default"">Optimal investing</p></div>, <div class=""module-content""><p class=""heading font-h6-mobile"">Module 5</p><p class=""font-p-default"">Funding strategies</p></div>, <div class=""module-content""><p class=""heading font-h6-mobile"">Module 6</p><p class=""font-p-default"">Valuing entire companies</p></div>]","['A financial toolkit that will assist you in making strategic managerial and business decisions in the modern work environment|', 'An understanding of financial reports, enabling you to analyse the financial health of an organisation and budget for future success|', 'The ability to apply valuation principles and techniques to companies|', '', '']","As employees are promoted to more senior positions or management, these new roles often call for greater financial accountability| This online certificate course focuses on providing vital corporate finance knowledge and skills to non-financial managers, and is geared towards anyone in a managerial or leadership position – as well as those aspiring towards one| You’ll develop your commercial acumen, as well as a practical understanding of the dynamic between a company's finances and its non-financial departments and projects|This course is certified by the United Kingdom CPD Certification Service, and may be applicable to individuals who are members of, or are associated with, UK-based professional bodies| The course has an estimated 65 hours of learning|Note: should you wish to claim CPD activity, the onus is upon you| The London School of Economics and Political Science (LSE) and GetSmarter accept no responsibility, and cannot be held responsible, for the claiming or validation of hours or points|",Dirk Jenter,"Lecturer in the College of Accounting, UCT",https://www.getsmarter.com/rails/active_storage/representations/eyJfcmFpbHMiOnsibWVzc2FnZSI6IkJBaHBHdz09IiwiZXhwIjpudWxsLCJwdXIiOiJibG9iX2lkIn19--d3fab3667de946a108d78ffd4ab1737f2849f1a1/eyJfcmFpbHMiOnsibWVzc2FnZSI6IkJBaDdCam9MY21WemFYcGxTU0lNTVRFd2VERXhNQVk2QmtWVSIsImV4cCI6bnVsbCwicHVyIjoidmFyaWF0aW9uIn19--e8e4d52386516ed9566f111cb5206b7b0185063d/lse_managerial_finance_course_convenor_dirk_jenter.jpg,,,,,,6,weeks,8–12 ,2021-10-27T00:00:00,2021-10-19T00:00:00,English,Make informed managerial and investment decisions with a practical understanding of your organisation’s financial health.,"Mobile,Desktop,Tablet",Paid,USD,"3,014","You can pay your course fees before the course starts, or you may opt for a split payment plan on courses that are nine weeks and shorter. For courses 10 weeks and longer, there is a three-part payment plan available.",The London School of Economics and Political Science,https://www.getsmarter.com/products/lse-managerial-finance-online-certificate-course
Investment Management,Course,"[<p><p><strong>Duration</strong>: 8 weeks (excluding orientation)<br/></p><p>Amid falling consumer confidence in traditional portfolio management, South Africans are more willing than ever to take the leap into individual investing – with modern technology providing the tools to do so. However, in order to make informed, responsible investment decisions, it’s necessary to understand the investment environment.</p><p>The Investment Management online short course from the University of Cape Town (UCT) offers a practical guide to the world of financial investments. The course does not offer specific investment advice, but rather empowers you with the skills needed to intelligently manage an investment portfolio. Learn to choose the right company, fund, and investment strategy with confidence.</p></p>, <p><strong>Duration</strong>: 8 weeks (excluding orientation)<br/></p>, <p>Amid falling consumer confidence in traditional portfolio management, South Africans are more willing than ever to take the leap into individual investing – with modern technology providing the tools to do so. However, in order to make informed, responsible investment decisions, it’s necessary to understand the investment environment.</p>, <p>The Investment Management online short course from the University of Cape Town (UCT) offers a practical guide to the world of financial investments. The course does not offer specific investment advice, but rather empowers you with the skills needed to intelligently manage an investment portfolio. Learn to choose the right company, fund, and investment strategy with confidence.</p>]",Online,Self Paced,"[<div class=""module-content""><p class=""heading font-h6-mobile"">Orientation module</p><p class=""font-p-default"">Welcome to your Online Campus</p></div>, <div class=""module-content""><p class=""heading font-h6-mobile"">Module 1</p><p class=""font-p-default"">An introduction to investing</p></div>, <div class=""module-content""><p class=""heading font-h6-mobile"">Module 2</p><p class=""font-p-default"">The effects of the economy</p></div>, <div class=""module-content""><p class=""heading font-h6-mobile"">Module 3</p><p class=""font-p-default"">The share market</p></div>, <div class=""module-content""><p class=""heading font-h6-mobile"">Module 4</p><p class=""font-p-default"">Interest bearing investments</p></div>, <div class=""module-content""><p class=""heading font-h6-mobile"">Module 5</p><p class=""font-p-default"">Other asset classes and investments</p></div>, <div class=""module-content""><p class=""heading font-h6-mobile"">Module 6</p><p class=""font-p-default"">Pooled investing</p></div>, <div class=""module-content""><p class=""heading font-h6-mobile"">Module 7</p><p class=""font-p-default"">Offshore investments</p></div>, <div class=""module-content""><p class=""heading font-h6-mobile"">Module 8</p><p class=""font-p-default"">Investment philosophies and constraints</p></div>]","['The confidence to intelligently manage an investment portfolio alongside a financial advisor|', 'The ability to estimate returns on equity investments and investigate offshore financial investments|', 'Knowledge of key investment philosophies and constraints, and an understanding of the fundamental principles of pooled investing|', 'The ability to distinguish between alternative asset classes, financial markets and products, as well as the understanding to make informed investment decisions|', '']","This course is ideal for anyone interested in investing, but who has no formal knowledge or qualification of the subject| It will also benefit professionals who have a background in finance, but little exposure to investing specifically| These professionals will gain a greater understanding of investment products, including offshore investments, and asset classes such as cryptocurrencies| Through the course, students will become equipped to consider investments from a global perspective, while working towards their own financial reward|
",Francois Toerien,"Associate Professorial Lecturer and MSc Programme Director, Department of Accounting, LSE",https://www.getsmarter.com/rails/active_storage/representations/eyJfcmFpbHMiOnsibWVzc2FnZSI6IkJBaHBBaDBDIiwiZXhwIjpudWxsLCJwdXIiOiJibG9iX2lkIn19--e49f2d2e6fd28f7365883627a9262fc7e05201d1/eyJfcmFpbHMiOnsibWVzc2FnZSI6IkJBaDdCam9MY21WemFYcGxTU0lNTVRFd2VERXhNQVk2QmtWVSIsImV4cCI6bnVsbCwicHVyIjoidmFyaWF0aW9uIn19--e8e4d52386516ed9566f111cb5206b7b0185063d/university_of_cape_town_basics_of_financial_management_course_convenor_francois_toerien.jpg,,,,,,8,weeks,7–10 ,2021-10-18T00:00:00,2021-10-12T00:00:00,English,Gain practical insights into South African and offshore investing.,"Mobile,Desktop,Tablet",Paid,USD,945,"You can pay your course fees before the course starts, or you may opt for a split payment plan on courses that are nine weeks and shorter. For courses 10 weeks and longer, there is a three-part payment plan available.",University of Cape Town,https://www.getsmarter.com/products/uct-investment-management-online-short-course
