title,learn_type,description,delivery_method,instruction_type,content,what_will_learn,target_students,instructor|1|name,instructor|1|designation,instructor|1|instructor_image,instructor|2|name,instructor|2|designation,instructor|2|instructor_image,review|1|reviewer_name,review|1|review,total_duration,total_duration_unit,recommended_effort_per_week,batch|1|batch_start_date,enrollment_end_date,languages,short_description,accessibilities,pricing_type,currency,regular_price,additional_pricing_details,institute,partner_course_url
Accounting,Course,"[<p><p><strong>Duration</strong>: 9 weeks (excluding orientation)<br/></p><p>The success of any organisation relies, in part, on sound financial management. As a result, personnel with the skills to manage and control the monthly accounting cycle are an indispensable part of a business. </p><p>The University of Cape Town (UCT) Accounting online short course provides an overview of core accounting principles and practices for those needing to assess, record, and report financial information. Guided by industry experts from UCT, you’ll gain a practical grounding in budgeting and business tax, and learn how to draft reports, like a Statement of Comprehensive Income or Cash Flows. </p><p>You’ll receive study assistance from our student support team throughout the course, and leave with the confidence to manage credit and apply internal controls.</p></p>, <p><strong>Duration</strong>: 9 weeks (excluding orientation)<br/></p>, <p>The success of any organisation relies, in part, on sound financial management. As a result, personnel with the skills to manage and control the monthly accounting cycle are an indispensable part of a business. </p>, <p>The University of Cape Town (UCT) Accounting online short course provides an overview of core accounting principles and practices for those needing to assess, record, and report financial information. Guided by industry experts from UCT, you’ll gain a practical grounding in budgeting and business tax, and learn how to draft reports, like a Statement of Comprehensive Income or Cash Flows. </p>, <p>You’ll receive study assistance from our student support team throughout the course, and leave with the confidence to manage credit and apply internal controls.</p>]",Online,Self Paced,"[<div class=""module-content""><p class=""heading font-h6-mobile"">Orientation module</p><p class=""font-p-default"">Welcome to your Online Campus</p></div>, <div class=""module-content""><p class=""heading font-h6-mobile"">Module 1</p><p class=""font-p-default"">The fundamentals of accounting: Part 1</p></div>, <div class=""module-content""><p class=""heading font-h6-mobile"">Module 2</p><p class=""font-p-default"">The fundamentals of accounting: Part 2</p></div>, <div class=""module-content""><p class=""heading font-h6-mobile"">Module 3</p><p class=""font-p-default"">Drafting financial statements: Part 1</p></div>, <div class=""module-content""><p class=""heading font-h6-mobile"">Module 4</p><p class=""font-p-default"">Drafting financial statements: Part 2</p></div>, <div class=""module-content""><p class=""heading font-h6-mobile"">Module 5</p><p class=""font-p-default"">Drafting budgets</p></div>, <div class=""module-content""><p class=""heading font-h6-mobile"">Module 6</p><p class=""font-p-default"">Measuring and evaluating financial performance</p></div>, <div class=""module-content""><p class=""heading font-h6-mobile"">Module 7</p><p class=""font-p-default"">Internal control and accounting systems</p></div>, <div class=""module-content""><p class=""heading font-h6-mobile"">Module 8</p><p class=""font-p-default"">Business tax</p></div>, <div class=""module-content""><p class=""heading font-h6-mobile"">Module 9</p><p class=""font-p-default"">Credit management and control</p></div>]","['The ability to evaluate the long- and short-term financial performance of your company|', 'A grounding in credit management, and strategies to minimise associated risks|', 'The skills to navigate the complexities of business tax and undertake eFiling|', 'The expertise to manage cash flow and implement internal controls to ensure reliable financial reporting|', '']","This course is designed for professionals who are currently working in a supporting role within an accounts or finance department and want to strengthen their skills and bolster performance| It’s also ideal for aspiring accounting technicians and financial support staff, and for those looking for the technical expertise to manage their own personal and professional finances|
",Shelly Herbert,"Senior Lecturer, College of Accounting, UCT",https://www.getsmarter.com/rails/active_storage/representations/eyJfcmFpbHMiOnsibWVzc2FnZSI6IkJBaHBBdElCIiwiZXhwIjpudWxsLCJwdXIiOiJibG9iX2lkIn19--c71600527a243cea56ac688de68a9f7e2d7f5606/eyJfcmFpbHMiOnsibWVzc2FnZSI6IkJBaDdCam9MY21WemFYcGxTU0lNTVRFd2VERXhNQVk2QmtWVSIsImV4cCI6bnVsbCwicHVyIjoidmFyaWF0aW9uIn19--e8e4d52386516ed9566f111cb5206b7b0185063d/university_of_cape_town_accounting_course_convenor_shelly_herbert.jpg,,,,Laurie RC Funk,"The course provided a solid foundation to corporate finance. I appreciated that it included activities that required analytical thinking and technical skills that enhanced my understanding and were challenging. I now have a working knowledge about the significance of corporate governance and structure, how the financial markets work and the ways financial metrics are used for financial decision-making.",9,weeks,7–10 ,2021-09-23T00:00:00,2021-09-17T00:00:00,English,Develop the technical expertise to manage the finance-related aspects of your business.,"Mobile,Desktop,Tablet",Paid,USD,"1,015","You can pay your course fees before the course starts, or you may opt for a split payment plan on courses that are nine weeks and shorter. For courses 10 weeks and longer, there is a three-part payment plan available.",University of Cape Town,https://www.getsmarter.com/products/uct-accounting-online-short-course
Payroll and Tax Administration,Course,"[<p><p><strong>Duration</strong>: 6 weeks (excluding orientation)<br/></p><p>Poor management of payroll and tax matters can cost a business significantly in both time and money, and is likely to frustrate and demotivate employees. Effective payroll administrators that are familiar with current legislation and best practices are, therefore, a valuable asset to any organisation. </p><p>The University of Cape Town (UCT) Payroll and Tax Administration online short course is designed to empower you with the skills to effectively perform these vital bookkeeping-related functions. You’ll be introduced to key concepts underpinning individual and business taxation, and gain an understanding of how eFiling and VAT returns work. You’ll also learn about different payroll systems and packages, and acquire the tools to manage employees’ remuneration effectively and efficiently to ensure a happy workforce.</p></p>, <p><strong>Duration</strong>: 6 weeks (excluding orientation)<br/></p>, <p>Poor management of payroll and tax matters can cost a business significantly in both time and money, and is likely to frustrate and demotivate employees. Effective payroll administrators that are familiar with current legislation and best practices are, therefore, a valuable asset to any organisation. </p>, <p>The University of Cape Town (UCT) Payroll and Tax Administration online short course is designed to empower you with the skills to effectively perform these vital bookkeeping-related functions. You’ll be introduced to key concepts underpinning individual and business taxation, and gain an understanding of how eFiling and VAT returns work. You’ll also learn about different payroll systems and packages, and acquire the tools to manage employees’ remuneration effectively and efficiently to ensure a happy workforce.</p>]",Online,Self Paced,"[<div class=""module-content""><p class=""heading font-h6-mobile"">Orientation module</p><p class=""font-p-default"">Welcome to your Online Campus</p></div>, <div class=""module-content""><p class=""heading font-h6-mobile"">Module 1</p><p class=""font-p-default"">Basic tax concepts for individuals</p></div>, <div class=""module-content""><p class=""heading font-h6-mobile"">Module 2</p><p class=""font-p-default"">Advanced tax concepts for individuals</p></div>, <div class=""module-content""><p class=""heading font-h6-mobile"">Module 3</p><p class=""font-p-default"">Basic tax concepts for business</p></div>, <div class=""module-content""><p class=""heading font-h6-mobile"">Module 4</p><p class=""font-p-default"">Advanced tax concepts for business</p></div>, <div class=""module-content""><p class=""heading font-h6-mobile"">Module 5</p><p class=""font-p-default"">Payroll – principles and legislation</p></div>, <div class=""module-content""><p class=""heading font-h6-mobile"">Module 6</p><p class=""font-p-default"">Payroll administration</p></div>]","['An up-to-date understanding of payroll systems and tax procedures that can be applied immediately to your context|', 'The knowledge to ensure organisational compliance with current legislation and regulations|', 'The skills to calculate and allocate payroll, while taking employee leave into account|', '', '']","As this course covers current legislation and practices, established payroll administrators, finance clerks, bookkeepers, and business owners will be able to update current skills and refresh their tax legislation knowledge| Those looking to develop their careers and move into the administrative, finance, or human resources function of a business will also likely benefit from this curriculum| No prior knowledge of bookkeeping, accounting, or finance is needed for this course|",Riley Carpenter,"Associate Professor, Department of Finance and Tax, UCT",https://www.getsmarter.com/rails/active_storage/representations/eyJfcmFpbHMiOnsibWVzc2FnZSI6IkJBaHBBcFVEIiwiZXhwIjpudWxsLCJwdXIiOiJibG9iX2lkIn19--d605e5efc1699b34d09679ce10ebea91f9fa1203/eyJfcmFpbHMiOnsibWVzc2FnZSI6IkJBaDdCam9MY21WemFYcGxTU0lNTVRFd2VERXhNQVk2QmtWVSIsImV4cCI6bnVsbCwicHVyIjoidmFyaWF0aW9uIn19--e8e4d52386516ed9566f111cb5206b7b0185063d/university_of_cape_town_payroll_and_tax_administration_course_convenor_riley_carpenter.jpg,,,,,,6,weeks,7–10 ,2021-10-14T00:00:00,2021-10-08T00:00:00,English,Explore corporate taxation and learn how to effectively manage employee compensation.,"Mobile,Desktop,Tablet",Paid,USD,945,"You can pay your course fees before the course starts, or you may opt for a split payment plan on courses that are nine weeks and shorter. For courses 10 weeks and longer, there is a three-part payment plan available.",University of Cape Town,https://www.getsmarter.com/products/uct-payroll-and-tax-administration-online-short-course
Financial Modelling and Analysis,Course,"[<p><p><strong>Duration</strong>: 8 weeks (excluding orientation)</p><p>Financial modelling skills are used to forecast the financial performance of a business, or to compare it to its industry competitors. The Financial Modelling and Analysis online short course from the University of Cape Town (UCT) introduces you to the fundamental concepts required for Excel-based modelling and forecasting. On it, you’ll develop the skills to create a mathematical model in Microsoft Excel that reflects the historical, current, or projected value or financial performance of an asset, stock, or investment. Guided by expert faculty, you’ll learn to recommend strategic business decisions with the use of financial modelling, and create a discounted cash flow analysis using financial forecasts. </p><p>By the end of this course, you’ll have explored how to build revenue models, determine realistic forecast assumptions, and learned how historic data is forecast into the future.</p></p>, <p><strong>Duration</strong>: 8 weeks (excluding orientation)</p>, <p>Financial modelling skills are used to forecast the financial performance of a business, or to compare it to its industry competitors. The Financial Modelling and Analysis online short course from the University of Cape Town (UCT) introduces you to the fundamental concepts required for Excel-based modelling and forecasting. On it, you’ll develop the skills to create a mathematical model in Microsoft Excel that reflects the historical, current, or projected value or financial performance of an asset, stock, or investment. Guided by expert faculty, you’ll learn to recommend strategic business decisions with the use of financial modelling, and create a discounted cash flow analysis using financial forecasts. </p>, <p>By the end of this course, you’ll have explored how to build revenue models, determine realistic forecast assumptions, and learned how historic data is forecast into the future.</p>]",Online,Self Paced,"[<div class=""module-content""><p class=""heading font-h6-mobile"">Orientation module</p><p class=""font-p-default"">Welcome to your Online Campus</p></div>, <div class=""module-content""><p class=""heading font-h6-mobile"">Module 1</p><p class=""font-p-default"">Using financial modelling effectively</p></div>, <div class=""module-content""><p class=""heading font-h6-mobile"">Module 2</p><p class=""font-p-default"">Accounting statements</p></div>, <div class=""module-content""><p class=""heading font-h6-mobile"">Module 3</p><p class=""font-p-default"">Building the three statement model</p></div>, <div class=""module-content""><p class=""heading font-h6-mobile"">Module 4</p><p class=""font-p-default"">Forecasting the three statement model</p></div>, <div class=""module-content""><p class=""heading font-h6-mobile"">Module 5</p><p class=""font-p-default"">Sensitivity and scenario analysis</p></div>, <div class=""module-content""><p class=""heading font-h6-mobile"">Module 6</p><p class=""font-p-default"">Modelling different types of businesses</p></div>, <div class=""module-content""><p class=""heading font-h6-mobile"">Module 7</p><p class=""font-p-default"">Using financial models for decision-making in business</p></div>, <div class=""module-content""><p class=""heading font-h6-mobile"">Module 8</p><p class=""font-p-default"">Using financial models for valuation</p></div>]","['Highly practical and in-demand financial modelling skills|', 'The ability to augment financial models for a variety of business types|', 'A certificate of completion from Africa’s leading university|', '', '']","Aimed at existing and aspiring financial analysts, this course offers critical thinking opportunities and an objective lens for which to understand the financial characteristics and interpretations of businesses| With the ability to calculate, forecast, or estimate financial numbers, you’ll hone the quantitative skills needed to excel in this field|",Francois Toerien,"Associate Professor, Department of Finance and Tax, UCT",https://www.getsmarter.com/rails/active_storage/representations/eyJfcmFpbHMiOnsibWVzc2FnZSI6IkJBaHBBaDBDIiwiZXhwIjpudWxsLCJwdXIiOiJibG9iX2lkIn19--e49f2d2e6fd28f7365883627a9262fc7e05201d1/eyJfcmFpbHMiOnsibWVzc2FnZSI6IkJBaDdCam9MY21WemFYcGxTU0lNTVRFd2VERXhNQVk2QmtWVSIsImV4cCI6bnVsbCwicHVyIjoidmFyaWF0aW9uIn19--e8e4d52386516ed9566f111cb5206b7b0185063d/university_of_cape_town_basics_of_financial_management_course_convenor_francois_toerien.jpg,,,,,,8,weeks,8–10 ,2021-10-11T00:00:00,2021-10-05T00:00:00,English,"Develop your understanding of financial forecasting, corporate valuation, and market analysis in preparation for a career in asset management.","Mobile,Desktop,Tablet",Paid,USD,973,"You can pay your course fees before the course starts, or you may opt for a split payment plan on courses that are nine weeks and shorter. For courses 10 weeks and longer, there is a three-part payment plan available.",University of Cape Town,https://www.getsmarter.com/products/uct-financial-modelling-and-analysis-online-short-course
Cost and Management Accounting,Course,"[<p><p><strong>Duration:</strong> 8 weeks (excluding orientation)<br/></p><p>In a highly competitive corporate environment, more managers and business owners are seeking to streamline processes and optimise the use of resources. Those working in cost and management accounting roles are responsible for providing information that can guide economical decision-making, and play an important part in maximising profit by controlling financial wastage.</p><br/>The University of Cape Town (UCT) Cost and Management Accounting online short course introduces you to the core principles of this function and covers a range of central concepts, such as job costing, process costing, absorption costing, and variable costing. You’ll discover how to use costings to make informed management decisions, and learn to perform a cost-volume-profit (CVP) analysis and manage funds through budgets.</p>, <p><strong>Duration:</strong> 8 weeks (excluding orientation)<br/></p>, <p>In a highly competitive corporate environment, more managers and business owners are seeking to streamline processes and optimise the use of resources. Those working in cost and management accounting roles are responsible for providing information that can guide economical decision-making, and play an important part in maximising profit by controlling financial wastage.</p>]",Online,Self Paced,"[<div class=""module-content""><p class=""heading font-h6-mobile"">Orientation module</p><p class=""font-p-default"">Welcome to your Online Campus</p></div>, <div class=""module-content""><p class=""heading font-h6-mobile"">Module 1</p><p class=""font-p-default"">Introduction to cost and management accounting</p></div>, <div class=""module-content""><p class=""heading font-h6-mobile"">Module 2</p><p class=""font-p-default"">Absorption and variable costing</p></div>, <div class=""module-content""><p class=""heading font-h6-mobile"">Module 3</p><p class=""font-p-default"">Cost-volume-profit analysis</p></div>, <div class=""module-content""><p class=""heading font-h6-mobile"">Module 4</p><p class=""font-p-default"">Budgeting</p></div>, <div class=""module-content""><p class=""heading font-h6-mobile"">Module 5</p><p class=""font-p-default"">Inventory management</p></div>, <div class=""module-content""><p class=""heading font-h6-mobile"">Module 6</p><p class=""font-p-default"">Costing systems</p></div>, <div class=""module-content""><p class=""heading font-h6-mobile"">Module 7</p><p class=""font-p-default"">Standard costing</p></div>, <div class=""module-content""><p class=""heading font-h6-mobile"">Module 8</p><p class=""font-p-default"">The evaluation of business decisions</p></div>]","['The ability to estimate and report on business costs, and compile reliable budgets for products|', 'An understanding of how to cut costs to maximise profits|', 'The skills to analyse financial information and apply insights to set goals and improve resource management|', 'Sound cost management knowledge you can draw on to make critical business decisions|', '']","This course is designed for finance and accounting professionals looking to refresh their knowledge and gain specific skills in the field of cost and management accounting| It’s also aimed at managers who want to improve their ability to make sound decisions based on financial insights, and business owners and entrepreneurs who need knowledge of costing techniques and systems|
",Richard Mellon,"Professor of Financial Economics, Saïd Business School, University of Oxford",https://www.getsmarter.com/rails/active_storage/representations/eyJfcmFpbHMiOnsibWVzc2FnZSI6IkJBaHBBclVCIiwiZXhwIjpudWxsLCJwdXIiOiJibG9iX2lkIn19--6b4017048ed8c7bb15e897b35e0191f19224efb0/eyJfcmFpbHMiOnsibWVzc2FnZSI6IkJBaDdCam9MY21WemFYcGxTU0lNTVRFd2VERXhNQVk2QmtWVSIsImV4cCI6bnVsbCwicHVyIjoidmFyaWF0aW9uIn19--e8e4d52386516ed9566f111cb5206b7b0185063d/university_of_cape_town_cost_and_management_accounting_course_convenor_richard_mellon.jpg,,,,,,8,weeks,7–10 ,2021-09-20T00:00:00,2021-09-14T00:00:00,English,Learn how to apply costing techniques and generate financial insights to inform key business decisions.,"Mobile,Desktop,Tablet",Paid,USD,693,"You can pay your course fees before the course starts, or you may opt for a split payment plan on courses that are nine weeks and shorter. For courses 10 weeks and longer, there is a three-part payment plan available.",University of Cape Town,https://www.getsmarter.com/products/uct-cost-and-management-accounting-online-short-course
