title,learn_type,description,delivery_method,instruction_type,content,what_will_learn,target_students,instructor|1|name,instructor|1|designation,instructor|1|instructor_image,instructor|2|name,instructor|2|designation,instructor|2|instructor_image,review|1|reviewer_name,review|1|review,total_duration,total_duration_unit,recommended_effort_per_week,batch|1|batch_start_date,enrollment_end_date,languages,short_description,accessibilities,pricing_type,currency,regular_price,additional_pricing_details,institute,partner_course_url
Sustainable Finance,Course,"[<p><p><strong>Duration</strong>: 8 weeks (excluding orientation)</p><p>In today’s business landscape, it’s no longer sufficient for organisations to simply acknowledge global sustainability challenges like climate change, resource depletion, and inequality – they’re expected to lead the way through them.</p><p>The Sustainable Finance online short course from the University of Cambridge Institute for Sustainability Leadership (CISL) offers the tools and insights needed to develop financial strategies that create value for society and invest in a sustainable future.</p><p>Over eight weeks, you’ll learn about the pressures, trends, and opportunities in the current financial system. You’ll also investigate the strategic business implications of social and environmental challenges, and discover how best to plan for the future through sustainable initiatives like impact investing, the integration of Environmental, Social, and Governance (ESG) investing, and positive screening.</p><p>With expert guidance from CISL faculty, you’ll gain the skills to implement sustainable finance solutions in your own context, and better understand how these strategies can positively impact your organisation’s long-term value gain. This course will also give you new perspectives on how businesses, banks, and insurers are shifting to more sustainable business models that offer positive returns for both their clients and society.</p></p>, <p><strong>Duration</strong>: 8 weeks (excluding orientation)</p>, <p>In today’s business landscape, it’s no longer sufficient for organisations to simply acknowledge global sustainability challenges like climate change, resource depletion, and inequality – they’re expected to lead the way through them.</p>, <p>The Sustainable Finance online short course from the University of Cambridge Institute for Sustainability Leadership (CISL) offers the tools and insights needed to develop financial strategies that create value for society and invest in a sustainable future.</p>, <p>Over eight weeks, you’ll learn about the pressures, trends, and opportunities in the current financial system. You’ll also investigate the strategic business implications of social and environmental challenges, and discover how best to plan for the future through sustainable initiatives like impact investing, the integration of Environmental, Social, and Governance (ESG) investing, and positive screening.</p>, <p>With expert guidance from CISL faculty, you’ll gain the skills to implement sustainable finance solutions in your own context, and better understand how these strategies can positively impact your organisation’s long-term value gain. This course will also give you new perspectives on how businesses, banks, and insurers are shifting to more sustainable business models that offer positive returns for both their clients and society.</p>]",Online,Self Paced,"[<div class=""module-content""><p class=""heading font-h6-mobile"">Orientation module</p><p class=""font-p-default"">Welcome to your Online Campus</p></div>, <div class=""module-content""><p class=""heading font-h6-mobile"">Module 1</p><p class=""font-p-default"">Introduction to sustainable finance</p></div>, <div class=""module-content""><p class=""heading font-h6-mobile"">Module 2</p><p class=""font-p-default"">Steering capital for a sustainable future</p></div>, <div class=""module-content""><p class=""heading font-h6-mobile"">Module 3</p><p class=""font-p-default"">Strategies that work for sustainable finance</p></div>, <div class=""module-content""><p class=""heading font-h6-mobile"">Module 4</p><p class=""font-p-default"">Rewiring risk and return</p></div>, <div class=""module-content""><p class=""heading font-h6-mobile"">Module 5</p><p class=""font-p-default"">Sustainable finance solutions</p></div>, <div class=""module-content""><p class=""heading font-h6-mobile"">Module 6</p><p class=""font-p-default"">The role of the public sector in sustainable finance</p></div>, <div class=""module-content""><p class=""heading font-h6-mobile"">Module 7</p><p class=""font-p-default"">Trends, disruption, innovation, and sustainable finance</p></div>, <div class=""module-content""><p class=""heading font-h6-mobile"">Module 8</p><p class=""font-p-default"">Creating impact</p></div>]","['Insight into the sustainability challenges facing business and financial systems|', 'An understanding of how sustainability is rewiring financial systems to benefit society and business|', 'Tools and frameworks to respond to financial risks posed by sustainability issues, and the insights needed to create long-term value|', 'The skills to influence your organisation’s success by implementing green finance strategies and steering capital for a sustainable future|', 'A personal action plan to implement sustainable finance in your sphere of influence|']","This course will be relevant to anyone interested in harnessing sustainable finance initiatives to bring about positive change – both professionals currently working in the finance sector, such as financial service providers, financial advisors, sustainability consultants, and fund managers, as well as those outside the industry seeking a more practical understanding of how sustainable finance can strategically drive long-term business returns (including managers, marketing specialists, investors, and those who work with NGOs)| Policymakers in the public sector will also benefit from this finance course, as will anyone with an interest in integrating environmental considerations into development planning and finance| Similarly, this course is ideal for those looking to understand how both mindsets and the broader financial system are evolving in response to social and environmental pressures and, ultimately, how this can be financially and environmentally beneficial|This course is certified by the United Kingdom CPD Certification Service, and may be applicable to individuals who are members of, or are associated with, UK-based professional bodies| The course has an estimated 60 hours of learning| Note: should you wish to claim CPD activity, the onus is upon you| CISL and GetSmarter accept no responsibility, and cannot be held responsible, for the claiming or validation of hours or points|",Alice Chapple,Subject Matter Expert,https://www.getsmarter.com/rails/active_storage/representations/eyJfcmFpbHMiOnsibWVzc2FnZSI6IkJBaHBBbDBQIiwiZXhwIjpudWxsLCJwdXIiOiJibG9iX2lkIn19--bc5fd3516af8006025a4e78599b3fe8a86784e99/eyJfcmFpbHMiOnsibWVzc2FnZSI6IkJBaDdCam9MY21WemFYcGxTU0lNTVRFd2VERXhNQVk2QmtWVSIsImV4cCI6bnVsbCwicHVyIjoidmFyaWF0aW9uIn19--e8e4d52386516ed9566f111cb5206b7b0185063d/%5BCAM-SUF%5D_headshot_Alice-Chapple.png,Martin Roberts,"Director of Digital Learning, University of Cambridge Institute for Sustainability Leadership",https://www.getsmarter.com/rails/active_storage/representations/eyJfcmFpbHMiOnsibWVzc2FnZSI6IkJBaHBBbFFCIiwiZXhwIjpudWxsLCJwdXIiOiJibG9iX2lkIn19--b27edbef0528dda199ed5eb0cfb34eee2fe27184/eyJfcmFpbHMiOnsibWVzc2FnZSI6IkJBaDdCam9MY21WemFYcGxTU0lNTVRFd2VERXhNQVk2QmtWVSIsImV4cCI6bnVsbCwicHVyIjoidmFyaWF0aW9uIn19--e8e4d52386516ed9566f111cb5206b7b0185063d/university_of_cambridge_business_sustainability_management_course_convenor_martin_roberts.jpg,Alberto Granados,"Excellent content, really insightful, and top quality. It was an excellent opportunity to meet global professionals with a broad experience. World-class support from the online team. [A] very good experience.",8,weeks,6–8 ,2021-10-13T00:00:00,2021-10-05T00:00:00,English,Explore the benefits of sustainable finance systems and develop a plan for creating a sustainable economy with long-term value returns.,"Mobile,Desktop,Tablet",Paid,USD,"3,014","You can pay your course fees before the course starts, or you may opt for a split payment plan on courses that are nine weeks and shorter. For courses 10 weeks and longer, there is a three-part payment plan available.",University of Cambridge,https://www.getsmarter.com/products/cambridge-sustainable-finance-online-short-course
Pricing: Using Data to Improve Pricing Performance,Course,"[<p><p><strong>Duration</strong>: 6 weeks (excluding orientation)<br/></p><p>An effective pricing strategy offers your organization a key advantage over your competitors. Understanding how to implement one is a valuable tool in an increasingly interconnected business landscape with a growing number of parties wanting their share of the market.</p><p>The Pricing: Using Data to Improve Pricing Performance online short course from MIT Sloan School of Management equips you with the skills and understanding to accurately and effectively price new or existing products or services, with a focus on providing economic value to the customer. In the course, you’ll learn to adopt a data-driven approach that explores regression analysis, survey techniques, and conjoint analysis. You’ll also discover the limitations of historical data in the context of pricing, and develop techniques and guidelines that will enable you to execute a successful pricing strategy for a variety of products and industries, enabling you to have a measurable impact on your organization.<br/></p></p>, <p><strong>Duration</strong>: 6 weeks (excluding orientation)<br/></p>, <p>An effective pricing strategy offers your organization a key advantage over your competitors. Understanding how to implement one is a valuable tool in an increasingly interconnected business landscape with a growing number of parties wanting their share of the market.</p>, <p>The Pricing: Using Data to Improve Pricing Performance online short course from MIT Sloan School of Management equips you with the skills and understanding to accurately and effectively price new or existing products or services, with a focus on providing economic value to the customer. In the course, you’ll learn to adopt a data-driven approach that explores regression analysis, survey techniques, and conjoint analysis. You’ll also discover the limitations of historical data in the context of pricing, and develop techniques and guidelines that will enable you to execute a successful pricing strategy for a variety of products and industries, enabling you to have a measurable impact on your organization.<br/></p>]",Online,Self Paced,"[<div class=""module-content""><p class=""heading font-h6-mobile"">Orientation module</p><p class=""font-p-default"">Welcome to your Online Campus</p></div>, <div class=""module-content""><p class=""heading font-h6-mobile"">Module 1</p><p class=""font-p-default"">Value-based pricing: Determining prices based on economic value to the customer</p></div>, <div class=""module-content""><p class=""heading font-h6-mobile"">Module 2</p><p class=""font-p-default"">Survey design: Measuring customer perception of product value</p></div>, <div class=""module-content""><p class=""heading font-h6-mobile"">Module 3</p><p class=""font-p-default"">The role of price elasticity in improving pricing</p></div>, <div class=""module-content""><p class=""heading font-h6-mobile"">Module 4</p><p class=""font-p-default"">Analyzing the right data to drive better pricing decisions</p></div>, <div class=""module-content""><p class=""heading font-h6-mobile"">Module 5</p><p class=""font-p-default"">Implications of customer segmentation and product differentiation for pricing</p></div>, <div class=""module-content""><p class=""heading font-h6-mobile"">Module 6</p><p class=""font-p-default"">Creating a pricing strategy: Consolidating various pricing techniques</p></div>]","['An analytical toolkit to develop a successful pricing strategy, with insight into the opportunities and limitations of data, to help you reinvent your approach to pricing|', 'The understanding to assign economic value to a product or service based on customer demand, equipping you to improve financial performance in your business|', 'Decision-making skills for pricing products across a range of industries, teaching you to account for multiple variables in a complex pricing market|', '', '']","Pricing is a timeless and adaptable skill that can be used to improve business performance in a wide range of industries| Whether you are introducing new products, facing price competition, or looking to improve the value provided to customers, this course will provide practical skills for any professional who plays a hands-on role within pricing strategy| CEOs and entrepreneurs, finance and sales executives, analysts, and product managers looking to grow their business and increase sales through better pricing will gain the ability to have a measurable impact on their organizations|",Catherine Tucker,"Sloan Distinguished Professor of Management and Professor of Marketing, MIT Sloan",https://www.getsmarter.com/rails/active_storage/representations/eyJfcmFpbHMiOnsibWVzc2FnZSI6IkJBaHBXQT09IiwiZXhwIjpudWxsLCJwdXIiOiJibG9iX2lkIn19--037731cd36235a7418ced92c77fff2b13ae5c830/eyJfcmFpbHMiOnsibWVzc2FnZSI6IkJBaDdCam9MY21WemFYcGxTU0lNTVRFd2VERXhNQVk2QmtWVSIsImV4cCI6bnVsbCwicHVyIjoidmFyaWF0aW9uIn19--e8e4d52386516ed9566f111cb5206b7b0185063d/mit_sloan_pricing_using_data_to_improve_pricing_performance_course_convenor_catherine_tucker.jpg,Shaun Parsons,"Associate Professor, College of Accounting, UCT",https://www.getsmarter.com/rails/active_storage/representations/eyJfcmFpbHMiOnsibWVzc2FnZSI6IkJBaHBBcFlEIiwiZXhwIjpudWxsLCJwdXIiOiJibG9iX2lkIn19--f1d4d68879ecd68dda8a1d59a4732ebec5d41a03/eyJfcmFpbHMiOnsibWVzc2FnZSI6IkJBaDdCam9MY21WemFYcGxTU0lNTVRFd2VERXhNQVk2QmtWVSIsImV4cCI6bnVsbCwicHVyIjoidmFyaWF0aW9uIn19--e8e4d52386516ed9566f111cb5206b7b0185063d/university_of_cape_town_payroll_and_tax_administration_course_convenor_shaun_parsons.jpg,Viola Yangzi QIU,This programme is value for money and the time management is reasonable. It provides an overview of algorithmic trading and also direct experience shared by industry professionals.,6,weeks,6–8 ,2021-09-29T00:00:00,2021-09-21T00:00:00,English,Develop the techniques and guidelines to execute a successful pricing strategy.,"Mobile,Desktop,Tablet",Paid,USD,"2,800","You can pay your course fees before the course starts, or you may opt for a split payment plan on courses that are nine weeks and shorter. For courses 10 weeks and longer, there is a three-part payment plan available.",MIT Sloan School of Management,https://www.getsmarter.com/products/mit-sloan-pricing-using-data-to-improve-pricing-performance-online-program
Oxford Entrepreneurship: Venture Finance Programme,Course,"[<p><p><strong>Duration: </strong>8 weeks (excluding orientation)</p><p>A lack of funding, not knowing how to spend it effectively, and not adequately balancing the risks of venture financing are just some of the reasons that startups fail. Gaining an understanding of venture finance could enable you to secure funding for a business and help it to realise its potential, whether as an investment or your own entrepreneurial venture. </p><p>The Oxford Entrepreneurship: Venture Finance Programme aims to provide you with this understanding through an exploration of the nature and dynamics of venture finance. Over the course of eight weeks, you’ll embark on an online learning journey that covers various investment avenues, including venture capital funds and crowdfunding. Led by Saïd Business School, University of Oxford faculty and industry experts, you’ll use a ‘two-hat’ approach to investigate venture finance from the perspective of both an entrepreneur and an investor. This programme also explores how to navigate the funding process, from the initial fundraising to the final exit strategy.  </p></p>, <p><strong>Duration: </strong>8 weeks (excluding orientation)</p>, <p>A lack of funding, not knowing how to spend it effectively, and not adequately balancing the risks of venture financing are just some of the reasons that startups fail. Gaining an understanding of venture finance could enable you to secure funding for a business and help it to realise its potential, whether as an investment or your own entrepreneurial venture. </p>, <p>The Oxford Entrepreneurship: Venture Finance Programme aims to provide you with this understanding through an exploration of the nature and dynamics of venture finance. Over the course of eight weeks, you’ll embark on an online learning journey that covers various investment avenues, including venture capital funds and crowdfunding. Led by Saïd Business School, University of Oxford faculty and industry experts, you’ll use a ‘two-hat’ approach to investigate venture finance from the perspective of both an entrepreneur and an investor. This programme also explores how to navigate the funding process, from the initial fundraising to the final exit strategy.  </p>]",Online,Self Paced,"[<div class=""module-content""><p class=""heading font-h6-mobile"">Orientation module</p><p class=""font-p-default"">Welcome to your Online Campus</p></div>, <div class=""module-content""><p class=""heading font-h6-mobile"">Module 1</p><p class=""font-p-default"">The investment cycle</p></div>, <div class=""module-content""><p class=""heading font-h6-mobile"">Module 2</p><p class=""font-p-default"">Investor types</p></div>, <div class=""module-content""><p class=""heading font-h6-mobile"">Module 3</p><p class=""font-p-default"">Fundraising</p></div>, <div class=""module-content""><p class=""heading font-h6-mobile"">Module 4</p><p class=""font-p-default"">Valuation: Art or science?</p></div>, <div class=""module-content""><p class=""heading font-h6-mobile"">Module 5</p><p class=""font-p-default"">Venture capitalists</p></div>, <div class=""module-content""><p class=""heading font-h6-mobile"">Module 6</p><p class=""font-p-default"">Negotiating deals</p></div>, <div class=""module-content""><p class=""heading font-h6-mobile"">Module 7</p><p class=""font-p-default"">Scaling up and scaling down</p></div>, <div class=""module-content""><p class=""heading font-h6-mobile"">Module 8</p><p class=""font-p-default"">Cashing in on success</p></div>]","['A comprehensive understanding of how new ventures are financed from an entrepreneur and investor perspective, and the types of investments available|', 'Practical skills to navigate the funding process, assess project valuations, and determine financial projections for a fundraising pitch deck|', 'An opportunity to network with and learn alongside a global cohort of like-minded entrepreneurs, investors, and venture capitalists|', 'Guidance from leading industry experts and Oxford Saïd faculty, and access to the official Oxford Executive Education Alumni group on LinkedIn|', '']","The coursework of this online programme is aimed at those who are planning, or currently involved in, a new business and would like to gain a comprehensive understanding of venture capital financing| It’s also ideal for current or aspiring investors wanting to break into the industry| Investors will learn to analyse different funding opportunities, while entrepreneurs will learn how to effectively present and prepare their venture as they go about the fundraising process| Basic financial knowledge or business acumen is recommended| This Oxford Entrepreneurship: Venture Finance Programme is certified by the United Kingdom CPD Certification Service, and may be applicable to individuals who are members of, or are associated with, UK-based professional bodies| The programme has an estimated 80 hours of learning|Note: should you wish to claim CPD activity, the onus is on you| Saïd Business School and GetSmarter accept no responsibility, and cannot be held responsible, for the claiming or validation of hours or points|",Dr Thomas Hellmann,"DP World Professor of Entrepreneurship and Innovation, Saïd Business School, University of Oxford",https://www.getsmarter.com/rails/active_storage/representations/eyJfcmFpbHMiOnsibWVzc2FnZSI6IkJBaHBBc2NGIiwiZXhwIjpudWxsLCJwdXIiOiJibG9iX2lkIn19--1eaba085f361d5dc9c9afbbb48310771294f8ee7/eyJfcmFpbHMiOnsibWVzc2FnZSI6IkJBaDdCam9MY21WemFYcGxTU0lNTVRFd2VERXhNQVk2QmtWVSIsImV4cCI6bnVsbCwicHVyIjoidmFyaWF0aW9uIn19--e8e4d52386516ed9566f111cb5206b7b0185063d/oxford_sa%C3%AFd_private_markets_investments_programme_course_convenor_thomas_hellmann.jpg,Jacqueline Dean,"Lecturer in the College of Accounting, UCT",https://www.getsmarter.com/rails/active_storage/representations/eyJfcmFpbHMiOnsibWVzc2FnZSI6IkJBaHBBcllCIiwiZXhwIjpudWxsLCJwdXIiOiJibG9iX2lkIn19--50f02494826d29594b5b6e880d6a90a7842af369/eyJfcmFpbHMiOnsibWVzc2FnZSI6IkJBaDdCam9MY21WemFYcGxTU0lNTVRFd2VERXhNQVk2QmtWVSIsImV4cCI6bnVsbCwicHVyIjoidmFyaWF0aW9uIn19--e8e4d52386516ed9566f111cb5206b7b0185063d/university_of_cape_town_cost_and_management_accounting_course_convenor_jacqueline_dean.jpg,Marianne Anderson,"Tax legislation continues to evolve over time, and it is easy to get left behind. It is therefore very important to stay in touch with changes. In my opinion, this course was an easy and hassle-free way to achieve just that.",8,weeks,7–10 ,2021-09-22T00:00:00,2021-09-14T00:00:00,English,Gain a holistic understanding of venture finance and make informed decisions for capital funding and investment.,"Mobile,Desktop,Tablet",Paid,USD,"3,014","You can pay your course fees before the course starts, or you may opt for a split payment plan on courses that are nine weeks and shorter. For courses 10 weeks and longer, there is a three-part payment plan available.","Saïd Business School, University of Oxford",https://www.getsmarter.com/products/oxford-entrepreneurship-venture-finance-programme
